Sheet: Instructions
A1: Helper file for bulk generation of issues on Drupal.org
A3: Summary and Background
A4: This spreadsheet allows you generate (mostly automatically) issues for translating the User Guide to a new language. The concept is based on the fact that Drupal.org understands specially formatted URLs with appropriate GET-parameters in them and pre-fills issue forms with the received values. So, this spreadsheet generates a list of bookmarks, which you can add to your browser and then use its Open all bookmarks in new tabs” feature. Then, your task will be to stepping through all the tabs (Ctrl+Tab) and click “Submit” buttons to submit the issues.
A6: Steps
A7: 1. Make a copy of this file somewhere on your computer, and sign in to Drupal.org if you are not already signed in.
A9: 2. Fill out column “B” on the second sheet of this file called “Input”, with values appropriate to your language.
A11: 3. On the third sheet called “Result”, put the Topic titles in column T, and Chapter titles in column AB. Both should be translated into your language. Note that there is a file called “bare_topic_names.csv” in the scripts directory of the User Guide project that has the topic/chapter names in English.
A13: 4. Once you have filled out the empty spaces on both sheets, use the spreadsheet editor's “Export” or “Save as...” feature to create a plain-text copy of the “Result” sheet. Use file name “bookmarks.csv”. Use a semicolon ( ; ) as the separator character when you export (usually this will be an option when you try to save/export to Comma-Separated Values (CSV) or Tab-Separated Values (TSV) file format, depending on what software application you are using to edit the spreadsheet), and make sure not to quote the output or use a text delimeter character.
A15: 5. Change the exported filename to bookmarks.html. Open up the bookmarks.html in any plain-text editor of your choice. Search & Replace for the separator character (;), and remove all of them.
A17: 6. Go to your web browser's bookmark manager window, search for “Import bookmarks from file” or similar feature, and process the freshly created bookmarks.html file.
A19: 7. Successful import will result a new bookmarks folder with the name “Drupal 8 User Guide - Issue generation links” containing bookmarks numbered from 1. to 101.
A21: 8. Depending on the power of your computer's processor and memory select all or a subset of the bookmarks. Right-click and select “Open bookmarks in new tabs”.
A23: 9. Step through on the newly opened tabs, review the issue settings, and if you find everything okay, click the “Submit” button on each tab to submit the issues.

Sheet: Input
A1: Project code: | B1: user_guide
A2: Issue Category ID: | B2: 2
A3: Language code: | B3: HU
A4: Component name: | B4: of:=CONCATENATE([.B3];" translation") -> HU translation
A5: Branch name: | B5: 8.x-2.x-dev
A6: Your translation of: “Translate this source file:” | B6: Forrásfájl lefordítása magyarra:
A7: Your translation of: “The task is to translate the following chapter” | B7: Az alábbi fejezet lefordítása angolról magyarra
A8: Your translation of: “in English” | B8: angolul
A9: Your translation of: “Topic” | B9: Téma
A10: Your translation of: “Chapter” | B10: Fejezet
A11: Your translation of: “Filename” | B11: Fájlnév
A12: Your translation of: “Find all instructions in this link” | B12: Minden szükséges tudnivalót ebben a leírásban találsz
A13: Link to the Contributor Guide with instructions for your translators: | B13: https://userguide_new-drupal.dev.devdrupal.org/guidelines/instructions.html#practicalities-translating

Sheet: Result
A1: <!DOCTYPE NETSCAPE-Bookmark-file-1> <!-- This is an automatically generated file. It will be read and overwritten. DO NOT EDIT! --> <TITLE>Bookmarks</TITLE> <DL><p> <DT><H3>Drupal 8 User Guide - Issue generation links</H3> <DL><p>
A2: <DT><A LAST_CHARSET="UTF-8" HREF="https://www.drupal.org/node/add/project-issue/ | B2: of:=[$Input.B1] -> user_guide | C2: ?categories= | D2: of:=[$Input.B2] -> 2 | E2: &component= | F2: of:=[$Input.B4] -> HU translation | G2: &version= | H2: of:=[$Input.B5] -> 8.x-2.x-dev | I2: &title=[ | J2: of:=[$Input.B3] -> HU | K2: ]%20 | L2: of:=[$Input.B6] -> Forrásfájl lefordítása magyarra: | M2: %20 | N2: guide.txt | O2: &body= | P2: of:=[$Input.B$7] -> Az alábbi fejezet lefordítása angolról magyarra | Q2: %3A%0A- | R2: of:=[$Input.B$9] -> Téma | S2: %3A%20 | T2: Overall titles for the User Guide and chapters | U2: %20( | V2: of:=[$Input.B8] -> angolul | W2: %3A%20 | X2: Overall titles for the User Guide and chapters | Y2: )%0A-%20 | Z2: of:=[$Input.B$10] -> Fejezet | AA2: %3A%20 | AB2: All | AC2: %20( | AD2: of:=[$Input.B8] -> angolul | AE2: %3A%20 | AF2: All | AG2: )%0A-%20 | AH2: of:=[$Input.B11] -> Fájlnév | AI2: %3A%20 | AJ2: guide.txt | AK2: %0A%0A | AL2: of:=[$Input.B12] -> Minden szükséges tudnivalót ebben a leírásban találsz | AM2: %3A%20 | AN2: of:=[$Input.B13] -> https://userguide_new-drupal.dev.devdrupal.org/guidelines/instructions.html#practicalities-translating | AO2: "> | AP2: 1 | AQ2: . | AR2: guide.txt | AS2: </A>
A3: of:=[.A$2] -> <DT><A LAST_CHARSET="UTF-8" HREF="https://www.drupal.org/node/add/project-issue/ | B3: of:=[.B$2] -> user_guide | C3: of:=[.C$2] -> ?categories= | D3: of:=[.D$2] -> 2 | E3: of:=[.E$2] -> &component= | F3: of:=[.F$2] -> HU translation | G3: of:=[.G$2] -> &version= | H3: of:=[.H$2] -> 8.x-2.x-dev | I3: of:=[.I$2] -> &title=[ | J3: of:=[.J$2] -> HU | K3: of:=[.K$2] -> ]%20 | L3: of:=[.L$2] -> Forrásfájl lefordítása magyarra: | M3: of:=[.M$2] -> %20 | N3: copyright.txt | O3: of:=[.O$2] -> &body= | P3: of:=[.P$2] -> Az alábbi fejezet lefordítása angolról magyarra | Q3: of:=[.Q$2] -> %3A%0A-  | R3: of:=[.R$2] -> Téma | S3: of:=[.S$2] -> %3A%20 | T3: Copyright | U3: of:=[.U$2] -> %20( | V3: of:=[.V$2] -> angolul | W3: of:=[.W$2] -> %3A%20 | X3: Copyright | Y3: of:=[.Y$2] -> )%0A-%20 | Z3: of:=[.Z$2] -> Fejezet | AA3: of:=[.AA$2] -> %3A%20 | AB3: Preface | AC3: of:=[.AC$2] -> %20( | AD3: of:=[.AD$2] -> angolul | AE3: of:=[.AE$2] -> %3A%20 | AF3: Preface | AG3: of:=[.AG$2] -> )%0A-%20 | AH3: of:=[.AH$2] -> Fájlnév | AI3: of:=[.AI$2] -> %3A%20 | AJ3: copyright.txt | AK3: of:=[.AK$2] -> %0A%0A | AL3: of:=[.AL$2] -> Minden szükséges tudnivalót ebben a leírásban találsz | AM3: of:=[.AM$2] -> %3A%20 | AN3: of:=[.AN$2] -> https://userguide_new-drupal.dev.devdrupal.org/guidelines/instructions.html#practicalities-translating | AO3: of:=[.AO$2] -> "> | AP3: 2 | AQ3: of:=[.AQ$2] -> .  | AR3: copyright.txt | AS3: of:=[.AS$2] -> </A>
A4: of:=[.A$2] -> <DT><A LAST_CHARSET="UTF-8" HREF="https://www.drupal.org/node/add/project-issue/ | B4: of:=[.B$2] -> user_guide | C4: of:=[.C$2] -> ?categories= | D4: of:=[.D$2] -> 2 | E4: of:=[.E$2] -> &component= | F4: of:=[.F$2] -> HU translation | G4: of:=[.G$2] -> &version= | H4: of:=[.H$2] -> 8.x-2.x-dev | I4: of:=[.I$2] -> &title=[ | J4: of:=[.J$2] -> HU | K4: of:=[.K$2] -> ]%20 | L4: of:=[.L$2] -> Forrásfájl lefordítása magyarra: | M4: of:=[.M$2] -> %20 | N4: preface-audience.txt | O4: of:=[.O$2] -> &body= | P4: of:=[.P$2] -> Az alábbi fejezet lefordítása angolról magyarra | Q4: of:=[.Q$2] -> %3A%0A-  | R4: of:=[.R$2] -> Téma | S4: of:=[.S$2] -> %3A%20 | T4: Audience and Goal | U4: of:=[.U$2] -> %20( | V4: of:=[.V$2] -> angolul | W4: of:=[.W$2] -> %3A%20 | X4: Audience and Goal | Y4: of:=[.Y$2] -> )%0A-%20 | Z4: of:=[.Z$2] -> Fejezet | AA4: of:=[.AA$2] -> %3A%20 | AB4: Preface | AC4: of:=[.AC$2] -> %20( | AD4: of:=[.AD$2] -> angolul | AE4: of:=[.AE$2] -> %3A%20 | AF4: Preface | AG4: of:=[.AG$2] -> )%0A-%20 | AH4: of:=[.AH$2] -> Fájlnév | AI4: of:=[.AI$2] -> %3A%20 | AJ4: preface-audience.txt | AK4: of:=[.AK$2] -> %0A%0A | AL4: of:=[.AL$2] -> Minden szükséges tudnivalót ebben a leírásban találsz | AM4: of:=[.AM$2] -> %3A%20 | AN4: of:=[.AN$2] -> https://userguide_new-drupal.dev.devdrupal.org/guidelines/instructions.html#practicalities-translating | AO4: of:=[.AO$2] -> "> | AP4: 3 | AQ4: of:=[.AQ$2] -> .  | AR4: preface-audience.txt | AS4: of:=[.AS$2] -> </A>
A5: of:=[.A$2] -> <DT><A LAST_CHARSET="UTF-8" HREF="https://www.drupal.org/node/add/project-issue/ | B5: of:=[.B$2] -> user_guide | C5: of:=[.C$2] -> ?categories= | D5: of:=[.D$2] -> 2 | E5: of:=[.E$2] -> &component= | F5: of:=[.F$2] -> HU translation | G5: of:=[.G$2] -> &version= | H5: of:=[.H$2] -> 8.x-2.x-dev | I5: of:=[.I$2] -> &title=[ | J5: of:=[.J$2] -> HU | K5: of:=[.K$2] -> ]%20 | L5: of:=[.L$2] -> Forrásfájl lefordítása magyarra: | M5: of:=[.M$2] -> %20 | N5: preface-organization.txt | O5: of:=[.O$2] -> &body= | P5: of:=[.P$2] -> Az alábbi fejezet lefordítása angolról magyarra | Q5: of:=[.Q$2] -> %3A%0A-  | R5: of:=[.R$2] -> Téma | S5: of:=[.S$2] -> %3A%20 | T5: Organization | U5: of:=[.U$2] -> %20( | V5: of:=[.V$2] -> angolul | W5: of:=[.W$2] -> %3A%20 | X5: Organization | Y5: of:=[.Y$2] -> )%0A-%20 | Z5: of:=[.Z$2] -> Fejezet | AA5: of:=[.AA$2] -> %3A%20 | AB5: Preface | AC5: of:=[.AC$2] -> %20( | AD5: of:=[.AD$2] -> angolul | AE5: of:=[.AE$2] -> %3A%20 | AF5: Preface | AG5: of:=[.AG$2] -> )%0A-%20 | AH5: of:=[.AH$2] -> Fájlnév | AI5: of:=[.AI$2] -> %3A%20 | AJ5: preface-organization.txt | AK5: of:=[.AK$2] -> %0A%0A | AL5: of:=[.AL$2] -> Minden szükséges tudnivalót ebben a leírásban találsz | AM5: of:=[.AM$2] -> %3A%20 | AN5: of:=[.AN$2] -> https://userguide_new-drupal.dev.devdrupal.org/guidelines/instructions.html#practicalities-translating | AO5: of:=[.AO$2] -> "> | AP5: 4 | AQ5: of:=[.AQ$2] -> .  | AR5: preface-organization.txt | AS5: of:=[.AS$2] -> </A>
A6: of:=[.A$2] -> <DT><A LAST_CHARSET="UTF-8" HREF="https://www.drupal.org/node/add/project-issue/ | B6: of:=[.B$2] -> user_guide | C6: of:=[.C$2] -> ?categories= | D6: of:=[.D$2] -> 2 | E6: of:=[.E$2] -> &component= | F6: of:=[.F$2] -> HU translation | G6: of:=[.G$2] -> &version= | H6: of:=[.H$2] -> 8.x-2.x-dev | I6: of:=[.I$2] -> &title=[ | J6: of:=[.J$2] -> HU | K6: of:=[.K$2] -> ]%20 | L6: of:=[.L$2] -> Forrásfájl lefordítása magyarra: | M6: of:=[.M$2] -> %20 | N6: preface-reporting.txt | O6: of:=[.O$2] -> &body= | P6: of:=[.P$2] -> Az alábbi fejezet lefordítása angolról magyarra | Q6: of:=[.Q$2] -> %3A%0A-  | R6: of:=[.R$2] -> Téma | S6: of:=[.S$2] -> %3A%20 | T6: Reporting Problems | U6: of:=[.U$2] -> %20( | V6: of:=[.V$2] -> angolul | W6: of:=[.W$2] -> %3A%20 | X6: Reporting Problems | Y6: of:=[.Y$2] -> )%0A-%20 | Z6: of:=[.Z$2] -> Fejezet | AA6: of:=[.AA$2] -> %3A%20 | AB6: Preface | AC6: of:=[.AC$2] -> %20( | AD6: of:=[.AD$2] -> angolul | AE6: of:=[.AE$2] -> %3A%20 | AF6: Preface | AG6: of:=[.AG$2] -> )%0A-%20 | AH6: of:=[.AH$2] -> Fájlnév | AI6: of:=[.AI$2] -> %3A%20 | AJ6: preface-reporting.txt | AK6: of:=[.AK$2] -> %0A%0A | AL6: of:=[.AL$2] -> Minden szükséges tudnivalót ebben a leírásban találsz | AM6: of:=[.AM$2] -> %3A%20 | AN6: of:=[.AN$2] -> https://userguide_new-drupal.dev.devdrupal.org/guidelines/instructions.html#practicalities-translating | AO6: of:=[.AO$2] -> "> | AP6: 5 | AQ6: of:=[.AQ$2] -> .  | AR6: preface-reporting.txt | AS6: of:=[.AS$2] -> </A>
A7: of:=[.A$2] -> <DT><A LAST_CHARSET="UTF-8" HREF="https://www.drupal.org/node/add/project-issue/ | B7: of:=[.B$2] -> user_guide | C7: of:=[.C$2] -> ?categories= | D7: of:=[.D$2] -> 2 | E7: of:=[.E$2] -> &component= | F7: of:=[.F$2] -> HU translation | G7: of:=[.G$2] -> &version= | H7: of:=[.H$2] -> 8.x-2.x-dev | I7: of:=[.I$2] -> &title=[ | J7: of:=[.J$2] -> HU | K7: of:=[.K$2] -> ]%20 | L7: of:=[.L$2] -> Forrásfájl lefordítása magyarra: | M7: of:=[.M$2] -> %20 | N7: preface-conventions.txt | O7: of:=[.O$2] -> &body= | P7: of:=[.P$2] -> Az alábbi fejezet lefordítása angolról magyarra | Q7: of:=[.Q$2] -> %3A%0A-  | R7: of:=[.R$2] -> Téma | S7: of:=[.S$2] -> %3A%20 | T7: Conventions of the Guide | U7: of:=[.U$2] -> %20( | V7: of:=[.V$2] -> angolul | W7: of:=[.W$2] -> %3A%20 | X7: Conventions of the Guide | Y7: of:=[.Y$2] -> )%0A-%20 | Z7: of:=[.Z$2] -> Fejezet | AA7: of:=[.AA$2] -> %3A%20 | AB7: Preface | AC7: of:=[.AC$2] -> %20( | AD7: of:=[.AD$2] -> angolul | AE7: of:=[.AE$2] -> %3A%20 | AF7: Preface | AG7: of:=[.AG$2] -> )%0A-%20 | AH7: of:=[.AH$2] -> Fájlnév | AI7: of:=[.AI$2] -> %3A%20 | AJ7: preface-conventions.txt | AK7: of:=[.AK$2] -> %0A%0A | AL7: of:=[.AL$2] -> Minden szükséges tudnivalót ebben a leírásban találsz | AM7: of:=[.AM$2] -> %3A%20 | AN7: of:=[.AN$2] -> https://userguide_new-drupal.dev.devdrupal.org/guidelines/instructions.html#practicalities-translating | AO7: of:=[.AO$2] -> "> | AP7: 6 | AQ7: of:=[.AQ$2] -> .  | AR7: preface-conventions.txt | AS7: of:=[.AS$2] -> </A>
A8: of:=[.A$2] -> <DT><A LAST_CHARSET="UTF-8" HREF="https://www.drupal.org/node/add/project-issue/ | B8: of:=[.B$2] -> user_guide | C8: of:=[.C$2] -> ?categories= | D8: of:=[.D$2] -> 2 | E8: of:=[.E$2] -> &component= | F8: of:=[.F$2] -> HU translation | G8: of:=[.G$2] -> &version= | H8: of:=[.H$2] -> 8.x-2.x-dev | I8: of:=[.I$2] -> &title=[ | J8: of:=[.J$2] -> HU | K8: of:=[.K$2] -> ]%20 | L8: of:=[.L$2] -> Forrásfájl lefordítása magyarra: | M8: of:=[.M$2] -> %20 | N8: preface-scenario.txt | O8: of:=[.O$2] -> &body= | P8: of:=[.P$2] -> Az alábbi fejezet lefordítása angolról magyarra | Q8: of:=[.Q$2] -> %3A%0A-  | R8: of:=[.R$2] -> Téma | S8: of:=[.S$2] -> %3A%20 | T8: Guiding Scenario | U8: of:=[.U$2] -> %20( | V8: of:=[.V$2] -> angolul | W8: of:=[.W$2] -> %3A%20 | X8: Guiding Scenario | Y8: of:=[.Y$2] -> )%0A-%20 | Z8: of:=[.Z$2] -> Fejezet | AA8: of:=[.AA$2] -> %3A%20 | AB8: Preface | AC8: of:=[.AC$2] -> %20( | AD8: of:=[.AD$2] -> angolul | AE8: of:=[.AE$2] -> %3A%20 | AF8: Preface | AG8: of:=[.AG$2] -> )%0A-%20 | AH8: of:=[.AH$2] -> Fájlnév | AI8: of:=[.AI$2] -> %3A%20 | AJ8: preface-scenario.txt | AK8: of:=[.AK$2] -> %0A%0A | AL8: of:=[.AL$2] -> Minden szükséges tudnivalót ebben a leírásban találsz | AM8: of:=[.AM$2] -> %3A%20 | AN8: of:=[.AN$2] -> https://userguide_new-drupal.dev.devdrupal.org/guidelines/instructions.html#practicalities-translating | AO8: of:=[.AO$2] -> "> | AP8: 7 | AQ8: of:=[.AQ$2] -> .  | AR8: preface-scenario.txt | AS8: of:=[.AS$2] -> </A>
A9: of:=[.A$2] -> <DT><A LAST_CHARSET="UTF-8" HREF="https://www.drupal.org/node/add/project-issue/ | B9: of:=[.B$2] -> user_guide | C9: of:=[.C$2] -> ?categories= | D9: of:=[.D$2] -> 2 | E9: of:=[.E$2] -> &component= | F9: of:=[.F$2] -> HU translation | G9: of:=[.G$2] -> &version= | H9: of:=[.H$2] -> 8.x-2.x-dev | I9: of:=[.I$2] -> &title=[ | J9: of:=[.J$2] -> HU | K9: of:=[.K$2] -> ]%20 | L9: of:=[.L$2] -> Forrásfájl lefordítása magyarra: | M9: of:=[.M$2] -> %20 | N9: understanding-drupal.txt | O9: of:=[.O$2] -> &body= | P9: of:=[.P$2] -> Az alábbi fejezet lefordítása angolról magyarra | Q9: of:=[.Q$2] -> %3A%0A-  | R9: of:=[.R$2] -> Téma | S9: of:=[.S$2] -> %3A%20 | T9: Concept: Drupal as a Content Management System | U9: of:=[.U$2] -> %20( | V9: of:=[.V$2] -> angolul | W9: of:=[.W$2] -> %3A%20 | X9: Concept: Drupal as a Content Management System | Y9: of:=[.Y$2] -> )%0A-%20 | Z9: of:=[.Z$2] -> Fejezet | AA9: of:=[.AA$2] -> %3A%20 | AB9: Understanding Drupal | AC9: of:=[.AC$2] -> %20( | AD9: of:=[.AD$2] -> angolul | AE9: of:=[.AE$2] -> %3A%20 | AF9: Understanding Drupal | AG9: of:=[.AG$2] -> )%0A-%20 | AH9: of:=[.AH$2] -> Fájlnév | AI9: of:=[.AI$2] -> %3A%20 | AJ9: understanding-drupal.txt | AK9: of:=[.AK$2] -> %0A%0A | AL9: of:=[.AL$2] -> Minden szükséges tudnivalót ebben a leírásban találsz | AM9: of:=[.AM$2] -> %3A%20 | AN9: of:=[.AN$2] -> https://userguide_new-drupal.dev.devdrupal.org/guidelines/instructions.html#practicalities-translating | AO9: of:=[.AO$2] -> "> | AP9: 8 | AQ9: of:=[.AQ$2] -> .  | AR9: understanding-drupal.txt | AS9: of:=[.AS$2] -> </A>
A10: of:=[.A$2] -> <DT><A LAST_CHARSET="UTF-8" HREF="https://www.drupal.org/node/add/project-issue/ | B10: of:=[.B$2] -> user_guide | C10: of:=[.C$2] -> ?categories= | D10: of:=[.D$2] -> 2 | E10: of:=[.E$2] -> &component= | F10: of:=[.F$2] -> HU translation | G10: of:=[.G$2] -> &version= | H10: of:=[.H$2] -> 8.x-2.x-dev | I10: of:=[.I$2] -> &title=[ | J10: of:=[.J$2] -> HU | K10: of:=[.K$2] -> ]%20 | L10: of:=[.L$2] -> Forrásfájl lefordítása magyarra: | M10: of:=[.M$2] -> %20 | N10: understanding-modules.txt | O10: of:=[.O$2] -> &body= | P10: of:=[.P$2] -> Az alábbi fejezet lefordítása angolról magyarra | Q10: of:=[.Q$2] -> %3A%0A-  | R10: of:=[.R$2] -> Téma | S10: of:=[.S$2] -> %3A%20 | T10: Concept: Modules | U10: of:=[.U$2] -> %20( | V10: of:=[.V$2] -> angolul | W10: of:=[.W$2] -> %3A%20 | X10: Concept: Modules | Y10: of:=[.Y$2] -> )%0A-%20 | Z10: of:=[.Z$2] -> Fejezet | AA10: of:=[.AA$2] -> %3A%20 | AB10: Understanding Drupal | AC10: of:=[.AC$2] -> %20( | AD10: of:=[.AD$2] -> angolul | AE10: of:=[.AE$2] -> %3A%20 | AF10: Understanding Drupal | AG10: of:=[.AG$2] -> )%0A-%20 | AH10: of:=[.AH$2] -> Fájlnév | AI10: of:=[.AI$2] -> %3A%20 | AJ10: understanding-modules.txt | AK10: of:=[.AK$2] -> %0A%0A | AL10: of:=[.AL$2] -> Minden szükséges tudnivalót ebben a leírásban találsz | AM10: of:=[.AM$2] -> %3A%20 | AN10: of:=[.AN$2] -> https://userguide_new-drupal.dev.devdrupal.org/guidelines/instructions.html#practicalities-translating | AO10: of:=[.AO$2] -> "> | AP10: 9 | AQ10: of:=[.AQ$2] -> .  | AR10: understanding-modules.txt | AS10: of:=[.AS$2] -> </A>
A11: of:=[.A$2] -> <DT><A LAST_CHARSET="UTF-8" HREF="https://www.drupal.org/node/add/project-issue/ | B11: of:=[.B$2] -> user_guide | C11: of:=[.C$2] -> ?categories= | D11: of:=[.D$2] -> 2 | E11: of:=[.E$2] -> &component= | F11: of:=[.F$2] -> HU translation | G11: of:=[.G$2] -> &version= | H11: of:=[.H$2] -> 8.x-2.x-dev | I11: of:=[.I$2] -> &title=[ | J11: of:=[.J$2] -> HU | K11: of:=[.K$2] -> ]%20 | L11: of:=[.L$2] -> Forrásfájl lefordítása magyarra: | M11: of:=[.M$2] -> %20 | N11: understanding-themes.txt | O11: of:=[.O$2] -> &body= | P11: of:=[.P$2] -> Az alábbi fejezet lefordítása angolról magyarra | Q11: of:=[.Q$2] -> %3A%0A-  | R11: of:=[.R$2] -> Téma | S11: of:=[.S$2] -> %3A%20 | T11: Concept: Themes | U11: of:=[.U$2] -> %20( | V11: of:=[.V$2] -> angolul | W11: of:=[.W$2] -> %3A%20 | X11: Concept: Themes | Y11: of:=[.Y$2] -> )%0A-%20 | Z11: of:=[.Z$2] -> Fejezet | AA11: of:=[.AA$2] -> %3A%20 | AB11: Understanding Drupal | AC11: of:=[.AC$2] -> %20( | AD11: of:=[.AD$2] -> angolul | AE11: of:=[.AE$2] -> %3A%20 | AF11: Understanding Drupal | AG11: of:=[.AG$2] -> )%0A-%20 | AH11: of:=[.AH$2] -> Fájlnév | AI11: of:=[.AI$2] -> %3A%20 | AJ11: understanding-themes.txt | AK11: of:=[.AK$2] -> %0A%0A | AL11: of:=[.AL$2] -> Minden szükséges tudnivalót ebben a leírásban találsz | AM11: of:=[.AM$2] -> %3A%20 | AN11: of:=[.AN$2] -> https://userguide_new-drupal.dev.devdrupal.org/guidelines/instructions.html#practicalities-translating | AO11: of:=[.AO$2] -> "> | AP11: 10 | AQ11: of:=[.AQ$2] -> .  | AR11: understanding-themes.txt | AS11: of:=[.AS$2] -> </A>
A12: of:=[.A$2] -> <DT><A LAST_CHARSET="UTF-8" HREF="https://www.drupal.org/node/add/project-issue/ | B12: of:=[.B$2] -> user_guide | C12: of:=[.C$2] -> ?categories= | D12: of:=[.D$2] -> 2 | E12: of:=[.E$2] -> &component= | F12: of:=[.F$2] -> HU translation | G12: of:=[.G$2] -> &version= | H12: of:=[.H$2] -> 8.x-2.x-dev | I12: of:=[.I$2] -> &title=[ | J12: of:=[.J$2] -> HU | K12: of:=[.K$2] -> ]%20 | L12: of:=[.L$2] -> Forrásfájl lefordítása magyarra: | M12: of:=[.M$2] -> %20 | N12: understanding-distributions.txt | O12: of:=[.O$2] -> &body= | P12: of:=[.P$2] -> Az alábbi fejezet lefordítása angolról magyarra | Q12: of:=[.Q$2] -> %3A%0A-  | R12: of:=[.R$2] -> Téma | S12: of:=[.S$2] -> %3A%20 | T12: Concept: Distributions | U12: of:=[.U$2] -> %20( | V12: of:=[.V$2] -> angolul | W12: of:=[.W$2] -> %3A%20 | X12: Concept: Distributions | Y12: of:=[.Y$2] -> )%0A-%20 | Z12: of:=[.Z$2] -> Fejezet | AA12: of:=[.AA$2] -> %3A%20 | AB12: Understanding Drupal | AC12: of:=[.AC$2] -> %20( | AD12: of:=[.AD$2] -> angolul | AE12: of:=[.AE$2] -> %3A%20 | AF12: Understanding Drupal | AG12: of:=[.AG$2] -> )%0A-%20 | AH12: of:=[.AH$2] -> Fájlnév | AI12: of:=[.AI$2] -> %3A%20 | AJ12: understanding-distributions.txt | AK12: of:=[.AK$2] -> %0A%0A | AL12: of:=[.AL$2] -> Minden szükséges tudnivalót ebben a leírásban találsz | AM12: of:=[.AM$2] -> %3A%20 | AN12: of:=[.AN$2] -> https://userguide_new-drupal.dev.devdrupal.org/guidelines/instructions.html#practicalities-translating | AO12: of:=[.AO$2] -> "> | AP12: 11 | AQ12: of:=[.AQ$2] -> .  | AR12: understanding-distributions.txt | AS12: of:=[.AS$2] -> </A>
A13: of:=[.A$2] -> <DT><A LAST_CHARSET="UTF-8" HREF="https://www.drupal.org/node/add/project-issue/ | B13: of:=[.B$2] -> user_guide | C13: of:=[.C$2] -> ?categories= | D13: of:=[.D$2] -> 2 | E13: of:=[.E$2] -> &component= | F13: of:=[.F$2] -> HU translation | G13: of:=[.G$2] -> &version= | H13: of:=[.H$2] -> 8.x-2.x-dev | I13: of:=[.I$2] -> &title=[ | J13: of:=[.J$2] -> HU | K13: of:=[.K$2] -> ]%20 | L13: of:=[.L$2] -> Forrásfájl lefordítása magyarra: | M13: of:=[.M$2] -> %20 | N13: understanding-data.txt | O13: of:=[.O$2] -> &body= | P13: of:=[.P$2] -> Az alábbi fejezet lefordítása angolról magyarra | Q13: of:=[.Q$2] -> %3A%0A-  | R13: of:=[.R$2] -> Téma | S13: of:=[.S$2] -> %3A%20 | T13: Concept: Types of Data | U13: of:=[.U$2] -> %20( | V13: of:=[.V$2] -> angolul | W13: of:=[.W$2] -> %3A%20 | X13: Concept: Types of Data | Y13: of:=[.Y$2] -> )%0A-%20 | Z13: of:=[.Z$2] -> Fejezet | AA13: of:=[.AA$2] -> %3A%20 | AB13: Understanding Drupal | AC13: of:=[.AC$2] -> %20( | AD13: of:=[.AD$2] -> angolul | AE13: of:=[.AE$2] -> %3A%20 | AF13: Understanding Drupal | AG13: of:=[.AG$2] -> )%0A-%20 | AH13: of:=[.AH$2] -> Fájlnév | AI13: of:=[.AI$2] -> %3A%20 | AJ13: understanding-data.txt | AK13: of:=[.AK$2] -> %0A%0A | AL13: of:=[.AL$2] -> Minden szükséges tudnivalót ebben a leírásban találsz | AM13: of:=[.AM$2] -> %3A%20 | AN13: of:=[.AN$2] -> https://userguide_new-drupal.dev.devdrupal.org/guidelines/instructions.html#practicalities-translating | AO13: of:=[.AO$2] -> "> | AP13: 12 | AQ13: of:=[.AQ$2] -> .  | AR13: understanding-data.txt | AS13: of:=[.AS$2] -> </A>
A14: of:=[.A$2] -> <DT><A LAST_CHARSET="UTF-8" HREF="https://www.drupal.org/node/add/project-issue/ | B14: of:=[.B$2] -> user_guide | C14: of:=[.C$2] -> ?categories= | D14: of:=[.D$2] -> 2 | E14: of:=[.E$2] -> &component= | F14: of:=[.F$2] -> HU translation | G14: of:=[.G$2] -> &version= | H14: of:=[.H$2] -> 8.x-2.x-dev | I14: of:=[.I$2] -> &title=[ | J14: of:=[.J$2] -> HU | K14: of:=[.K$2] -> ]%20 | L14: of:=[.L$2] -> Forrásfájl lefordítása magyarra: | M14: of:=[.M$2] -> %20 | N14: understanding-project.txt | O14: of:=[.O$2] -> &body= | P14: of:=[.P$2] -> Az alábbi fejezet lefordítása angolról magyarra | Q14: of:=[.Q$2] -> %3A%0A-  | R14: of:=[.R$2] -> Téma | S14: of:=[.S$2] -> %3A%20 | T14: Concept: The Drupal Project | U14: of:=[.U$2] -> %20( | V14: of:=[.V$2] -> angolul | W14: of:=[.W$2] -> %3A%20 | X14: Concept: The Drupal Project | Y14: of:=[.Y$2] -> )%0A-%20 | Z14: of:=[.Z$2] -> Fejezet | AA14: of:=[.AA$2] -> %3A%20 | AB14: Understanding Drupal | AC14: of:=[.AC$2] -> %20( | AD14: of:=[.AD$2] -> angolul | AE14: of:=[.AE$2] -> %3A%20 | AF14: Understanding Drupal | AG14: of:=[.AG$2] -> )%0A-%20 | AH14: of:=[.AH$2] -> Fájlnév | AI14: of:=[.AI$2] -> %3A%20 | AJ14: understanding-project.txt | AK14: of:=[.AK$2] -> %0A%0A | AL14: of:=[.AL$2] -> Minden szükséges tudnivalót ebben a leírásban találsz | AM14: of:=[.AM$2] -> %3A%20 | AN14: of:=[.AN$2] -> https://userguide_new-drupal.dev.devdrupal.org/guidelines/instructions.html#practicalities-translating | AO14: of:=[.AO$2] -> "> | AP14: 13 | AQ14: of:=[.AQ$2] -> .  | AR14: understanding-project.txt | AS14: of:=[.AS$2] -> </A>
A15: of:=[.A$2] -> <DT><A LAST_CHARSET="UTF-8" HREF="https://www.drupal.org/node/add/project-issue/ | B15: of:=[.B$2] -> user_guide | C15: of:=[.C$2] -> ?categories= | D15: of:=[.D$2] -> 2 | E15: of:=[.E$2] -> &component= | F15: of:=[.F$2] -> HU translation | G15: of:=[.G$2] -> &version= | H15: of:=[.H$2] -> 8.x-2.x-dev | I15: of:=[.I$2] -> &title=[ | J15: of:=[.J$2] -> HU | K15: of:=[.K$2] -> ]%20 | L15: of:=[.L$2] -> Forrásfájl lefordítása magyarra: | M15: of:=[.M$2] -> %20 | N15: understanding-gpl.txt | O15: of:=[.O$2] -> &body= | P15: of:=[.P$2] -> Az alábbi fejezet lefordítása angolról magyarra | Q15: of:=[.Q$2] -> %3A%0A-  | R15: of:=[.R$2] -> Téma | S15: of:=[.S$2] -> %3A%20 | T15: Concept: Drupal Licensing | U15: of:=[.U$2] -> %20( | V15: of:=[.V$2] -> angolul | W15: of:=[.W$2] -> %3A%20 | X15: Concept: Drupal Licensing | Y15: of:=[.Y$2] -> )%0A-%20 | Z15: of:=[.Z$2] -> Fejezet | AA15: of:=[.AA$2] -> %3A%20 | AB15: Understanding Drupal | AC15: of:=[.AC$2] -> %20( | AD15: of:=[.AD$2] -> angolul | AE15: of:=[.AE$2] -> %3A%20 | AF15: Understanding Drupal | AG15: of:=[.AG$2] -> )%0A-%20 | AH15: of:=[.AH$2] -> Fájlnév | AI15: of:=[.AI$2] -> %3A%20 | AJ15: understanding-gpl.txt | AK15: of:=[.AK$2] -> %0A%0A | AL15: of:=[.AL$2] -> Minden szükséges tudnivalót ebben a leírásban találsz | AM15: of:=[.AM$2] -> %3A%20 | AN15: of:=[.AN$2] -> https://userguide_new-drupal.dev.devdrupal.org/guidelines/instructions.html#practicalities-translating | AO15: of:=[.AO$2] -> "> | AP15: 14 | AQ15: of:=[.AQ$2] -> .  | AR15: understanding-gpl.txt | AS15: of:=[.AS$2] -> </A>
A16: of:=[.A$2] -> <DT><A LAST_CHARSET="UTF-8" HREF="https://www.drupal.org/node/add/project-issue/ | B16: of:=[.B$2] -> user_guide | C16: of:=[.C$2] -> ?categories= | D16: of:=[.D$2] -> 2 | E16: of:=[.E$2] -> &component= | F16: of:=[.F$2] -> HU translation | G16: of:=[.G$2] -> &version= | H16: of:=[.H$2] -> 8.x-2.x-dev | I16: of:=[.I$2] -> &title=[ | J16: of:=[.J$2] -> HU | K16: of:=[.K$2] -> ]%20 | L16: of:=[.L$2] -> Forrásfájl lefordítása magyarra: | M16: of:=[.M$2] -> %20 | N16: block-regions.txt | O16: of:=[.O$2] -> &body= | P16: of:=[.P$2] -> Az alábbi fejezet lefordítása angolról magyarra | Q16: of:=[.Q$2] -> %3A%0A-  | R16: of:=[.R$2] -> Téma | S16: of:=[.S$2] -> %3A%20 | T16: Concept: Regions in a Theme | U16: of:=[.U$2] -> %20( | V16: of:=[.V$2] -> angolul | W16: of:=[.W$2] -> %3A%20 | X16: Concept: Regions in a Theme | Y16: of:=[.Y$2] -> )%0A-%20 | Z16: of:=[.Z$2] -> Fejezet | AA16: of:=[.AA$2] -> %3A%20 | AB16: Planning your Site | AC16: of:=[.AC$2] -> %20( | AD16: of:=[.AD$2] -> angolul | AE16: of:=[.AE$2] -> %3A%20 | AF16: Planning your Site | AG16: of:=[.AG$2] -> )%0A-%20 | AH16: of:=[.AH$2] -> Fájlnév | AI16: of:=[.AI$2] -> %3A%20 | AJ16: block-regions.txt | AK16: of:=[.AK$2] -> %0A%0A | AL16: of:=[.AL$2] -> Minden szükséges tudnivalót ebben a leírásban találsz | AM16: of:=[.AM$2] -> %3A%20 | AN16: of:=[.AN$2] -> https://userguide_new-drupal.dev.devdrupal.org/guidelines/instructions.html#practicalities-translating | AO16: of:=[.AO$2] -> "> | AP16: 15 | AQ16: of:=[.AQ$2] -> .  | AR16: block-regions.txt | AS16: of:=[.AS$2] -> </A>
A17: of:=[.A$2] -> <DT><A LAST_CHARSET="UTF-8" HREF="https://www.drupal.org/node/add/project-issue/ | B17: of:=[.B$2] -> user_guide | C17: of:=[.C$2] -> ?categories= | D17: of:=[.D$2] -> 2 | E17: of:=[.E$2] -> &component= | F17: of:=[.F$2] -> HU translation | G17: of:=[.G$2] -> &version= | H17: of:=[.H$2] -> 8.x-2.x-dev | I17: of:=[.I$2] -> &title=[ | J17: of:=[.J$2] -> HU | K17: of:=[.K$2] -> ]%20 | L17: of:=[.L$2] -> Forrásfájl lefordítása magyarra: | M17: of:=[.M$2] -> %20 | N17: planning-layout.txt | O17: of:=[.O$2] -> &body= | P17: of:=[.P$2] -> Az alábbi fejezet lefordítása angolról magyarra | Q17: of:=[.Q$2] -> %3A%0A-  | R17: of:=[.R$2] -> Téma | S17: of:=[.S$2] -> %3A%20 | T17: Planning your Site Layout | U17: of:=[.U$2] -> %20( | V17: of:=[.V$2] -> angolul | W17: of:=[.W$2] -> %3A%20 | X17: Planning your Site Layout | Y17: of:=[.Y$2] -> )%0A-%20 | Z17: of:=[.Z$2] -> Fejezet | AA17: of:=[.AA$2] -> %3A%20 | AB17: Planning your Site | AC17: of:=[.AC$2] -> %20( | AD17: of:=[.AD$2] -> angolul | AE17: of:=[.AE$2] -> %3A%20 | AF17: Planning your Site | AG17: of:=[.AG$2] -> )%0A-%20 | AH17: of:=[.AH$2] -> Fájlnév | AI17: of:=[.AI$2] -> %3A%20 | AJ17: planning-layout.txt | AK17: of:=[.AK$2] -> %0A%0A | AL17: of:=[.AL$2] -> Minden szükséges tudnivalót ebben a leírásban találsz | AM17: of:=[.AM$2] -> %3A%20 | AN17: of:=[.AN$2] -> https://userguide_new-drupal.dev.devdrupal.org/guidelines/instructions.html#practicalities-translating | AO17: of:=[.AO$2] -> "> | AP17: 16 | AQ17: of:=[.AQ$2] -> .  | AR17: planning-layout.txt | AS17: of:=[.AS$2] -> </A>
A18: of:=[.A$2] -> <DT><A LAST_CHARSET="UTF-8" HREF="https://www.drupal.org/node/add/project-issue/ | B18: of:=[.B$2] -> user_guide | C18: of:=[.C$2] -> ?categories= | D18: of:=[.D$2] -> 2 | E18: of:=[.E$2] -> &component= | F18: of:=[.F$2] -> HU translation | G18: of:=[.G$2] -> &version= | H18: of:=[.H$2] -> 8.x-2.x-dev | I18: of:=[.I$2] -> &title=[ | J18: of:=[.J$2] -> HU | K18: of:=[.K$2] -> ]%20 | L18: of:=[.L$2] -> Forrásfájl lefordítása magyarra: | M18: of:=[.M$2] -> %20 | N18: planning-data-types.txt | O18: of:=[.O$2] -> &body= | P18: of:=[.P$2] -> Az alábbi fejezet lefordítása angolról magyarra | Q18: of:=[.Q$2] -> %3A%0A-  | R18: of:=[.R$2] -> Téma | S18: of:=[.S$2] -> %3A%20 | T18: Concept: Content Entities and Fields | U18: of:=[.U$2] -> %20( | V18: of:=[.V$2] -> angolul | W18: of:=[.W$2] -> %3A%20 | X18: Concept: Content Entities and Fields | Y18: of:=[.Y$2] -> )%0A-%20 | Z18: of:=[.Z$2] -> Fejezet | AA18: of:=[.AA$2] -> %3A%20 | AB18: Planning your Site | AC18: of:=[.AC$2] -> %20( | AD18: of:=[.AD$2] -> angolul | AE18: of:=[.AE$2] -> %3A%20 | AF18: Planning your Site | AG18: of:=[.AG$2] -> )%0A-%20 | AH18: of:=[.AH$2] -> Fájlnév | AI18: of:=[.AI$2] -> %3A%20 | AJ18: planning-data-types.txt | AK18: of:=[.AK$2] -> %0A%0A | AL18: of:=[.AL$2] -> Minden szükséges tudnivalót ebben a leírásban találsz | AM18: of:=[.AM$2] -> %3A%20 | AN18: of:=[.AN$2] -> https://userguide_new-drupal.dev.devdrupal.org/guidelines/instructions.html#practicalities-translating | AO18: of:=[.AO$2] -> "> | AP18: 17 | AQ18: of:=[.AQ$2] -> .  | AR18: planning-data-types.txt | AS18: of:=[.AS$2] -> </A>
A19: of:=[.A$2] -> <DT><A LAST_CHARSET="UTF-8" HREF="https://www.drupal.org/node/add/project-issue/ | B19: of:=[.B$2] -> user_guide | C19: of:=[.C$2] -> ?categories= | D19: of:=[.D$2] -> 2 | E19: of:=[.E$2] -> &component= | F19: of:=[.F$2] -> HU translation | G19: of:=[.G$2] -> &version= | H19: of:=[.H$2] -> 8.x-2.x-dev | I19: of:=[.I$2] -> &title=[ | J19: of:=[.J$2] -> HU | K19: of:=[.K$2] -> ]%20 | L19: of:=[.L$2] -> Forrásfájl lefordítása magyarra: | M19: of:=[.M$2] -> %20 | N19: planning-modular.txt | O19: of:=[.O$2] -> &body= | P19: of:=[.P$2] -> Az alábbi fejezet lefordítása angolról magyarra | Q19: of:=[.Q$2] -> %3A%0A-  | R19: of:=[.R$2] -> Téma | S19: of:=[.S$2] -> %3A%20 | T19: Concept: Modular Content | U19: of:=[.U$2] -> %20( | V19: of:=[.V$2] -> angolul | W19: of:=[.W$2] -> %3A%20 | X19: Concept: Modular Content | Y19: of:=[.Y$2] -> )%0A-%20 | Z19: of:=[.Z$2] -> Fejezet | AA19: of:=[.AA$2] -> %3A%20 | AB19: Planning your Site | AC19: of:=[.AC$2] -> %20( | AD19: of:=[.AD$2] -> angolul | AE19: of:=[.AE$2] -> %3A%20 | AF19: Planning your Site | AG19: of:=[.AG$2] -> )%0A-%20 | AH19: of:=[.AH$2] -> Fájlnév | AI19: of:=[.AI$2] -> %3A%20 | AJ19: planning-modular.txt | AK19: of:=[.AK$2] -> %0A%0A | AL19: of:=[.AL$2] -> Minden szükséges tudnivalót ebben a leírásban találsz | AM19: of:=[.AM$2] -> %3A%20 | AN19: of:=[.AN$2] -> https://userguide_new-drupal.dev.devdrupal.org/guidelines/instructions.html#practicalities-translating | AO19: of:=[.AO$2] -> "> | AP19: 18 | AQ19: of:=[.AQ$2] -> .  | AR19: planning-modular.txt | AS19: of:=[.AS$2] -> </A>
A20: of:=[.A$2] -> <DT><A LAST_CHARSET="UTF-8" HREF="https://www.drupal.org/node/add/project-issue/ | B20: of:=[.B$2] -> user_guide | C20: of:=[.C$2] -> ?categories= | D20: of:=[.D$2] -> 2 | E20: of:=[.E$2] -> &component= | F20: of:=[.F$2] -> HU translation | G20: of:=[.G$2] -> &version= | H20: of:=[.H$2] -> 8.x-2.x-dev | I20: of:=[.I$2] -> &title=[ | J20: of:=[.J$2] -> HU | K20: of:=[.K$2] -> ]%20 | L20: of:=[.L$2] -> Forrásfájl lefordítása magyarra: | M20: of:=[.M$2] -> %20 | N20: planning-structure.txt | O20: of:=[.O$2] -> &body= | P20: of:=[.P$2] -> Az alábbi fejezet lefordítása angolról magyarra | Q20: of:=[.Q$2] -> %3A%0A-  | R20: of:=[.R$2] -> Téma | S20: of:=[.S$2] -> %3A%20 | T20: Planning your Content Structure | U20: of:=[.U$2] -> %20( | V20: of:=[.V$2] -> angolul | W20: of:=[.W$2] -> %3A%20 | X20: Planning your Content Structure | Y20: of:=[.Y$2] -> )%0A-%20 | Z20: of:=[.Z$2] -> Fejezet | AA20: of:=[.AA$2] -> %3A%20 | AB20: Planning your Site | AC20: of:=[.AC$2] -> %20( | AD20: of:=[.AD$2] -> angolul | AE20: of:=[.AE$2] -> %3A%20 | AF20: Planning your Site | AG20: of:=[.AG$2] -> )%0A-%20 | AH20: of:=[.AH$2] -> Fájlnév | AI20: of:=[.AI$2] -> %3A%20 | AJ20: planning-structure.txt | AK20: of:=[.AK$2] -> %0A%0A | AL20: of:=[.AL$2] -> Minden szükséges tudnivalót ebben a leírásban találsz | AM20: of:=[.AM$2] -> %3A%20 | AN20: of:=[.AN$2] -> https://userguide_new-drupal.dev.devdrupal.org/guidelines/instructions.html#practicalities-translating | AO20: of:=[.AO$2] -> "> | AP20: 19 | AQ20: of:=[.AQ$2] -> .  | AR20: planning-structure.txt | AS20: of:=[.AS$2] -> </A>
A21: of:=[.A$2] -> <DT><A LAST_CHARSET="UTF-8" HREF="https://www.drupal.org/node/add/project-issue/ | B21: of:=[.B$2] -> user_guide | C21: of:=[.C$2] -> ?categories= | D21: of:=[.D$2] -> 2 | E21: of:=[.E$2] -> &component= | F21: of:=[.F$2] -> HU translation | G21: of:=[.G$2] -> &version= | H21: of:=[.H$2] -> 8.x-2.x-dev | I21: of:=[.I$2] -> &title=[ | J21: of:=[.J$2] -> HU | K21: of:=[.K$2] -> ]%20 | L21: of:=[.L$2] -> Forrásfájl lefordítása magyarra: | M21: of:=[.M$2] -> %20 | N21: planning-workflow.txt | O21: of:=[.O$2] -> &body= | P21: of:=[.P$2] -> Az alábbi fejezet lefordítása angolról magyarra | Q21: of:=[.Q$2] -> %3A%0A-  | R21: of:=[.R$2] -> Téma | S21: of:=[.S$2] -> %3A%20 | T21: Concept: Editorial Workflow | U21: of:=[.U$2] -> %20( | V21: of:=[.V$2] -> angolul | W21: of:=[.W$2] -> %3A%20 | X21: Concept: Editorial Workflow | Y21: of:=[.Y$2] -> )%0A-%20 | Z21: of:=[.Z$2] -> Fejezet | AA21: of:=[.AA$2] -> %3A%20 | AB21: Planning your Site | AC21: of:=[.AC$2] -> %20( | AD21: of:=[.AD$2] -> angolul | AE21: of:=[.AE$2] -> %3A%20 | AF21: Planning your Site | AG21: of:=[.AG$2] -> )%0A-%20 | AH21: of:=[.AH$2] -> Fájlnév | AI21: of:=[.AI$2] -> %3A%20 | AJ21: planning-workflow.txt | AK21: of:=[.AK$2] -> %0A%0A | AL21: of:=[.AL$2] -> Minden szükséges tudnivalót ebben a leírásban találsz | AM21: of:=[.AM$2] -> %3A%20 | AN21: of:=[.AN$2] -> https://userguide_new-drupal.dev.devdrupal.org/guidelines/instructions.html#practicalities-translating | AO21: of:=[.AO$2] -> "> | AP21: 20 | AQ21: of:=[.AQ$2] -> .  | AR21: planning-workflow.txt | AS21: of:=[.AS$2] -> </A>
A22: of:=[.A$2] -> <DT><A LAST_CHARSET="UTF-8" HREF="https://www.drupal.org/node/add/project-issue/ | B22: of:=[.B$2] -> user_guide | C22: of:=[.C$2] -> ?categories= | D22: of:=[.D$2] -> 2 | E22: of:=[.E$2] -> &component= | F22: of:=[.F$2] -> HU translation | G22: of:=[.G$2] -> &version= | H22: of:=[.H$2] -> 8.x-2.x-dev | I22: of:=[.I$2] -> &title=[ | J22: of:=[.J$2] -> HU | K22: of:=[.K$2] -> ]%20 | L22: of:=[.L$2] -> Forrásfájl lefordítása magyarra: | M22: of:=[.M$2] -> %20 | N22: install-requirements.txt | O22: of:=[.O$2] -> &body= | P22: of:=[.P$2] -> Az alábbi fejezet lefordítása angolról magyarra | Q22: of:=[.Q$2] -> %3A%0A-  | R22: of:=[.R$2] -> Téma | S22: of:=[.S$2] -> %3A%20 | T22: Concept: Server Requirements | U22: of:=[.U$2] -> %20( | V22: of:=[.V$2] -> angolul | W22: of:=[.W$2] -> %3A%20 | X22: Concept: Server Requirements | Y22: of:=[.Y$2] -> )%0A-%20 | Z22: of:=[.Z$2] -> Fejezet | AA22: of:=[.AA$2] -> %3A%20 | AB22: Installation | AC22: of:=[.AC$2] -> %20( | AD22: of:=[.AD$2] -> angolul | AE22: of:=[.AE$2] -> %3A%20 | AF22: Installation | AG22: of:=[.AG$2] -> )%0A-%20 | AH22: of:=[.AH$2] -> Fájlnév | AI22: of:=[.AI$2] -> %3A%20 | AJ22: install-requirements.txt | AK22: of:=[.AK$2] -> %0A%0A | AL22: of:=[.AL$2] -> Minden szükséges tudnivalót ebben a leírásban találsz | AM22: of:=[.AM$2] -> %3A%20 | AN22: of:=[.AN$2] -> https://userguide_new-drupal.dev.devdrupal.org/guidelines/instructions.html#practicalities-translating | AO22: of:=[.AO$2] -> "> | AP22: 21 | AQ22: of:=[.AQ$2] -> .  | AR22: install-requirements.txt | AS22: of:=[.AS$2] -> </A>
A23: of:=[.A$2] -> <DT><A LAST_CHARSET="UTF-8" HREF="https://www.drupal.org/node/add/project-issue/ | B23: of:=[.B$2] -> user_guide | C23: of:=[.C$2] -> ?categories= | D23: of:=[.D$2] -> 2 | E23: of:=[.E$2] -> &component= | F23: of:=[.F$2] -> HU translation | G23: of:=[.G$2] -> &version= | H23: of:=[.H$2] -> 8.x-2.x-dev | I23: of:=[.I$2] -> &title=[ | J23: of:=[.J$2] -> HU | K23: of:=[.K$2] -> ]%20 | L23: of:=[.L$2] -> Forrásfájl lefordítása magyarra: | M23: of:=[.M$2] -> %20 | N23: install-tools.txt | O23: of:=[.O$2] -> &body= | P23: of:=[.P$2] -> Az alábbi fejezet lefordítása angolról magyarra | Q23: of:=[.Q$2] -> %3A%0A-  | R23: of:=[.R$2] -> Téma | S23: of:=[.S$2] -> %3A%20 | T23: Concept: Additional Tools | U23: of:=[.U$2] -> %20( | V23: of:=[.V$2] -> angolul | W23: of:=[.W$2] -> %3A%20 | X23: Concept: Additional Tools | Y23: of:=[.Y$2] -> )%0A-%20 | Z23: of:=[.Z$2] -> Fejezet | AA23: of:=[.AA$2] -> %3A%20 | AB23: Installation | AC23: of:=[.AC$2] -> %20( | AD23: of:=[.AD$2] -> angolul | AE23: of:=[.AE$2] -> %3A%20 | AF23: Installation | AG23: of:=[.AG$2] -> )%0A-%20 | AH23: of:=[.AH$2] -> Fájlnév | AI23: of:=[.AI$2] -> %3A%20 | AJ23: install-tools.txt | AK23: of:=[.AK$2] -> %0A%0A | AL23: of:=[.AL$2] -> Minden szükséges tudnivalót ebben a leírásban találsz | AM23: of:=[.AM$2] -> %3A%20 | AN23: of:=[.AN$2] -> https://userguide_new-drupal.dev.devdrupal.org/guidelines/instructions.html#practicalities-translating | AO23: of:=[.AO$2] -> "> | AP23: 22 | AQ23: of:=[.AQ$2] -> .  | AR23: install-tools.txt | AS23: of:=[.AS$2] -> </A>
A24: of:=[.A$2] -> <DT><A LAST_CHARSET="UTF-8" HREF="https://www.drupal.org/node/add/project-issue/ | B24: of:=[.B$2] -> user_guide | C24: of:=[.C$2] -> ?categories= | D24: of:=[.D$2] -> 2 | E24: of:=[.E$2] -> &component= | F24: of:=[.F$2] -> HU translation | G24: of:=[.G$2] -> &version= | H24: of:=[.H$2] -> 8.x-2.x-dev | I24: of:=[.I$2] -> &title=[ | J24: of:=[.J$2] -> HU | K24: of:=[.K$2] -> ]%20 | L24: of:=[.L$2] -> Forrásfájl lefordítása magyarra: | M24: of:=[.M$2] -> %20 | N24: install-prepare.txt | O24: of:=[.O$2] -> &body= | P24: of:=[.P$2] -> Az alábbi fejezet lefordítása angolról magyarra | Q24: of:=[.Q$2] -> %3A%0A-  | R24: of:=[.R$2] -> Téma | S24: of:=[.S$2] -> %3A%20 | T24: Preparing to Install | U24: of:=[.U$2] -> %20( | V24: of:=[.V$2] -> angolul | W24: of:=[.W$2] -> %3A%20 | X24: Preparing to Install | Y24: of:=[.Y$2] -> )%0A-%20 | Z24: of:=[.Z$2] -> Fejezet | AA24: of:=[.AA$2] -> %3A%20 | AB24: Installation | AC24: of:=[.AC$2] -> %20( | AD24: of:=[.AD$2] -> angolul | AE24: of:=[.AE$2] -> %3A%20 | AF24: Installation | AG24: of:=[.AG$2] -> )%0A-%20 | AH24: of:=[.AH$2] -> Fájlnév | AI24: of:=[.AI$2] -> %3A%20 | AJ24: install-prepare.txt | AK24: of:=[.AK$2] -> %0A%0A | AL24: of:=[.AL$2] -> Minden szükséges tudnivalót ebben a leírásban találsz | AM24: of:=[.AM$2] -> %3A%20 | AN24: of:=[.AN$2] -> https://userguide_new-drupal.dev.devdrupal.org/guidelines/instructions.html#practicalities-translating | AO24: of:=[.AO$2] -> "> | AP24: 23 | AQ24: of:=[.AQ$2] -> .  | AR24: install-prepare.txt | AS24: of:=[.AS$2] -> </A>
A25: of:=[.A$2] -> <DT><A LAST_CHARSET="UTF-8" HREF="https://www.drupal.org/node/add/project-issue/ | B25: of:=[.B$2] -> user_guide | C25: of:=[.C$2] -> ?categories= | D25: of:=[.D$2] -> 2 | E25: of:=[.E$2] -> &component= | F25: of:=[.F$2] -> HU translation | G25: of:=[.G$2] -> &version= | H25: of:=[.H$2] -> 8.x-2.x-dev | I25: of:=[.I$2] -> &title=[ | J25: of:=[.J$2] -> HU | K25: of:=[.K$2] -> ]%20 | L25: of:=[.L$2] -> Forrásfájl lefordítása magyarra: | M25: of:=[.M$2] -> %20 | N25: install-run.txt | O25: of:=[.O$2] -> &body= | P25: of:=[.P$2] -> Az alábbi fejezet lefordítása angolról magyarra | Q25: of:=[.Q$2] -> %3A%0A-  | R25: of:=[.R$2] -> Téma | S25: of:=[.S$2] -> %3A%20 | T25: Running the Installer | U25: of:=[.U$2] -> %20( | V25: of:=[.V$2] -> angolul | W25: of:=[.W$2] -> %3A%20 | X25: Running the Installer | Y25: of:=[.Y$2] -> )%0A-%20 | Z25: of:=[.Z$2] -> Fejezet | AA25: of:=[.AA$2] -> %3A%20 | AB25: Installation | AC25: of:=[.AC$2] -> %20( | AD25: of:=[.AD$2] -> angolul | AE25: of:=[.AE$2] -> %3A%20 | AF25: Installation | AG25: of:=[.AG$2] -> )%0A-%20 | AH25: of:=[.AH$2] -> Fájlnév | AI25: of:=[.AI$2] -> %3A%20 | AJ25: install-run.txt | AK25: of:=[.AK$2] -> %0A%0A | AL25: of:=[.AL$2] -> Minden szükséges tudnivalót ebben a leírásban találsz | AM25: of:=[.AM$2] -> %3A%20 | AN25: of:=[.AN$2] -> https://userguide_new-drupal.dev.devdrupal.org/guidelines/instructions.html#practicalities-translating | AO25: of:=[.AO$2] -> "> | AP25: 24 | AQ25: of:=[.AQ$2] -> .  | AR25: install-run.txt | AS25: of:=[.AS$2] -> </A>
A26: of:=[.A$2] -> <DT><A LAST_CHARSET="UTF-8" HREF="https://www.drupal.org/node/add/project-issue/ | B26: of:=[.B$2] -> user_guide | C26: of:=[.C$2] -> ?categories= | D26: of:=[.D$2] -> 2 | E26: of:=[.E$2] -> &component= | F26: of:=[.F$2] -> HU translation | G26: of:=[.G$2] -> &version= | H26: of:=[.H$2] -> 8.x-2.x-dev | I26: of:=[.I$2] -> &title=[ | J26: of:=[.J$2] -> HU | K26: of:=[.K$2] -> ]%20 | L26: of:=[.L$2] -> Forrásfájl lefordítása magyarra: | M26: of:=[.M$2] -> %20 | N26: config-overview.txt | O26: of:=[.O$2] -> &body= | P26: of:=[.P$2] -> Az alábbi fejezet lefordítása angolról magyarra | Q26: of:=[.Q$2] -> %3A%0A-  | R26: of:=[.R$2] -> Téma | S26: of:=[.S$2] -> %3A%20 | T26: Concept: Administrative Overview | U26: of:=[.U$2] -> %20( | V26: of:=[.V$2] -> angolul | W26: of:=[.W$2] -> %3A%20 | X26: Concept: Administrative Overview | Y26: of:=[.Y$2] -> )%0A-%20 | Z26: of:=[.Z$2] -> Fejezet | AA26: of:=[.AA$2] -> %3A%20 | AB26: Basic Site Configuration | AC26: of:=[.AC$2] -> %20( | AD26: of:=[.AD$2] -> angolul | AE26: of:=[.AE$2] -> %3A%20 | AF26: Basic Site Configuration | AG26: of:=[.AG$2] -> )%0A-%20 | AH26: of:=[.AH$2] -> Fájlnév | AI26: of:=[.AI$2] -> %3A%20 | AJ26: config-overview.txt | AK26: of:=[.AK$2] -> %0A%0A | AL26: of:=[.AL$2] -> Minden szükséges tudnivalót ebben a leírásban találsz | AM26: of:=[.AM$2] -> %3A%20 | AN26: of:=[.AN$2] -> https://userguide_new-drupal.dev.devdrupal.org/guidelines/instructions.html#practicalities-translating | AO26: of:=[.AO$2] -> "> | AP26: 25 | AQ26: of:=[.AQ$2] -> .  | AR26: config-overview.txt | AS26: of:=[.AS$2] -> </A>
A27: of:=[.A$2] -> <DT><A LAST_CHARSET="UTF-8" HREF="https://www.drupal.org/node/add/project-issue/ | B27: of:=[.B$2] -> user_guide | C27: of:=[.C$2] -> ?categories= | D27: of:=[.D$2] -> 2 | E27: of:=[.E$2] -> &component= | F27: of:=[.F$2] -> HU translation | G27: of:=[.G$2] -> &version= | H27: of:=[.H$2] -> 8.x-2.x-dev | I27: of:=[.I$2] -> &title=[ | J27: of:=[.J$2] -> HU | K27: of:=[.K$2] -> ]%20 | L27: of:=[.L$2] -> Forrásfájl lefordítása magyarra: | M27: of:=[.M$2] -> %20 | N27: config-basic.txt | O27: of:=[.O$2] -> &body= | P27: of:=[.P$2] -> Az alábbi fejezet lefordítása angolról magyarra | Q27: of:=[.Q$2] -> %3A%0A-  | R27: of:=[.R$2] -> Téma | S27: of:=[.S$2] -> %3A%20 | T27: Editing Basic Site Information | U27: of:=[.U$2] -> %20( | V27: of:=[.V$2] -> angolul | W27: of:=[.W$2] -> %3A%20 | X27: Editing Basic Site Information | Y27: of:=[.Y$2] -> )%0A-%20 | Z27: of:=[.Z$2] -> Fejezet | AA27: of:=[.AA$2] -> %3A%20 | AB27: Basic Site Configuration | AC27: of:=[.AC$2] -> %20( | AD27: of:=[.AD$2] -> angolul | AE27: of:=[.AE$2] -> %3A%20 | AF27: Basic Site Configuration | AG27: of:=[.AG$2] -> )%0A-%20 | AH27: of:=[.AH$2] -> Fájlnév | AI27: of:=[.AI$2] -> %3A%20 | AJ27: config-basic.txt | AK27: of:=[.AK$2] -> %0A%0A | AL27: of:=[.AL$2] -> Minden szükséges tudnivalót ebben a leírásban találsz | AM27: of:=[.AM$2] -> %3A%20 | AN27: of:=[.AN$2] -> https://userguide_new-drupal.dev.devdrupal.org/guidelines/instructions.html#practicalities-translating | AO27: of:=[.AO$2] -> "> | AP27: 26 | AQ27: of:=[.AQ$2] -> .  | AR27: config-basic.txt | AS27: of:=[.AS$2] -> </A>
A28: of:=[.A$2] -> <DT><A LAST_CHARSET="UTF-8" HREF="https://www.drupal.org/node/add/project-issue/ | B28: of:=[.B$2] -> user_guide | C28: of:=[.C$2] -> ?categories= | D28: of:=[.D$2] -> 2 | E28: of:=[.E$2] -> &component= | F28: of:=[.F$2] -> HU translation | G28: of:=[.G$2] -> &version= | H28: of:=[.H$2] -> 8.x-2.x-dev | I28: of:=[.I$2] -> &title=[ | J28: of:=[.J$2] -> HU | K28: of:=[.K$2] -> ]%20 | L28: of:=[.L$2] -> Forrásfájl lefordítása magyarra: | M28: of:=[.M$2] -> %20 | N28: config-install.txt | O28: of:=[.O$2] -> &body= | P28: of:=[.P$2] -> Az alábbi fejezet lefordítása angolról magyarra | Q28: of:=[.Q$2] -> %3A%0A-  | R28: of:=[.R$2] -> Téma | S28: of:=[.S$2] -> %3A%20 | T28: Installing a Module | U28: of:=[.U$2] -> %20( | V28: of:=[.V$2] -> angolul | W28: of:=[.W$2] -> %3A%20 | X28: Installing a Module | Y28: of:=[.Y$2] -> )%0A-%20 | Z28: of:=[.Z$2] -> Fejezet | AA28: of:=[.AA$2] -> %3A%20 | AB28: Basic Site Configuration | AC28: of:=[.AC$2] -> %20( | AD28: of:=[.AD$2] -> angolul | AE28: of:=[.AE$2] -> %3A%20 | AF28: Basic Site Configuration | AG28: of:=[.AG$2] -> )%0A-%20 | AH28: of:=[.AH$2] -> Fájlnév | AI28: of:=[.AI$2] -> %3A%20 | AJ28: config-install.txt | AK28: of:=[.AK$2] -> %0A%0A | AL28: of:=[.AL$2] -> Minden szükséges tudnivalót ebben a leírásban találsz | AM28: of:=[.AM$2] -> %3A%20 | AN28: of:=[.AN$2] -> https://userguide_new-drupal.dev.devdrupal.org/guidelines/instructions.html#practicalities-translating | AO28: of:=[.AO$2] -> "> | AP28: 27 | AQ28: of:=[.AQ$2] -> .  | AR28: config-install.txt | AS28: of:=[.AS$2] -> </A>
A29: of:=[.A$2] -> <DT><A LAST_CHARSET="UTF-8" HREF="https://www.drupal.org/node/add/project-issue/ | B29: of:=[.B$2] -> user_guide | C29: of:=[.C$2] -> ?categories= | D29: of:=[.D$2] -> 2 | E29: of:=[.E$2] -> &component= | F29: of:=[.F$2] -> HU translation | G29: of:=[.G$2] -> &version= | H29: of:=[.H$2] -> 8.x-2.x-dev | I29: of:=[.I$2] -> &title=[ | J29: of:=[.J$2] -> HU | K29: of:=[.K$2] -> ]%20 | L29: of:=[.L$2] -> Forrásfájl lefordítása magyarra: | M29: of:=[.M$2] -> %20 | N29: config-uninstall.txt | O29: of:=[.O$2] -> &body= | P29: of:=[.P$2] -> Az alábbi fejezet lefordítása angolról magyarra | Q29: of:=[.Q$2] -> %3A%0A-  | R29: of:=[.R$2] -> Téma | S29: of:=[.S$2] -> %3A%20 | T29: Uninstalling Unused Modules | U29: of:=[.U$2] -> %20( | V29: of:=[.V$2] -> angolul | W29: of:=[.W$2] -> %3A%20 | X29: Uninstalling Unused Modules | Y29: of:=[.Y$2] -> )%0A-%20 | Z29: of:=[.Z$2] -> Fejezet | AA29: of:=[.AA$2] -> %3A%20 | AB29: Basic Site Configuration | AC29: of:=[.AC$2] -> %20( | AD29: of:=[.AD$2] -> angolul | AE29: of:=[.AE$2] -> %3A%20 | AF29: Basic Site Configuration | AG29: of:=[.AG$2] -> )%0A-%20 | AH29: of:=[.AH$2] -> Fájlnév | AI29: of:=[.AI$2] -> %3A%20 | AJ29: config-uninstall.txt | AK29: of:=[.AK$2] -> %0A%0A | AL29: of:=[.AL$2] -> Minden szükséges tudnivalót ebben a leírásban találsz | AM29: of:=[.AM$2] -> %3A%20 | AN29: of:=[.AN$2] -> https://userguide_new-drupal.dev.devdrupal.org/guidelines/instructions.html#practicalities-translating | AO29: of:=[.AO$2] -> "> | AP29: 28 | AQ29: of:=[.AQ$2] -> .  | AR29: config-uninstall.txt | AS29: of:=[.AS$2] -> </A>
A30: of:=[.A$2] -> <DT><A LAST_CHARSET="UTF-8" HREF="https://www.drupal.org/node/add/project-issue/ | B30: of:=[.B$2] -> user_guide | C30: of:=[.C$2] -> ?categories= | D30: of:=[.D$2] -> 2 | E30: of:=[.E$2] -> &component= | F30: of:=[.F$2] -> HU translation | G30: of:=[.G$2] -> &version= | H30: of:=[.H$2] -> 8.x-2.x-dev | I30: of:=[.I$2] -> &title=[ | J30: of:=[.J$2] -> HU | K30: of:=[.K$2] -> ]%20 | L30: of:=[.L$2] -> Forrásfájl lefordítása magyarra: | M30: of:=[.M$2] -> %20 | N30: config-user.txt | O30: of:=[.O$2] -> &body= | P30: of:=[.P$2] -> Az alábbi fejezet lefordítása angolról magyarra | Q30: of:=[.Q$2] -> %3A%0A-  | R30: of:=[.R$2] -> Téma | S30: of:=[.S$2] -> %3A%20 | T30: Configuring User Account Settings | U30: of:=[.U$2] -> %20( | V30: of:=[.V$2] -> angolul | W30: of:=[.W$2] -> %3A%20 | X30: Configuring User Account Settings | Y30: of:=[.Y$2] -> )%0A-%20 | Z30: of:=[.Z$2] -> Fejezet | AA30: of:=[.AA$2] -> %3A%20 | AB30: Basic Site Configuration | AC30: of:=[.AC$2] -> %20( | AD30: of:=[.AD$2] -> angolul | AE30: of:=[.AE$2] -> %3A%20 | AF30: Basic Site Configuration | AG30: of:=[.AG$2] -> )%0A-%20 | AH30: of:=[.AH$2] -> Fájlnév | AI30: of:=[.AI$2] -> %3A%20 | AJ30: config-user.txt | AK30: of:=[.AK$2] -> %0A%0A | AL30: of:=[.AL$2] -> Minden szükséges tudnivalót ebben a leírásban találsz | AM30: of:=[.AM$2] -> %3A%20 | AN30: of:=[.AN$2] -> https://userguide_new-drupal.dev.devdrupal.org/guidelines/instructions.html#practicalities-translating | AO30: of:=[.AO$2] -> "> | AP30: 29 | AQ30: of:=[.AQ$2] -> .  | AR30: config-user.txt | AS30: of:=[.AS$2] -> </A>
A31: of:=[.A$2] -> <DT><A LAST_CHARSET="UTF-8" HREF="https://www.drupal.org/node/add/project-issue/ | B31: of:=[.B$2] -> user_guide | C31: of:=[.C$2] -> ?categories= | D31: of:=[.D$2] -> 2 | E31: of:=[.E$2] -> &component= | F31: of:=[.F$2] -> HU translation | G31: of:=[.G$2] -> &version= | H31: of:=[.H$2] -> 8.x-2.x-dev | I31: of:=[.I$2] -> &title=[ | J31: of:=[.J$2] -> HU | K31: of:=[.K$2] -> ]%20 | L31: of:=[.L$2] -> Forrásfájl lefordítása magyarra: | M31: of:=[.M$2] -> %20 | N31: config-theme.txt | O31: of:=[.O$2] -> &body= | P31: of:=[.P$2] -> Az alábbi fejezet lefordítása angolról magyarra | Q31: of:=[.Q$2] -> %3A%0A-  | R31: of:=[.R$2] -> Téma | S31: of:=[.S$2] -> %3A%20 | T31: Configuring the Theme | U31: of:=[.U$2] -> %20( | V31: of:=[.V$2] -> angolul | W31: of:=[.W$2] -> %3A%20 | X31: Configuring the Theme | Y31: of:=[.Y$2] -> )%0A-%20 | Z31: of:=[.Z$2] -> Fejezet | AA31: of:=[.AA$2] -> %3A%20 | AB31: Basic Site Configuration | AC31: of:=[.AC$2] -> %20( | AD31: of:=[.AD$2] -> angolul | AE31: of:=[.AE$2] -> %3A%20 | AF31: Basic Site Configuration | AG31: of:=[.AG$2] -> )%0A-%20 | AH31: of:=[.AH$2] -> Fájlnév | AI31: of:=[.AI$2] -> %3A%20 | AJ31: config-theme.txt | AK31: of:=[.AK$2] -> %0A%0A | AL31: of:=[.AL$2] -> Minden szükséges tudnivalót ebben a leírásban találsz | AM31: of:=[.AM$2] -> %3A%20 | AN31: of:=[.AN$2] -> https://userguide_new-drupal.dev.devdrupal.org/guidelines/instructions.html#practicalities-translating | AO31: of:=[.AO$2] -> "> | AP31: 30 | AQ31: of:=[.AQ$2] -> .  | AR31: config-theme.txt | AS31: of:=[.AS$2] -> </A>
A32: of:=[.A$2] -> <DT><A LAST_CHARSET="UTF-8" HREF="https://www.drupal.org/node/add/project-issue/ | B32: of:=[.B$2] -> user_guide | C32: of:=[.C$2] -> ?categories= | D32: of:=[.D$2] -> 2 | E32: of:=[.E$2] -> &component= | F32: of:=[.F$2] -> HU translation | G32: of:=[.G$2] -> &version= | H32: of:=[.H$2] -> 8.x-2.x-dev | I32: of:=[.I$2] -> &title=[ | J32: of:=[.J$2] -> HU | K32: of:=[.K$2] -> ]%20 | L32: of:=[.L$2] -> Forrásfájl lefordítása magyarra: | M32: of:=[.M$2] -> %20 | N32: content-paths.txt | O32: of:=[.O$2] -> &body= | P32: of:=[.P$2] -> Az alábbi fejezet lefordítása angolról magyarra | Q32: of:=[.Q$2] -> %3A%0A-  | R32: of:=[.R$2] -> Téma | S32: of:=[.S$2] -> %3A%20 | T32: Concept: Paths, Aliases, and URLs | U32: of:=[.U$2] -> %20( | V32: of:=[.V$2] -> angolul | W32: of:=[.W$2] -> %3A%20 | X32: Concept: Paths, Aliases, and URLs | Y32: of:=[.Y$2] -> )%0A-%20 | Z32: of:=[.Z$2] -> Fejezet | AA32: of:=[.AA$2] -> %3A%20 | AB32: Basic Page Management | AC32: of:=[.AC$2] -> %20( | AD32: of:=[.AD$2] -> angolul | AE32: of:=[.AE$2] -> %3A%20 | AF32: Basic Page Management | AG32: of:=[.AG$2] -> )%0A-%20 | AH32: of:=[.AH$2] -> Fájlnév | AI32: of:=[.AI$2] -> %3A%20 | AJ32: content-paths.txt | AK32: of:=[.AK$2] -> %0A%0A | AL32: of:=[.AL$2] -> Minden szükséges tudnivalót ebben a leírásban találsz | AM32: of:=[.AM$2] -> %3A%20 | AN32: of:=[.AN$2] -> https://userguide_new-drupal.dev.devdrupal.org/guidelines/instructions.html#practicalities-translating | AO32: of:=[.AO$2] -> "> | AP32: 31 | AQ32: of:=[.AQ$2] -> .  | AR32: content-paths.txt | AS32: of:=[.AS$2] -> </A>
A33: of:=[.A$2] -> <DT><A LAST_CHARSET="UTF-8" HREF="https://www.drupal.org/node/add/project-issue/ | B33: of:=[.B$2] -> user_guide | C33: of:=[.C$2] -> ?categories= | D33: of:=[.D$2] -> 2 | E33: of:=[.E$2] -> &component= | F33: of:=[.F$2] -> HU translation | G33: of:=[.G$2] -> &version= | H33: of:=[.H$2] -> 8.x-2.x-dev | I33: of:=[.I$2] -> &title=[ | J33: of:=[.J$2] -> HU | K33: of:=[.K$2] -> ]%20 | L33: of:=[.L$2] -> Forrásfájl lefordítása magyarra: | M33: of:=[.M$2] -> %20 | N33: content-create.txt | O33: of:=[.O$2] -> &body= | P33: of:=[.P$2] -> Az alábbi fejezet lefordítása angolról magyarra | Q33: of:=[.Q$2] -> %3A%0A-  | R33: of:=[.R$2] -> Téma | S33: of:=[.S$2] -> %3A%20 | T33: Creating a Content Item | U33: of:=[.U$2] -> %20( | V33: of:=[.V$2] -> angolul | W33: of:=[.W$2] -> %3A%20 | X33: Creating a Content Item | Y33: of:=[.Y$2] -> )%0A-%20 | Z33: of:=[.Z$2] -> Fejezet | AA33: of:=[.AA$2] -> %3A%20 | AB33: Basic Page Management | AC33: of:=[.AC$2] -> %20( | AD33: of:=[.AD$2] -> angolul | AE33: of:=[.AE$2] -> %3A%20 | AF33: Basic Page Management | AG33: of:=[.AG$2] -> )%0A-%20 | AH33: of:=[.AH$2] -> Fájlnév | AI33: of:=[.AI$2] -> %3A%20 | AJ33: content-create.txt | AK33: of:=[.AK$2] -> %0A%0A | AL33: of:=[.AL$2] -> Minden szükséges tudnivalót ebben a leírásban találsz | AM33: of:=[.AM$2] -> %3A%20 | AN33: of:=[.AN$2] -> https://userguide_new-drupal.dev.devdrupal.org/guidelines/instructions.html#practicalities-translating | AO33: of:=[.AO$2] -> "> | AP33: 32 | AQ33: of:=[.AQ$2] -> .  | AR33: content-create.txt | AS33: of:=[.AS$2] -> </A>
A34: of:=[.A$2] -> <DT><A LAST_CHARSET="UTF-8" HREF="https://www.drupal.org/node/add/project-issue/ | B34: of:=[.B$2] -> user_guide | C34: of:=[.C$2] -> ?categories= | D34: of:=[.D$2] -> 2 | E34: of:=[.E$2] -> &component= | F34: of:=[.F$2] -> HU translation | G34: of:=[.G$2] -> &version= | H34: of:=[.H$2] -> 8.x-2.x-dev | I34: of:=[.I$2] -> &title=[ | J34: of:=[.J$2] -> HU | K34: of:=[.K$2] -> ]%20 | L34: of:=[.L$2] -> Forrásfájl lefordítása magyarra: | M34: of:=[.M$2] -> %20 | N34: content-edit.txt | O34: of:=[.O$2] -> &body= | P34: of:=[.P$2] -> Az alábbi fejezet lefordítása angolról magyarra | Q34: of:=[.Q$2] -> %3A%0A-  | R34: of:=[.R$2] -> Téma | S34: of:=[.S$2] -> %3A%20 | T34: Editing a Content Item | U34: of:=[.U$2] -> %20( | V34: of:=[.V$2] -> angolul | W34: of:=[.W$2] -> %3A%20 | X34: Editing a Content Item | Y34: of:=[.Y$2] -> )%0A-%20 | Z34: of:=[.Z$2] -> Fejezet | AA34: of:=[.AA$2] -> %3A%20 | AB34: Basic Page Management | AC34: of:=[.AC$2] -> %20( | AD34: of:=[.AD$2] -> angolul | AE34: of:=[.AE$2] -> %3A%20 | AF34: Basic Page Management | AG34: of:=[.AG$2] -> )%0A-%20 | AH34: of:=[.AH$2] -> Fájlnév | AI34: of:=[.AI$2] -> %3A%20 | AJ34: content-edit.txt | AK34: of:=[.AK$2] -> %0A%0A | AL34: of:=[.AL$2] -> Minden szükséges tudnivalót ebben a leírásban találsz | AM34: of:=[.AM$2] -> %3A%20 | AN34: of:=[.AN$2] -> https://userguide_new-drupal.dev.devdrupal.org/guidelines/instructions.html#practicalities-translating | AO34: of:=[.AO$2] -> "> | AP34: 33 | AQ34: of:=[.AQ$2] -> .  | AR34: content-edit.txt | AS34: of:=[.AS$2] -> </A>
A35: of:=[.A$2] -> <DT><A LAST_CHARSET="UTF-8" HREF="https://www.drupal.org/node/add/project-issue/ | B35: of:=[.B$2] -> user_guide | C35: of:=[.C$2] -> ?categories= | D35: of:=[.D$2] -> 2 | E35: of:=[.E$2] -> &component= | F35: of:=[.F$2] -> HU translation | G35: of:=[.G$2] -> &version= | H35: of:=[.H$2] -> 8.x-2.x-dev | I35: of:=[.I$2] -> &title=[ | J35: of:=[.J$2] -> HU | K35: of:=[.K$2] -> ]%20 | L35: of:=[.L$2] -> Forrásfájl lefordítása magyarra: | M35: of:=[.M$2] -> %20 | N35: content-in-place-edit.txt | O35: of:=[.O$2] -> &body= | P35: of:=[.P$2] -> Az alábbi fejezet lefordítása angolról magyarra | Q35: of:=[.Q$2] -> %3A%0A-  | R35: of:=[.R$2] -> Téma | S35: of:=[.S$2] -> %3A%20 | T35: Editing with the In-Place Editor | U35: of:=[.U$2] -> %20( | V35: of:=[.V$2] -> angolul | W35: of:=[.W$2] -> %3A%20 | X35: Editing with the In-Place Editor | Y35: of:=[.Y$2] -> )%0A-%20 | Z35: of:=[.Z$2] -> Fejezet | AA35: of:=[.AA$2] -> %3A%20 | AB35: Basic Page Management | AC35: of:=[.AC$2] -> %20( | AD35: of:=[.AD$2] -> angolul | AE35: of:=[.AE$2] -> %3A%20 | AF35: Basic Page Management | AG35: of:=[.AG$2] -> )%0A-%20 | AH35: of:=[.AH$2] -> Fájlnév | AI35: of:=[.AI$2] -> %3A%20 | AJ35: content-in-place-edit.txt | AK35: of:=[.AK$2] -> %0A%0A | AL35: of:=[.AL$2] -> Minden szükséges tudnivalót ebben a leírásban találsz | AM35: of:=[.AM$2] -> %3A%20 | AN35: of:=[.AN$2] -> https://userguide_new-drupal.dev.devdrupal.org/guidelines/instructions.html#practicalities-translating | AO35: of:=[.AO$2] -> "> | AP35: 34 | AQ35: of:=[.AQ$2] -> .  | AR35: content-in-place-edit.txt | AS35: of:=[.AS$2] -> </A>
A36: of:=[.A$2] -> <DT><A LAST_CHARSET="UTF-8" HREF="https://www.drupal.org/node/add/project-issue/ | B36: of:=[.B$2] -> user_guide | C36: of:=[.C$2] -> ?categories= | D36: of:=[.D$2] -> 2 | E36: of:=[.E$2] -> &component= | F36: of:=[.F$2] -> HU translation | G36: of:=[.G$2] -> &version= | H36: of:=[.H$2] -> 8.x-2.x-dev | I36: of:=[.I$2] -> &title=[ | J36: of:=[.J$2] -> HU | K36: of:=[.K$2] -> ]%20 | L36: of:=[.L$2] -> Forrásfájl lefordítása magyarra: | M36: of:=[.M$2] -> %20 | N36: menu-home.txt | O36: of:=[.O$2] -> &body= | P36: of:=[.P$2] -> Az alábbi fejezet lefordítása angolról magyarra | Q36: of:=[.Q$2] -> %3A%0A-  | R36: of:=[.R$2] -> Téma | S36: of:=[.S$2] -> %3A%20 | T36: Designating a Front Page for your Site | U36: of:=[.U$2] -> %20( | V36: of:=[.V$2] -> angolul | W36: of:=[.W$2] -> %3A%20 | X36: Designating a Front Page for your Site | Y36: of:=[.Y$2] -> )%0A-%20 | Z36: of:=[.Z$2] -> Fejezet | AA36: of:=[.AA$2] -> %3A%20 | AB36: Basic Page Management | AC36: of:=[.AC$2] -> %20( | AD36: of:=[.AD$2] -> angolul | AE36: of:=[.AE$2] -> %3A%20 | AF36: Basic Page Management | AG36: of:=[.AG$2] -> )%0A-%20 | AH36: of:=[.AH$2] -> Fájlnév | AI36: of:=[.AI$2] -> %3A%20 | AJ36: menu-home.txt | AK36: of:=[.AK$2] -> %0A%0A | AL36: of:=[.AL$2] -> Minden szükséges tudnivalót ebben a leírásban találsz | AM36: of:=[.AM$2] -> %3A%20 | AN36: of:=[.AN$2] -> https://userguide_new-drupal.dev.devdrupal.org/guidelines/instructions.html#practicalities-translating | AO36: of:=[.AO$2] -> "> | AP36: 35 | AQ36: of:=[.AQ$2] -> .  | AR36: menu-home.txt | AS36: of:=[.AS$2] -> </A>
A37: of:=[.A$2] -> <DT><A LAST_CHARSET="UTF-8" HREF="https://www.drupal.org/node/add/project-issue/ | B37: of:=[.B$2] -> user_guide | C37: of:=[.C$2] -> ?categories= | D37: of:=[.D$2] -> 2 | E37: of:=[.E$2] -> &component= | F37: of:=[.F$2] -> HU translation | G37: of:=[.G$2] -> &version= | H37: of:=[.H$2] -> 8.x-2.x-dev | I37: of:=[.I$2] -> &title=[ | J37: of:=[.J$2] -> HU | K37: of:=[.K$2] -> ]%20 | L37: of:=[.L$2] -> Forrásfájl lefordítása magyarra: | M37: of:=[.M$2] -> %20 | N37: menu-concept.txt | O37: of:=[.O$2] -> &body= | P37: of:=[.P$2] -> Az alábbi fejezet lefordítása angolról magyarra | Q37: of:=[.Q$2] -> %3A%0A-  | R37: of:=[.R$2] -> Téma | S37: of:=[.S$2] -> %3A%20 | T37: Concept: Menu | U37: of:=[.U$2] -> %20( | V37: of:=[.V$2] -> angolul | W37: of:=[.W$2] -> %3A%20 | X37: Concept: Menu | Y37: of:=[.Y$2] -> )%0A-%20 | Z37: of:=[.Z$2] -> Fejezet | AA37: of:=[.AA$2] -> %3A%20 | AB37: Basic Page Management | AC37: of:=[.AC$2] -> %20( | AD37: of:=[.AD$2] -> angolul | AE37: of:=[.AE$2] -> %3A%20 | AF37: Basic Page Management | AG37: of:=[.AG$2] -> )%0A-%20 | AH37: of:=[.AH$2] -> Fájlnév | AI37: of:=[.AI$2] -> %3A%20 | AJ37: menu-concept.txt | AK37: of:=[.AK$2] -> %0A%0A | AL37: of:=[.AL$2] -> Minden szükséges tudnivalót ebben a leírásban találsz | AM37: of:=[.AM$2] -> %3A%20 | AN37: of:=[.AN$2] -> https://userguide_new-drupal.dev.devdrupal.org/guidelines/instructions.html#practicalities-translating | AO37: of:=[.AO$2] -> "> | AP37: 36 | AQ37: of:=[.AQ$2] -> .  | AR37: menu-concept.txt | AS37: of:=[.AS$2] -> </A>
A38: of:=[.A$2] -> <DT><A LAST_CHARSET="UTF-8" HREF="https://www.drupal.org/node/add/project-issue/ | B38: of:=[.B$2] -> user_guide | C38: of:=[.C$2] -> ?categories= | D38: of:=[.D$2] -> 2 | E38: of:=[.E$2] -> &component= | F38: of:=[.F$2] -> HU translation | G38: of:=[.G$2] -> &version= | H38: of:=[.H$2] -> 8.x-2.x-dev | I38: of:=[.I$2] -> &title=[ | J38: of:=[.J$2] -> HU | K38: of:=[.K$2] -> ]%20 | L38: of:=[.L$2] -> Forrásfájl lefordítása magyarra: | M38: of:=[.M$2] -> %20 | N38: menu-link-from-content.txt | O38: of:=[.O$2] -> &body= | P38: of:=[.P$2] -> Az alábbi fejezet lefordítása angolról magyarra | Q38: of:=[.Q$2] -> %3A%0A-  | R38: of:=[.R$2] -> Téma | S38: of:=[.S$2] -> %3A%20 | T38: Adding a Page to the Navigation | U38: of:=[.U$2] -> %20( | V38: of:=[.V$2] -> angolul | W38: of:=[.W$2] -> %3A%20 | X38: Adding a Page to the Navigation | Y38: of:=[.Y$2] -> )%0A-%20 | Z38: of:=[.Z$2] -> Fejezet | AA38: of:=[.AA$2] -> %3A%20 | AB38: Basic Page Management | AC38: of:=[.AC$2] -> %20( | AD38: of:=[.AD$2] -> angolul | AE38: of:=[.AE$2] -> %3A%20 | AF38: Basic Page Management | AG38: of:=[.AG$2] -> )%0A-%20 | AH38: of:=[.AH$2] -> Fájlnév | AI38: of:=[.AI$2] -> %3A%20 | AJ38: menu-link-from-content.txt | AK38: of:=[.AK$2] -> %0A%0A | AL38: of:=[.AL$2] -> Minden szükséges tudnivalót ebben a leírásban találsz | AM38: of:=[.AM$2] -> %3A%20 | AN38: of:=[.AN$2] -> https://userguide_new-drupal.dev.devdrupal.org/guidelines/instructions.html#practicalities-translating | AO38: of:=[.AO$2] -> "> | AP38: 37 | AQ38: of:=[.AQ$2] -> .  | AR38: menu-link-from-content.txt | AS38: of:=[.AS$2] -> </A>
A39: of:=[.A$2] -> <DT><A LAST_CHARSET="UTF-8" HREF="https://www.drupal.org/node/add/project-issue/ | B39: of:=[.B$2] -> user_guide | C39: of:=[.C$2] -> ?categories= | D39: of:=[.D$2] -> 2 | E39: of:=[.E$2] -> &component= | F39: of:=[.F$2] -> HU translation | G39: of:=[.G$2] -> &version= | H39: of:=[.H$2] -> 8.x-2.x-dev | I39: of:=[.I$2] -> &title=[ | J39: of:=[.J$2] -> HU | K39: of:=[.K$2] -> ]%20 | L39: of:=[.L$2] -> Forrásfájl lefordítása magyarra: | M39: of:=[.M$2] -> %20 | N39: menu-reorder.txt | O39: of:=[.O$2] -> &body= | P39: of:=[.P$2] -> Az alábbi fejezet lefordítása angolról magyarra | Q39: of:=[.Q$2] -> %3A%0A-  | R39: of:=[.R$2] -> Téma | S39: of:=[.S$2] -> %3A%20 | T39: Changing the Order of Navigation | U39: of:=[.U$2] -> %20( | V39: of:=[.V$2] -> angolul | W39: of:=[.W$2] -> %3A%20 | X39: Changing the Order of Navigation | Y39: of:=[.Y$2] -> )%0A-%20 | Z39: of:=[.Z$2] -> Fejezet | AA39: of:=[.AA$2] -> %3A%20 | AB39: Basic Page Management | AC39: of:=[.AC$2] -> %20( | AD39: of:=[.AD$2] -> angolul | AE39: of:=[.AE$2] -> %3A%20 | AF39: Basic Page Management | AG39: of:=[.AG$2] -> )%0A-%20 | AH39: of:=[.AH$2] -> Fájlnév | AI39: of:=[.AI$2] -> %3A%20 | AJ39: menu-reorder.txt | AK39: of:=[.AK$2] -> %0A%0A | AL39: of:=[.AL$2] -> Minden szükséges tudnivalót ebben a leírásban találsz | AM39: of:=[.AM$2] -> %3A%20 | AN39: of:=[.AN$2] -> https://userguide_new-drupal.dev.devdrupal.org/guidelines/instructions.html#practicalities-translating | AO39: of:=[.AO$2] -> "> | AP39: 38 | AQ39: of:=[.AQ$2] -> .  | AR39: menu-reorder.txt | AS39: of:=[.AS$2] -> </A>
A40: of:=[.A$2] -> <DT><A LAST_CHARSET="UTF-8" HREF="https://www.drupal.org/node/add/project-issue/ | B40: of:=[.B$2] -> user_guide | C40: of:=[.C$2] -> ?categories= | D40: of:=[.D$2] -> 2 | E40: of:=[.E$2] -> &component= | F40: of:=[.F$2] -> HU translation | G40: of:=[.G$2] -> &version= | H40: of:=[.H$2] -> 8.x-2.x-dev | I40: of:=[.I$2] -> &title=[ | J40: of:=[.J$2] -> HU | K40: of:=[.K$2] -> ]%20 | L40: of:=[.L$2] -> Forrásfájl lefordítása magyarra: | M40: of:=[.M$2] -> %20 | N40: structure-content-type.txt | O40: of:=[.O$2] -> &body= | P40: of:=[.P$2] -> Az alábbi fejezet lefordítása angolról magyarra | Q40: of:=[.Q$2] -> %3A%0A-  | R40: of:=[.R$2] -> Téma | S40: of:=[.S$2] -> %3A%20 | T40: Adding a Content Type | U40: of:=[.U$2] -> %20( | V40: of:=[.V$2] -> angolul | W40: of:=[.W$2] -> %3A%20 | X40: Adding a Content Type | Y40: of:=[.Y$2] -> )%0A-%20 | Z40: of:=[.Z$2] -> Fejezet | AA40: of:=[.AA$2] -> %3A%20 | AB40: Setting Up Content Structure | AC40: of:=[.AC$2] -> %20( | AD40: of:=[.AD$2] -> angolul | AE40: of:=[.AE$2] -> %3A%20 | AF40: Setting Up Content Structure | AG40: of:=[.AG$2] -> )%0A-%20 | AH40: of:=[.AH$2] -> Fájlnév | AI40: of:=[.AI$2] -> %3A%20 | AJ40: structure-content-type.txt | AK40: of:=[.AK$2] -> %0A%0A | AL40: of:=[.AL$2] -> Minden szükséges tudnivalót ebben a leírásban találsz | AM40: of:=[.AM$2] -> %3A%20 | AN40: of:=[.AN$2] -> https://userguide_new-drupal.dev.devdrupal.org/guidelines/instructions.html#practicalities-translating | AO40: of:=[.AO$2] -> "> | AP40: 39 | AQ40: of:=[.AQ$2] -> .  | AR40: structure-content-type.txt | AS40: of:=[.AS$2] -> </A>
A41: of:=[.A$2] -> <DT><A LAST_CHARSET="UTF-8" HREF="https://www.drupal.org/node/add/project-issue/ | B41: of:=[.B$2] -> user_guide | C41: of:=[.C$2] -> ?categories= | D41: of:=[.D$2] -> 2 | E41: of:=[.E$2] -> &component= | F41: of:=[.F$2] -> HU translation | G41: of:=[.G$2] -> &version= | H41: of:=[.H$2] -> 8.x-2.x-dev | I41: of:=[.I$2] -> &title=[ | J41: of:=[.J$2] -> HU | K41: of:=[.K$2] -> ]%20 | L41: of:=[.L$2] -> Forrásfájl lefordítása magyarra: | M41: of:=[.M$2] -> %20 | N41: structure-content-type-delete.txt | O41: of:=[.O$2] -> &body= | P41: of:=[.P$2] -> Az alábbi fejezet lefordítása angolról magyarra | Q41: of:=[.Q$2] -> %3A%0A-  | R41: of:=[.R$2] -> Téma | S41: of:=[.S$2] -> %3A%20 | T41: Deleting a Content Type | U41: of:=[.U$2] -> %20( | V41: of:=[.V$2] -> angolul | W41: of:=[.W$2] -> %3A%20 | X41: Deleting a Content Type | Y41: of:=[.Y$2] -> )%0A-%20 | Z41: of:=[.Z$2] -> Fejezet | AA41: of:=[.AA$2] -> %3A%20 | AB41: Setting Up Content Structure | AC41: of:=[.AC$2] -> %20( | AD41: of:=[.AD$2] -> angolul | AE41: of:=[.AE$2] -> %3A%20 | AF41: Setting Up Content Structure | AG41: of:=[.AG$2] -> )%0A-%20 | AH41: of:=[.AH$2] -> Fájlnév | AI41: of:=[.AI$2] -> %3A%20 | AJ41: structure-content-type-delete.txt | AK41: of:=[.AK$2] -> %0A%0A | AL41: of:=[.AL$2] -> Minden szükséges tudnivalót ebben a leírásban találsz | AM41: of:=[.AM$2] -> %3A%20 | AN41: of:=[.AN$2] -> https://userguide_new-drupal.dev.devdrupal.org/guidelines/instructions.html#practicalities-translating | AO41: of:=[.AO$2] -> "> | AP41: 40 | AQ41: of:=[.AQ$2] -> .  | AR41: structure-content-type-delete.txt | AS41: of:=[.AS$2] -> </A>
A42: of:=[.A$2] -> <DT><A LAST_CHARSET="UTF-8" HREF="https://www.drupal.org/node/add/project-issue/ | B42: of:=[.B$2] -> user_guide | C42: of:=[.C$2] -> ?categories= | D42: of:=[.D$2] -> 2 | E42: of:=[.E$2] -> &component= | F42: of:=[.F$2] -> HU translation | G42: of:=[.G$2] -> &version= | H42: of:=[.H$2] -> 8.x-2.x-dev | I42: of:=[.I$2] -> &title=[ | J42: of:=[.J$2] -> HU | K42: of:=[.K$2] -> ]%20 | L42: of:=[.L$2] -> Forrásfájl lefordítása magyarra: | M42: of:=[.M$2] -> %20 | N42: structure-fields.txt | O42: of:=[.O$2] -> &body= | P42: of:=[.P$2] -> Az alábbi fejezet lefordítása angolról magyarra | Q42: of:=[.Q$2] -> %3A%0A-  | R42: of:=[.R$2] -> Téma | S42: of:=[.S$2] -> %3A%20 | T42: Adding Basic Fields to a Content Type | U42: of:=[.U$2] -> %20( | V42: of:=[.V$2] -> angolul | W42: of:=[.W$2] -> %3A%20 | X42: Adding Basic Fields to a Content Type | Y42: of:=[.Y$2] -> )%0A-%20 | Z42: of:=[.Z$2] -> Fejezet | AA42: of:=[.AA$2] -> %3A%20 | AB42: Setting Up Content Structure | AC42: of:=[.AC$2] -> %20( | AD42: of:=[.AD$2] -> angolul | AE42: of:=[.AE$2] -> %3A%20 | AF42: Setting Up Content Structure | AG42: of:=[.AG$2] -> )%0A-%20 | AH42: of:=[.AH$2] -> Fájlnév | AI42: of:=[.AI$2] -> %3A%20 | AJ42: structure-fields.txt | AK42: of:=[.AK$2] -> %0A%0A | AL42: of:=[.AL$2] -> Minden szükséges tudnivalót ebben a leírásban találsz | AM42: of:=[.AM$2] -> %3A%20 | AN42: of:=[.AN$2] -> https://userguide_new-drupal.dev.devdrupal.org/guidelines/instructions.html#practicalities-translating | AO42: of:=[.AO$2] -> "> | AP42: 41 | AQ42: of:=[.AQ$2] -> .  | AR42: structure-fields.txt | AS42: of:=[.AS$2] -> </A>
A43: of:=[.A$2] -> <DT><A LAST_CHARSET="UTF-8" HREF="https://www.drupal.org/node/add/project-issue/ | B43: of:=[.B$2] -> user_guide | C43: of:=[.C$2] -> ?categories= | D43: of:=[.D$2] -> 2 | E43: of:=[.E$2] -> &component= | F43: of:=[.F$2] -> HU translation | G43: of:=[.G$2] -> &version= | H43: of:=[.H$2] -> 8.x-2.x-dev | I43: of:=[.I$2] -> &title=[ | J43: of:=[.J$2] -> HU | K43: of:=[.K$2] -> ]%20 | L43: of:=[.L$2] -> Forrásfájl lefordítása magyarra: | M43: of:=[.M$2] -> %20 | N43: structure-reference-fields.txt | O43: of:=[.O$2] -> &body= | P43: of:=[.P$2] -> Az alábbi fejezet lefordítása angolról magyarra | Q43: of:=[.Q$2] -> %3A%0A-  | R43: of:=[.R$2] -> Téma | S43: of:=[.S$2] -> %3A%20 | T43: Concept: Reference Fields | U43: of:=[.U$2] -> %20( | V43: of:=[.V$2] -> angolul | W43: of:=[.W$2] -> %3A%20 | X43: Concept: Reference Fields | Y43: of:=[.Y$2] -> )%0A-%20 | Z43: of:=[.Z$2] -> Fejezet | AA43: of:=[.AA$2] -> %3A%20 | AB43: Setting Up Content Structure | AC43: of:=[.AC$2] -> %20( | AD43: of:=[.AD$2] -> angolul | AE43: of:=[.AE$2] -> %3A%20 | AF43: Setting Up Content Structure | AG43: of:=[.AG$2] -> )%0A-%20 | AH43: of:=[.AH$2] -> Fájlnév | AI43: of:=[.AI$2] -> %3A%20 | AJ43: structure-reference-fields.txt | AK43: of:=[.AK$2] -> %0A%0A | AL43: of:=[.AL$2] -> Minden szükséges tudnivalót ebben a leírásban találsz | AM43: of:=[.AM$2] -> %3A%20 | AN43: of:=[.AN$2] -> https://userguide_new-drupal.dev.devdrupal.org/guidelines/instructions.html#practicalities-translating | AO43: of:=[.AO$2] -> "> | AP43: 42 | AQ43: of:=[.AQ$2] -> .  | AR43: structure-reference-fields.txt | AS43: of:=[.AS$2] -> </A>
A44: of:=[.A$2] -> <DT><A LAST_CHARSET="UTF-8" HREF="https://www.drupal.org/node/add/project-issue/ | B44: of:=[.B$2] -> user_guide | C44: of:=[.C$2] -> ?categories= | D44: of:=[.D$2] -> 2 | E44: of:=[.E$2] -> &component= | F44: of:=[.F$2] -> HU translation | G44: of:=[.G$2] -> &version= | H44: of:=[.H$2] -> 8.x-2.x-dev | I44: of:=[.I$2] -> &title=[ | J44: of:=[.J$2] -> HU | K44: of:=[.K$2] -> ]%20 | L44: of:=[.L$2] -> Forrásfájl lefordítása magyarra: | M44: of:=[.M$2] -> %20 | N44: structure-taxonomy.txt | O44: of:=[.O$2] -> &body= | P44: of:=[.P$2] -> Az alábbi fejezet lefordítása angolról magyarra | Q44: of:=[.Q$2] -> %3A%0A-  | R44: of:=[.R$2] -> Téma | S44: of:=[.S$2] -> %3A%20 | T44: Concept: Taxonomy | U44: of:=[.U$2] -> %20( | V44: of:=[.V$2] -> angolul | W44: of:=[.W$2] -> %3A%20 | X44: Concept: Taxonomy | Y44: of:=[.Y$2] -> )%0A-%20 | Z44: of:=[.Z$2] -> Fejezet | AA44: of:=[.AA$2] -> %3A%20 | AB44: Setting Up Content Structure | AC44: of:=[.AC$2] -> %20( | AD44: of:=[.AD$2] -> angolul | AE44: of:=[.AE$2] -> %3A%20 | AF44: Setting Up Content Structure | AG44: of:=[.AG$2] -> )%0A-%20 | AH44: of:=[.AH$2] -> Fájlnév | AI44: of:=[.AI$2] -> %3A%20 | AJ44: structure-taxonomy.txt | AK44: of:=[.AK$2] -> %0A%0A | AL44: of:=[.AL$2] -> Minden szükséges tudnivalót ebben a leírásban találsz | AM44: of:=[.AM$2] -> %3A%20 | AN44: of:=[.AN$2] -> https://userguide_new-drupal.dev.devdrupal.org/guidelines/instructions.html#practicalities-translating | AO44: of:=[.AO$2] -> "> | AP44: 43 | AQ44: of:=[.AQ$2] -> .  | AR44: structure-taxonomy.txt | AS44: of:=[.AS$2] -> </A>
A45: of:=[.A$2] -> <DT><A LAST_CHARSET="UTF-8" HREF="https://www.drupal.org/node/add/project-issue/ | B45: of:=[.B$2] -> user_guide | C45: of:=[.C$2] -> ?categories= | D45: of:=[.D$2] -> 2 | E45: of:=[.E$2] -> &component= | F45: of:=[.F$2] -> HU translation | G45: of:=[.G$2] -> &version= | H45: of:=[.H$2] -> 8.x-2.x-dev | I45: of:=[.I$2] -> &title=[ | J45: of:=[.J$2] -> HU | K45: of:=[.K$2] -> ]%20 | L45: of:=[.L$2] -> Forrásfájl lefordítása magyarra: | M45: of:=[.M$2] -> %20 | N45: structure-taxonomy-setup.txt | O45: of:=[.O$2] -> &body= | P45: of:=[.P$2] -> Az alábbi fejezet lefordítása angolról magyarra | Q45: of:=[.Q$2] -> %3A%0A-  | R45: of:=[.R$2] -> Téma | S45: of:=[.S$2] -> %3A%20 | T45: Setting Up a Taxonomy | U45: of:=[.U$2] -> %20( | V45: of:=[.V$2] -> angolul | W45: of:=[.W$2] -> %3A%20 | X45: Setting Up a Taxonomy | Y45: of:=[.Y$2] -> )%0A-%20 | Z45: of:=[.Z$2] -> Fejezet | AA45: of:=[.AA$2] -> %3A%20 | AB45: Setting Up Content Structure | AC45: of:=[.AC$2] -> %20( | AD45: of:=[.AD$2] -> angolul | AE45: of:=[.AE$2] -> %3A%20 | AF45: Setting Up Content Structure | AG45: of:=[.AG$2] -> )%0A-%20 | AH45: of:=[.AH$2] -> Fájlnév | AI45: of:=[.AI$2] -> %3A%20 | AJ45: structure-taxonomy-setup.txt | AK45: of:=[.AK$2] -> %0A%0A | AL45: of:=[.AL$2] -> Minden szükséges tudnivalót ebben a leírásban találsz | AM45: of:=[.AM$2] -> %3A%20 | AN45: of:=[.AN$2] -> https://userguide_new-drupal.dev.devdrupal.org/guidelines/instructions.html#practicalities-translating | AO45: of:=[.AO$2] -> "> | AP45: 44 | AQ45: of:=[.AQ$2] -> .  | AR45: structure-taxonomy-setup.txt | AS45: of:=[.AS$2] -> </A>
A46: of:=[.A$2] -> <DT><A LAST_CHARSET="UTF-8" HREF="https://www.drupal.org/node/add/project-issue/ | B46: of:=[.B$2] -> user_guide | C46: of:=[.C$2] -> ?categories= | D46: of:=[.D$2] -> 2 | E46: of:=[.E$2] -> &component= | F46: of:=[.F$2] -> HU translation | G46: of:=[.G$2] -> &version= | H46: of:=[.H$2] -> 8.x-2.x-dev | I46: of:=[.I$2] -> &title=[ | J46: of:=[.J$2] -> HU | K46: of:=[.K$2] -> ]%20 | L46: of:=[.L$2] -> Forrásfájl lefordítása magyarra: | M46: of:=[.M$2] -> %20 | N46: structure-adding-reference.txt | O46: of:=[.O$2] -> &body= | P46: of:=[.P$2] -> Az alábbi fejezet lefordítása angolról magyarra | Q46: of:=[.Q$2] -> %3A%0A-  | R46: of:=[.R$2] -> Téma | S46: of:=[.S$2] -> %3A%20 | T46: Adding a Reference Field | U46: of:=[.U$2] -> %20( | V46: of:=[.V$2] -> angolul | W46: of:=[.W$2] -> %3A%20 | X46: Adding a Reference Field | Y46: of:=[.Y$2] -> )%0A-%20 | Z46: of:=[.Z$2] -> Fejezet | AA46: of:=[.AA$2] -> %3A%20 | AB46: Setting Up Content Structure | AC46: of:=[.AC$2] -> %20( | AD46: of:=[.AD$2] -> angolul | AE46: of:=[.AE$2] -> %3A%20 | AF46: Setting Up Content Structure | AG46: of:=[.AG$2] -> )%0A-%20 | AH46: of:=[.AH$2] -> Fájlnév | AI46: of:=[.AI$2] -> %3A%20 | AJ46: structure-adding-reference.txt | AK46: of:=[.AK$2] -> %0A%0A | AL46: of:=[.AL$2] -> Minden szükséges tudnivalót ebben a leírásban találsz | AM46: of:=[.AM$2] -> %3A%20 | AN46: of:=[.AN$2] -> https://userguide_new-drupal.dev.devdrupal.org/guidelines/instructions.html#practicalities-translating | AO46: of:=[.AO$2] -> "> | AP46: 45 | AQ46: of:=[.AQ$2] -> .  | AR46: structure-adding-reference.txt | AS46: of:=[.AS$2] -> </A>
A47: of:=[.A$2] -> <DT><A LAST_CHARSET="UTF-8" HREF="https://www.drupal.org/node/add/project-issue/ | B47: of:=[.B$2] -> user_guide | C47: of:=[.C$2] -> ?categories= | D47: of:=[.D$2] -> 2 | E47: of:=[.E$2] -> &component= | F47: of:=[.F$2] -> HU translation | G47: of:=[.G$2] -> &version= | H47: of:=[.H$2] -> 8.x-2.x-dev | I47: of:=[.I$2] -> &title=[ | J47: of:=[.J$2] -> HU | K47: of:=[.K$2] -> ]%20 | L47: of:=[.L$2] -> Forrásfájl lefordítása magyarra: | M47: of:=[.M$2] -> %20 | N47: structure-widgets.txt | O47: of:=[.O$2] -> &body= | P47: of:=[.P$2] -> Az alábbi fejezet lefordítása angolról magyarra | Q47: of:=[.Q$2] -> %3A%0A-  | R47: of:=[.R$2] -> Téma | S47: of:=[.S$2] -> %3A%20 | T47: Concept: Forms and Widgets | U47: of:=[.U$2] -> %20( | V47: of:=[.V$2] -> angolul | W47: of:=[.W$2] -> %3A%20 | X47: Concept: Forms and Widgets | Y47: of:=[.Y$2] -> )%0A-%20 | Z47: of:=[.Z$2] -> Fejezet | AA47: of:=[.AA$2] -> %3A%20 | AB47: Setting Up Content Structure | AC47: of:=[.AC$2] -> %20( | AD47: of:=[.AD$2] -> angolul | AE47: of:=[.AE$2] -> %3A%20 | AF47: Setting Up Content Structure | AG47: of:=[.AG$2] -> )%0A-%20 | AH47: of:=[.AH$2] -> Fájlnév | AI47: of:=[.AI$2] -> %3A%20 | AJ47: structure-widgets.txt | AK47: of:=[.AK$2] -> %0A%0A | AL47: of:=[.AL$2] -> Minden szükséges tudnivalót ebben a leírásban találsz | AM47: of:=[.AM$2] -> %3A%20 | AN47: of:=[.AN$2] -> https://userguide_new-drupal.dev.devdrupal.org/guidelines/instructions.html#practicalities-translating | AO47: of:=[.AO$2] -> "> | AP47: 46 | AQ47: of:=[.AQ$2] -> .  | AR47: structure-widgets.txt | AS47: of:=[.AS$2] -> </A>
A48: of:=[.A$2] -> <DT><A LAST_CHARSET="UTF-8" HREF="https://www.drupal.org/node/add/project-issue/ | B48: of:=[.B$2] -> user_guide | C48: of:=[.C$2] -> ?categories= | D48: of:=[.D$2] -> 2 | E48: of:=[.E$2] -> &component= | F48: of:=[.F$2] -> HU translation | G48: of:=[.G$2] -> &version= | H48: of:=[.H$2] -> 8.x-2.x-dev | I48: of:=[.I$2] -> &title=[ | J48: of:=[.J$2] -> HU | K48: of:=[.K$2] -> ]%20 | L48: of:=[.L$2] -> Forrásfájl lefordítása magyarra: | M48: of:=[.M$2] -> %20 | N48: structure-form-editing.txt | O48: of:=[.O$2] -> &body= | P48: of:=[.P$2] -> Az alábbi fejezet lefordítása angolról magyarra | Q48: of:=[.Q$2] -> %3A%0A-  | R48: of:=[.R$2] -> Téma | S48: of:=[.S$2] -> %3A%20 | T48: Changing Content Entry Forms | U48: of:=[.U$2] -> %20( | V48: of:=[.V$2] -> angolul | W48: of:=[.W$2] -> %3A%20 | X48: Changing Content Entry Forms | Y48: of:=[.Y$2] -> )%0A-%20 | Z48: of:=[.Z$2] -> Fejezet | AA48: of:=[.AA$2] -> %3A%20 | AB48: Setting Up Content Structure | AC48: of:=[.AC$2] -> %20( | AD48: of:=[.AD$2] -> angolul | AE48: of:=[.AE$2] -> %3A%20 | AF48: Setting Up Content Structure | AG48: of:=[.AG$2] -> )%0A-%20 | AH48: of:=[.AH$2] -> Fájlnév | AI48: of:=[.AI$2] -> %3A%20 | AJ48: structure-form-editing.txt | AK48: of:=[.AK$2] -> %0A%0A | AL48: of:=[.AL$2] -> Minden szükséges tudnivalót ebben a leírásban találsz | AM48: of:=[.AM$2] -> %3A%20 | AN48: of:=[.AN$2] -> https://userguide_new-drupal.dev.devdrupal.org/guidelines/instructions.html#practicalities-translating | AO48: of:=[.AO$2] -> "> | AP48: 47 | AQ48: of:=[.AQ$2] -> .  | AR48: structure-form-editing.txt | AS48: of:=[.AS$2] -> </A>
A49: of:=[.A$2] -> <DT><A LAST_CHARSET="UTF-8" HREF="https://www.drupal.org/node/add/project-issue/ | B49: of:=[.B$2] -> user_guide | C49: of:=[.C$2] -> ?categories= | D49: of:=[.D$2] -> 2 | E49: of:=[.E$2] -> &component= | F49: of:=[.F$2] -> HU translation | G49: of:=[.G$2] -> &version= | H49: of:=[.H$2] -> 8.x-2.x-dev | I49: of:=[.I$2] -> &title=[ | J49: of:=[.J$2] -> HU | K49: of:=[.K$2] -> ]%20 | L49: of:=[.L$2] -> Forrásfájl lefordítása magyarra: | M49: of:=[.M$2] -> %20 | N49: structure-view-modes.txt | O49: of:=[.O$2] -> &body= | P49: of:=[.P$2] -> Az alábbi fejezet lefordítása angolról magyarra | Q49: of:=[.Q$2] -> %3A%0A-  | R49: of:=[.R$2] -> Téma | S49: of:=[.S$2] -> %3A%20 | T49: Concept: View Modes and Formatters | U49: of:=[.U$2] -> %20( | V49: of:=[.V$2] -> angolul | W49: of:=[.W$2] -> %3A%20 | X49: Concept: View Modes and Formatters | Y49: of:=[.Y$2] -> )%0A-%20 | Z49: of:=[.Z$2] -> Fejezet | AA49: of:=[.AA$2] -> %3A%20 | AB49: Setting Up Content Structure | AC49: of:=[.AC$2] -> %20( | AD49: of:=[.AD$2] -> angolul | AE49: of:=[.AE$2] -> %3A%20 | AF49: Setting Up Content Structure | AG49: of:=[.AG$2] -> )%0A-%20 | AH49: of:=[.AH$2] -> Fájlnév | AI49: of:=[.AI$2] -> %3A%20 | AJ49: structure-view-modes.txt | AK49: of:=[.AK$2] -> %0A%0A | AL49: of:=[.AL$2] -> Minden szükséges tudnivalót ebben a leírásban találsz | AM49: of:=[.AM$2] -> %3A%20 | AN49: of:=[.AN$2] -> https://userguide_new-drupal.dev.devdrupal.org/guidelines/instructions.html#practicalities-translating | AO49: of:=[.AO$2] -> "> | AP49: 48 | AQ49: of:=[.AQ$2] -> .  | AR49: structure-view-modes.txt | AS49: of:=[.AS$2] -> </A>
A50: of:=[.A$2] -> <DT><A LAST_CHARSET="UTF-8" HREF="https://www.drupal.org/node/add/project-issue/ | B50: of:=[.B$2] -> user_guide | C50: of:=[.C$2] -> ?categories= | D50: of:=[.D$2] -> 2 | E50: of:=[.E$2] -> &component= | F50: of:=[.F$2] -> HU translation | G50: of:=[.G$2] -> &version= | H50: of:=[.H$2] -> 8.x-2.x-dev | I50: of:=[.I$2] -> &title=[ | J50: of:=[.J$2] -> HU | K50: of:=[.K$2] -> ]%20 | L50: of:=[.L$2] -> Forrásfájl lefordítása magyarra: | M50: of:=[.M$2] -> %20 | N50: structure-content-display.txt | O50: of:=[.O$2] -> &body= | P50: of:=[.P$2] -> Az alábbi fejezet lefordítása angolról magyarra | Q50: of:=[.Q$2] -> %3A%0A-  | R50: of:=[.R$2] -> Téma | S50: of:=[.S$2] -> %3A%20 | T50: Changing Content Display | U50: of:=[.U$2] -> %20( | V50: of:=[.V$2] -> angolul | W50: of:=[.W$2] -> %3A%20 | X50: Changing Content Display | Y50: of:=[.Y$2] -> )%0A-%20 | Z50: of:=[.Z$2] -> Fejezet | AA50: of:=[.AA$2] -> %3A%20 | AB50: Setting Up Content Structure | AC50: of:=[.AC$2] -> %20( | AD50: of:=[.AD$2] -> angolul | AE50: of:=[.AE$2] -> %3A%20 | AF50: Setting Up Content Structure | AG50: of:=[.AG$2] -> )%0A-%20 | AH50: of:=[.AH$2] -> Fájlnév | AI50: of:=[.AI$2] -> %3A%20 | AJ50: structure-content-display.txt | AK50: of:=[.AK$2] -> %0A%0A | AL50: of:=[.AL$2] -> Minden szükséges tudnivalót ebben a leírásban találsz | AM50: of:=[.AM$2] -> %3A%20 | AN50: of:=[.AN$2] -> https://userguide_new-drupal.dev.devdrupal.org/guidelines/instructions.html#practicalities-translating | AO50: of:=[.AO$2] -> "> | AP50: 49 | AQ50: of:=[.AQ$2] -> .  | AR50: structure-content-display.txt | AS50: of:=[.AS$2] -> </A>
A51: of:=[.A$2] -> <DT><A LAST_CHARSET="UTF-8" HREF="https://www.drupal.org/node/add/project-issue/ | B51: of:=[.B$2] -> user_guide | C51: of:=[.C$2] -> ?categories= | D51: of:=[.D$2] -> 2 | E51: of:=[.E$2] -> &component= | F51: of:=[.F$2] -> HU translation | G51: of:=[.G$2] -> &version= | H51: of:=[.H$2] -> 8.x-2.x-dev | I51: of:=[.I$2] -> &title=[ | J51: of:=[.J$2] -> HU | K51: of:=[.K$2] -> ]%20 | L51: of:=[.L$2] -> Forrásfájl lefordítása magyarra: | M51: of:=[.M$2] -> %20 | N51: structure-image-styles.txt | O51: of:=[.O$2] -> &body= | P51: of:=[.P$2] -> Az alábbi fejezet lefordítása angolról magyarra | Q51: of:=[.Q$2] -> %3A%0A-  | R51: of:=[.R$2] -> Téma | S51: of:=[.S$2] -> %3A%20 | T51: Concept: Image Styles | U51: of:=[.U$2] -> %20( | V51: of:=[.V$2] -> angolul | W51: of:=[.W$2] -> %3A%20 | X51: Concept: Image Styles | Y51: of:=[.Y$2] -> )%0A-%20 | Z51: of:=[.Z$2] -> Fejezet | AA51: of:=[.AA$2] -> %3A%20 | AB51: Setting Up Content Structure | AC51: of:=[.AC$2] -> %20( | AD51: of:=[.AD$2] -> angolul | AE51: of:=[.AE$2] -> %3A%20 | AF51: Setting Up Content Structure | AG51: of:=[.AG$2] -> )%0A-%20 | AH51: of:=[.AH$2] -> Fájlnév | AI51: of:=[.AI$2] -> %3A%20 | AJ51: structure-image-styles.txt | AK51: of:=[.AK$2] -> %0A%0A | AL51: of:=[.AL$2] -> Minden szükséges tudnivalót ebben a leírásban találsz | AM51: of:=[.AM$2] -> %3A%20 | AN51: of:=[.AN$2] -> https://userguide_new-drupal.dev.devdrupal.org/guidelines/instructions.html#practicalities-translating | AO51: of:=[.AO$2] -> "> | AP51: 50 | AQ51: of:=[.AQ$2] -> .  | AR51: structure-image-styles.txt | AS51: of:=[.AS$2] -> </A>
A52: of:=[.A$2] -> <DT><A LAST_CHARSET="UTF-8" HREF="https://www.drupal.org/node/add/project-issue/ | B52: of:=[.B$2] -> user_guide | C52: of:=[.C$2] -> ?categories= | D52: of:=[.D$2] -> 2 | E52: of:=[.E$2] -> &component= | F52: of:=[.F$2] -> HU translation | G52: of:=[.G$2] -> &version= | H52: of:=[.H$2] -> 8.x-2.x-dev | I52: of:=[.I$2] -> &title=[ | J52: of:=[.J$2] -> HU | K52: of:=[.K$2] -> ]%20 | L52: of:=[.L$2] -> Forrásfájl lefordítása magyarra: | M52: of:=[.M$2] -> %20 | N52: structure-image-style-create.txt | O52: of:=[.O$2] -> &body= | P52: of:=[.P$2] -> Az alábbi fejezet lefordítása angolról magyarra | Q52: of:=[.Q$2] -> %3A%0A-  | R52: of:=[.R$2] -> Téma | S52: of:=[.S$2] -> %3A%20 | T52: Setting Up an Image Style | U52: of:=[.U$2] -> %20( | V52: of:=[.V$2] -> angolul | W52: of:=[.W$2] -> %3A%20 | X52: Setting Up an Image Style | Y52: of:=[.Y$2] -> )%0A-%20 | Z52: of:=[.Z$2] -> Fejezet | AA52: of:=[.AA$2] -> %3A%20 | AB52: Setting Up Content Structure | AC52: of:=[.AC$2] -> %20( | AD52: of:=[.AD$2] -> angolul | AE52: of:=[.AE$2] -> %3A%20 | AF52: Setting Up Content Structure | AG52: of:=[.AG$2] -> )%0A-%20 | AH52: of:=[.AH$2] -> Fájlnév | AI52: of:=[.AI$2] -> %3A%20 | AJ52: structure-image-style-create.txt | AK52: of:=[.AK$2] -> %0A%0A | AL52: of:=[.AL$2] -> Minden szükséges tudnivalót ebben a leírásban találsz | AM52: of:=[.AM$2] -> %3A%20 | AN52: of:=[.AN$2] -> https://userguide_new-drupal.dev.devdrupal.org/guidelines/instructions.html#practicalities-translating | AO52: of:=[.AO$2] -> "> | AP52: 51 | AQ52: of:=[.AQ$2] -> .  | AR52: structure-image-style-create.txt | AS52: of:=[.AS$2] -> </A>
A53: of:=[.A$2] -> <DT><A LAST_CHARSET="UTF-8" HREF="https://www.drupal.org/node/add/project-issue/ | B53: of:=[.B$2] -> user_guide | C53: of:=[.C$2] -> ?categories= | D53: of:=[.D$2] -> 2 | E53: of:=[.E$2] -> &component= | F53: of:=[.F$2] -> HU translation | G53: of:=[.G$2] -> &version= | H53: of:=[.H$2] -> 8.x-2.x-dev | I53: of:=[.I$2] -> &title=[ | J53: of:=[.J$2] -> HU | K53: of:=[.K$2] -> ]%20 | L53: of:=[.L$2] -> Forrásfájl lefordítása magyarra: | M53: of:=[.M$2] -> %20 | N53: structure-image-responsive.txt | O53: of:=[.O$2] -> &body= | P53: of:=[.P$2] -> Az alábbi fejezet lefordítása angolról magyarra | Q53: of:=[.Q$2] -> %3A%0A-  | R53: of:=[.R$2] -> Téma | S53: of:=[.S$2] -> %3A%20 | T53: Concept: Responsive Image Styles | U53: of:=[.U$2] -> %20( | V53: of:=[.V$2] -> angolul | W53: of:=[.W$2] -> %3A%20 | X53: Concept: Responsive Image Styles | Y53: of:=[.Y$2] -> )%0A-%20 | Z53: of:=[.Z$2] -> Fejezet | AA53: of:=[.AA$2] -> %3A%20 | AB53: Setting Up Content Structure | AC53: of:=[.AC$2] -> %20( | AD53: of:=[.AD$2] -> angolul | AE53: of:=[.AE$2] -> %3A%20 | AF53: Setting Up Content Structure | AG53: of:=[.AG$2] -> )%0A-%20 | AH53: of:=[.AH$2] -> Fájlnév | AI53: of:=[.AI$2] -> %3A%20 | AJ53: structure-image-responsive.txt | AK53: of:=[.AK$2] -> %0A%0A | AL53: of:=[.AL$2] -> Minden szükséges tudnivalót ebben a leírásban találsz | AM53: of:=[.AM$2] -> %3A%20 | AN53: of:=[.AN$2] -> https://userguide_new-drupal.dev.devdrupal.org/guidelines/instructions.html#practicalities-translating | AO53: of:=[.AO$2] -> "> | AP53: 52 | AQ53: of:=[.AQ$2] -> .  | AR53: structure-image-responsive.txt | AS53: of:=[.AS$2] -> </A>
A54: of:=[.A$2] -> <DT><A LAST_CHARSET="UTF-8" HREF="https://www.drupal.org/node/add/project-issue/ | B54: of:=[.B$2] -> user_guide | C54: of:=[.C$2] -> ?categories= | D54: of:=[.D$2] -> 2 | E54: of:=[.E$2] -> &component= | F54: of:=[.F$2] -> HU translation | G54: of:=[.G$2] -> &version= | H54: of:=[.H$2] -> 8.x-2.x-dev | I54: of:=[.I$2] -> &title=[ | J54: of:=[.J$2] -> HU | K54: of:=[.K$2] -> ]%20 | L54: of:=[.L$2] -> Forrásfájl lefordítása magyarra: | M54: of:=[.M$2] -> %20 | N54: structure-text-formats.txt | O54: of:=[.O$2] -> &body= | P54: of:=[.P$2] -> Az alábbi fejezet lefordítása angolról magyarra | Q54: of:=[.Q$2] -> %3A%0A-  | R54: of:=[.R$2] -> Téma | S54: of:=[.S$2] -> %3A%20 | T54: Concept: Text Formats and Editors | U54: of:=[.U$2] -> %20( | V54: of:=[.V$2] -> angolul | W54: of:=[.W$2] -> %3A%20 | X54: Concept: Text Formats and Editors | Y54: of:=[.Y$2] -> )%0A-%20 | Z54: of:=[.Z$2] -> Fejezet | AA54: of:=[.AA$2] -> %3A%20 | AB54: Setting Up Content Structure | AC54: of:=[.AC$2] -> %20( | AD54: of:=[.AD$2] -> angolul | AE54: of:=[.AE$2] -> %3A%20 | AF54: Setting Up Content Structure | AG54: of:=[.AG$2] -> )%0A-%20 | AH54: of:=[.AH$2] -> Fájlnév | AI54: of:=[.AI$2] -> %3A%20 | AJ54: structure-text-formats.txt | AK54: of:=[.AK$2] -> %0A%0A | AL54: of:=[.AL$2] -> Minden szükséges tudnivalót ebben a leírásban találsz | AM54: of:=[.AM$2] -> %3A%20 | AN54: of:=[.AN$2] -> https://userguide_new-drupal.dev.devdrupal.org/guidelines/instructions.html#practicalities-translating | AO54: of:=[.AO$2] -> "> | AP54: 53 | AQ54: of:=[.AQ$2] -> .  | AR54: structure-text-formats.txt | AS54: of:=[.AS$2] -> </A>
A55: of:=[.A$2] -> <DT><A LAST_CHARSET="UTF-8" HREF="https://www.drupal.org/node/add/project-issue/ | B55: of:=[.B$2] -> user_guide | C55: of:=[.C$2] -> ?categories= | D55: of:=[.D$2] -> 2 | E55: of:=[.E$2] -> &component= | F55: of:=[.F$2] -> HU translation | G55: of:=[.G$2] -> &version= | H55: of:=[.H$2] -> 8.x-2.x-dev | I55: of:=[.I$2] -> &title=[ | J55: of:=[.J$2] -> HU | K55: of:=[.K$2] -> ]%20 | L55: of:=[.L$2] -> Forrásfájl lefordítása magyarra: | M55: of:=[.M$2] -> %20 | N55: structure-text-format-config.txt | O55: of:=[.O$2] -> &body= | P55: of:=[.P$2] -> Az alábbi fejezet lefordítása angolról magyarra | Q55: of:=[.Q$2] -> %3A%0A-  | R55: of:=[.R$2] -> Téma | S55: of:=[.S$2] -> %3A%20 | T55: Configuring Text Formats and Editors | U55: of:=[.U$2] -> %20( | V55: of:=[.V$2] -> angolul | W55: of:=[.W$2] -> %3A%20 | X55: Configuring Text Formats and Editors | Y55: of:=[.Y$2] -> )%0A-%20 | Z55: of:=[.Z$2] -> Fejezet | AA55: of:=[.AA$2] -> %3A%20 | AB55: Setting Up Content Structure | AC55: of:=[.AC$2] -> %20( | AD55: of:=[.AD$2] -> angolul | AE55: of:=[.AE$2] -> %3A%20 | AF55: Setting Up Content Structure | AG55: of:=[.AG$2] -> )%0A-%20 | AH55: of:=[.AH$2] -> Fájlnév | AI55: of:=[.AI$2] -> %3A%20 | AJ55: structure-text-format-config.txt | AK55: of:=[.AK$2] -> %0A%0A | AL55: of:=[.AL$2] -> Minden szükséges tudnivalót ebben a leírásban találsz | AM55: of:=[.AM$2] -> %3A%20 | AN55: of:=[.AN$2] -> https://userguide_new-drupal.dev.devdrupal.org/guidelines/instructions.html#practicalities-translating | AO55: of:=[.AO$2] -> "> | AP55: 54 | AQ55: of:=[.AQ$2] -> .  | AR55: structure-text-format-config.txt | AS55: of:=[.AS$2] -> </A>
A56: of:=[.A$2] -> <DT><A LAST_CHARSET="UTF-8" HREF="https://www.drupal.org/node/add/project-issue/ | B56: of:=[.B$2] -> user_guide | C56: of:=[.C$2] -> ?categories= | D56: of:=[.D$2] -> 2 | E56: of:=[.E$2] -> &component= | F56: of:=[.F$2] -> HU translation | G56: of:=[.G$2] -> &version= | H56: of:=[.H$2] -> 8.x-2.x-dev | I56: of:=[.I$2] -> &title=[ | J56: of:=[.J$2] -> HU | K56: of:=[.K$2] -> ]%20 | L56: of:=[.L$2] -> Forrásfájl lefordítása magyarra: | M56: of:=[.M$2] -> %20 | N56: user-concept.txt | O56: of:=[.O$2] -> &body= | P56: of:=[.P$2] -> Az alábbi fejezet lefordítása angolról magyarra | Q56: of:=[.Q$2] -> %3A%0A-  | R56: of:=[.R$2] -> Téma | S56: of:=[.S$2] -> %3A%20 | T56: Concept: Users, Roles, and Permissions | U56: of:=[.U$2] -> %20( | V56: of:=[.V$2] -> angolul | W56: of:=[.W$2] -> %3A%20 | X56: Concept: Users, Roles, and Permissions | Y56: of:=[.Y$2] -> )%0A-%20 | Z56: of:=[.Z$2] -> Fejezet | AA56: of:=[.AA$2] -> %3A%20 | AB56: Managing User Accounts | AC56: of:=[.AC$2] -> %20( | AD56: of:=[.AD$2] -> angolul | AE56: of:=[.AE$2] -> %3A%20 | AF56: Managing User Accounts | AG56: of:=[.AG$2] -> )%0A-%20 | AH56: of:=[.AH$2] -> Fájlnév | AI56: of:=[.AI$2] -> %3A%20 | AJ56: user-concept.txt | AK56: of:=[.AK$2] -> %0A%0A | AL56: of:=[.AL$2] -> Minden szükséges tudnivalót ebben a leírásban találsz | AM56: of:=[.AM$2] -> %3A%20 | AN56: of:=[.AN$2] -> https://userguide_new-drupal.dev.devdrupal.org/guidelines/instructions.html#practicalities-translating | AO56: of:=[.AO$2] -> "> | AP56: 55 | AQ56: of:=[.AQ$2] -> .  | AR56: user-concept.txt | AS56: of:=[.AS$2] -> </A>
A57: of:=[.A$2] -> <DT><A LAST_CHARSET="UTF-8" HREF="https://www.drupal.org/node/add/project-issue/ | B57: of:=[.B$2] -> user_guide | C57: of:=[.C$2] -> ?categories= | D57: of:=[.D$2] -> 2 | E57: of:=[.E$2] -> &component= | F57: of:=[.F$2] -> HU translation | G57: of:=[.G$2] -> &version= | H57: of:=[.H$2] -> 8.x-2.x-dev | I57: of:=[.I$2] -> &title=[ | J57: of:=[.J$2] -> HU | K57: of:=[.K$2] -> ]%20 | L57: of:=[.L$2] -> Forrásfájl lefordítása magyarra: | M57: of:=[.M$2] -> %20 | N57: user-admin-account.txt | O57: of:=[.O$2] -> &body= | P57: of:=[.P$2] -> Az alábbi fejezet lefordítása angolról magyarra | Q57: of:=[.Q$2] -> %3A%0A-  | R57: of:=[.R$2] -> Téma | S57: of:=[.S$2] -> %3A%20 | T57: Concept: The User 1 Account | U57: of:=[.U$2] -> %20( | V57: of:=[.V$2] -> angolul | W57: of:=[.W$2] -> %3A%20 | X57: Concept: The User 1 Account | Y57: of:=[.Y$2] -> )%0A-%20 | Z57: of:=[.Z$2] -> Fejezet | AA57: of:=[.AA$2] -> %3A%20 | AB57: Managing User Accounts | AC57: of:=[.AC$2] -> %20( | AD57: of:=[.AD$2] -> angolul | AE57: of:=[.AE$2] -> %3A%20 | AF57: Managing User Accounts | AG57: of:=[.AG$2] -> )%0A-%20 | AH57: of:=[.AH$2] -> Fájlnév | AI57: of:=[.AI$2] -> %3A%20 | AJ57: user-admin-account.txt | AK57: of:=[.AK$2] -> %0A%0A | AL57: of:=[.AL$2] -> Minden szükséges tudnivalót ebben a leírásban találsz | AM57: of:=[.AM$2] -> %3A%20 | AN57: of:=[.AN$2] -> https://userguide_new-drupal.dev.devdrupal.org/guidelines/instructions.html#practicalities-translating | AO57: of:=[.AO$2] -> "> | AP57: 56 | AQ57: of:=[.AQ$2] -> .  | AR57: user-admin-account.txt | AS57: of:=[.AS$2] -> </A>
A58: of:=[.A$2] -> <DT><A LAST_CHARSET="UTF-8" HREF="https://www.drupal.org/node/add/project-issue/ | B58: of:=[.B$2] -> user_guide | C58: of:=[.C$2] -> ?categories= | D58: of:=[.D$2] -> 2 | E58: of:=[.E$2] -> &component= | F58: of:=[.F$2] -> HU translation | G58: of:=[.G$2] -> &version= | H58: of:=[.H$2] -> 8.x-2.x-dev | I58: of:=[.I$2] -> &title=[ | J58: of:=[.J$2] -> HU | K58: of:=[.K$2] -> ]%20 | L58: of:=[.L$2] -> Forrásfájl lefordítása magyarra: | M58: of:=[.M$2] -> %20 | N58: user-new-role.txt | O58: of:=[.O$2] -> &body= | P58: of:=[.P$2] -> Az alábbi fejezet lefordítása angolról magyarra | Q58: of:=[.Q$2] -> %3A%0A-  | R58: of:=[.R$2] -> Téma | S58: of:=[.S$2] -> %3A%20 | T58: Creating a Role | U58: of:=[.U$2] -> %20( | V58: of:=[.V$2] -> angolul | W58: of:=[.W$2] -> %3A%20 | X58: Creating a Role | Y58: of:=[.Y$2] -> )%0A-%20 | Z58: of:=[.Z$2] -> Fejezet | AA58: of:=[.AA$2] -> %3A%20 | AB58: Managing User Accounts | AC58: of:=[.AC$2] -> %20( | AD58: of:=[.AD$2] -> angolul | AE58: of:=[.AE$2] -> %3A%20 | AF58: Managing User Accounts | AG58: of:=[.AG$2] -> )%0A-%20 | AH58: of:=[.AH$2] -> Fájlnév | AI58: of:=[.AI$2] -> %3A%20 | AJ58: user-new-role.txt | AK58: of:=[.AK$2] -> %0A%0A | AL58: of:=[.AL$2] -> Minden szükséges tudnivalót ebben a leírásban találsz | AM58: of:=[.AM$2] -> %3A%20 | AN58: of:=[.AN$2] -> https://userguide_new-drupal.dev.devdrupal.org/guidelines/instructions.html#practicalities-translating | AO58: of:=[.AO$2] -> "> | AP58: 57 | AQ58: of:=[.AQ$2] -> .  | AR58: user-new-role.txt | AS58: of:=[.AS$2] -> </A>
A59: of:=[.A$2] -> <DT><A LAST_CHARSET="UTF-8" HREF="https://www.drupal.org/node/add/project-issue/ | B59: of:=[.B$2] -> user_guide | C59: of:=[.C$2] -> ?categories= | D59: of:=[.D$2] -> 2 | E59: of:=[.E$2] -> &component= | F59: of:=[.F$2] -> HU translation | G59: of:=[.G$2] -> &version= | H59: of:=[.H$2] -> 8.x-2.x-dev | I59: of:=[.I$2] -> &title=[ | J59: of:=[.J$2] -> HU | K59: of:=[.K$2] -> ]%20 | L59: of:=[.L$2] -> Forrásfájl lefordítása magyarra: | M59: of:=[.M$2] -> %20 | N59: user-new-user.txt | O59: of:=[.O$2] -> &body= | P59: of:=[.P$2] -> Az alábbi fejezet lefordítása angolról magyarra | Q59: of:=[.Q$2] -> %3A%0A-  | R59: of:=[.R$2] -> Téma | S59: of:=[.S$2] -> %3A%20 | T59: Creating a User Account | U59: of:=[.U$2] -> %20( | V59: of:=[.V$2] -> angolul | W59: of:=[.W$2] -> %3A%20 | X59: Creating a User Account | Y59: of:=[.Y$2] -> )%0A-%20 | Z59: of:=[.Z$2] -> Fejezet | AA59: of:=[.AA$2] -> %3A%20 | AB59: Managing User Accounts | AC59: of:=[.AC$2] -> %20( | AD59: of:=[.AD$2] -> angolul | AE59: of:=[.AE$2] -> %3A%20 | AF59: Managing User Accounts | AG59: of:=[.AG$2] -> )%0A-%20 | AH59: of:=[.AH$2] -> Fájlnév | AI59: of:=[.AI$2] -> %3A%20 | AJ59: user-new-user.txt | AK59: of:=[.AK$2] -> %0A%0A | AL59: of:=[.AL$2] -> Minden szükséges tudnivalót ebben a leírásban találsz | AM59: of:=[.AM$2] -> %3A%20 | AN59: of:=[.AN$2] -> https://userguide_new-drupal.dev.devdrupal.org/guidelines/instructions.html#practicalities-translating | AO59: of:=[.AO$2] -> "> | AP59: 58 | AQ59: of:=[.AQ$2] -> .  | AR59: user-new-user.txt | AS59: of:=[.AS$2] -> </A>
A60: of:=[.A$2] -> <DT><A LAST_CHARSET="UTF-8" HREF="https://www.drupal.org/node/add/project-issue/ | B60: of:=[.B$2] -> user_guide | C60: of:=[.C$2] -> ?categories= | D60: of:=[.D$2] -> 2 | E60: of:=[.E$2] -> &component= | F60: of:=[.F$2] -> HU translation | G60: of:=[.G$2] -> &version= | H60: of:=[.H$2] -> 8.x-2.x-dev | I60: of:=[.I$2] -> &title=[ | J60: of:=[.J$2] -> HU | K60: of:=[.K$2] -> ]%20 | L60: of:=[.L$2] -> Forrásfájl lefordítása magyarra: | M60: of:=[.M$2] -> %20 | N60: user-permissions.txt | O60: of:=[.O$2] -> &body= | P60: of:=[.P$2] -> Az alábbi fejezet lefordítása angolról magyarra | Q60: of:=[.Q$2] -> %3A%0A-  | R60: of:=[.R$2] -> Téma | S60: of:=[.S$2] -> %3A%20 | T60: Assigning Permissions to a Role | U60: of:=[.U$2] -> %20( | V60: of:=[.V$2] -> angolul | W60: of:=[.W$2] -> %3A%20 | X60: Assigning Permissions to a Role | Y60: of:=[.Y$2] -> )%0A-%20 | Z60: of:=[.Z$2] -> Fejezet | AA60: of:=[.AA$2] -> %3A%20 | AB60: Managing User Accounts | AC60: of:=[.AC$2] -> %20( | AD60: of:=[.AD$2] -> angolul | AE60: of:=[.AE$2] -> %3A%20 | AF60: Managing User Accounts | AG60: of:=[.AG$2] -> )%0A-%20 | AH60: of:=[.AH$2] -> Fájlnév | AI60: of:=[.AI$2] -> %3A%20 | AJ60: user-permissions.txt | AK60: of:=[.AK$2] -> %0A%0A | AL60: of:=[.AL$2] -> Minden szükséges tudnivalót ebben a leírásban találsz | AM60: of:=[.AM$2] -> %3A%20 | AN60: of:=[.AN$2] -> https://userguide_new-drupal.dev.devdrupal.org/guidelines/instructions.html#practicalities-translating | AO60: of:=[.AO$2] -> "> | AP60: 59 | AQ60: of:=[.AQ$2] -> .  | AR60: user-permissions.txt | AS60: of:=[.AS$2] -> </A>
A61: of:=[.A$2] -> <DT><A LAST_CHARSET="UTF-8" HREF="https://www.drupal.org/node/add/project-issue/ | B61: of:=[.B$2] -> user_guide | C61: of:=[.C$2] -> ?categories= | D61: of:=[.D$2] -> 2 | E61: of:=[.E$2] -> &component= | F61: of:=[.F$2] -> HU translation | G61: of:=[.G$2] -> &version= | H61: of:=[.H$2] -> 8.x-2.x-dev | I61: of:=[.I$2] -> &title=[ | J61: of:=[.J$2] -> HU | K61: of:=[.K$2] -> ]%20 | L61: of:=[.L$2] -> Forrásfájl lefordítása magyarra: | M61: of:=[.M$2] -> %20 | N61: user-roles.txt | O61: of:=[.O$2] -> &body= | P61: of:=[.P$2] -> Az alábbi fejezet lefordítása angolról magyarra | Q61: of:=[.Q$2] -> %3A%0A-  | R61: of:=[.R$2] -> Téma | S61: of:=[.S$2] -> %3A%20 | T61: Changing a User's Roles | U61: of:=[.U$2] -> %20( | V61: of:=[.V$2] -> angolul | W61: of:=[.W$2] -> %3A%20 | X61: Changing a User's Roles | Y61: of:=[.Y$2] -> )%0A-%20 | Z61: of:=[.Z$2] -> Fejezet | AA61: of:=[.AA$2] -> %3A%20 | AB61: Managing User Accounts | AC61: of:=[.AC$2] -> %20( | AD61: of:=[.AD$2] -> angolul | AE61: of:=[.AE$2] -> %3A%20 | AF61: Managing User Accounts | AG61: of:=[.AG$2] -> )%0A-%20 | AH61: of:=[.AH$2] -> Fájlnév | AI61: of:=[.AI$2] -> %3A%20 | AJ61: user-roles.txt | AK61: of:=[.AK$2] -> %0A%0A | AL61: of:=[.AL$2] -> Minden szükséges tudnivalót ebben a leírásban találsz | AM61: of:=[.AM$2] -> %3A%20 | AN61: of:=[.AN$2] -> https://userguide_new-drupal.dev.devdrupal.org/guidelines/instructions.html#practicalities-translating | AO61: of:=[.AO$2] -> "> | AP61: 60 | AQ61: of:=[.AQ$2] -> .  | AR61: user-roles.txt | AS61: of:=[.AS$2] -> </A>
A62: of:=[.A$2] -> <DT><A LAST_CHARSET="UTF-8" HREF="https://www.drupal.org/node/add/project-issue/ | B62: of:=[.B$2] -> user_guide | C62: of:=[.C$2] -> ?categories= | D62: of:=[.D$2] -> 2 | E62: of:=[.E$2] -> &component= | F62: of:=[.F$2] -> HU translation | G62: of:=[.G$2] -> &version= | H62: of:=[.H$2] -> 8.x-2.x-dev | I62: of:=[.I$2] -> &title=[ | J62: of:=[.J$2] -> HU | K62: of:=[.K$2] -> ]%20 | L62: of:=[.L$2] -> Forrásfájl lefordítása magyarra: | M62: of:=[.M$2] -> %20 | N62: user-content.txt | O62: of:=[.O$2] -> &body= | P62: of:=[.P$2] -> Az alábbi fejezet lefordítása angolról magyarra | Q62: of:=[.Q$2] -> %3A%0A-  | R62: of:=[.R$2] -> Téma | S62: of:=[.S$2] -> %3A%20 | T62: Assigning Authors to Content | U62: of:=[.U$2] -> %20( | V62: of:=[.V$2] -> angolul | W62: of:=[.W$2] -> %3A%20 | X62: Assigning Authors to Content | Y62: of:=[.Y$2] -> )%0A-%20 | Z62: of:=[.Z$2] -> Fejezet | AA62: of:=[.AA$2] -> %3A%20 | AB62: Managing User Accounts | AC62: of:=[.AC$2] -> %20( | AD62: of:=[.AD$2] -> angolul | AE62: of:=[.AE$2] -> %3A%20 | AF62: Managing User Accounts | AG62: of:=[.AG$2] -> )%0A-%20 | AH62: of:=[.AH$2] -> Fájlnév | AI62: of:=[.AI$2] -> %3A%20 | AJ62: user-content.txt | AK62: of:=[.AK$2] -> %0A%0A | AL62: of:=[.AL$2] -> Minden szükséges tudnivalót ebben a leírásban találsz | AM62: of:=[.AM$2] -> %3A%20 | AN62: of:=[.AN$2] -> https://userguide_new-drupal.dev.devdrupal.org/guidelines/instructions.html#practicalities-translating | AO62: of:=[.AO$2] -> "> | AP62: 61 | AQ62: of:=[.AQ$2] -> .  | AR62: user-content.txt | AS62: of:=[.AS$2] -> </A>
A63: of:=[.A$2] -> <DT><A LAST_CHARSET="UTF-8" HREF="https://www.drupal.org/node/add/project-issue/ | B63: of:=[.B$2] -> user_guide | C63: of:=[.C$2] -> ?categories= | D63: of:=[.D$2] -> 2 | E63: of:=[.E$2] -> &component= | F63: of:=[.F$2] -> HU translation | G63: of:=[.G$2] -> &version= | H63: of:=[.H$2] -> 8.x-2.x-dev | I63: of:=[.I$2] -> &title=[ | J63: of:=[.J$2] -> HU | K63: of:=[.K$2] -> ]%20 | L63: of:=[.L$2] -> Forrásfájl lefordítása magyarra: | M63: of:=[.M$2] -> %20 | N63: block-concept.txt | O63: of:=[.O$2] -> &body= | P63: of:=[.P$2] -> Az alábbi fejezet lefordítása angolról magyarra | Q63: of:=[.Q$2] -> %3A%0A-  | R63: of:=[.R$2] -> Téma | S63: of:=[.S$2] -> %3A%20 | T63: Concept: Blocks | U63: of:=[.U$2] -> %20( | V63: of:=[.V$2] -> angolul | W63: of:=[.W$2] -> %3A%20 | X63: Concept: Blocks | Y63: of:=[.Y$2] -> )%0A-%20 | Z63: of:=[.Z$2] -> Fejezet | AA63: of:=[.AA$2] -> %3A%20 | AB63: Blocks | AC63: of:=[.AC$2] -> %20( | AD63: of:=[.AD$2] -> angolul | AE63: of:=[.AE$2] -> %3A%20 | AF63: Blocks | AG63: of:=[.AG$2] -> )%0A-%20 | AH63: of:=[.AH$2] -> Fájlnév | AI63: of:=[.AI$2] -> %3A%20 | AJ63: block-concept.txt | AK63: of:=[.AK$2] -> %0A%0A | AL63: of:=[.AL$2] -> Minden szükséges tudnivalót ebben a leírásban találsz | AM63: of:=[.AM$2] -> %3A%20 | AN63: of:=[.AN$2] -> https://userguide_new-drupal.dev.devdrupal.org/guidelines/instructions.html#practicalities-translating | AO63: of:=[.AO$2] -> "> | AP63: 62 | AQ63: of:=[.AQ$2] -> .  | AR63: block-concept.txt | AS63: of:=[.AS$2] -> </A>
A64: of:=[.A$2] -> <DT><A LAST_CHARSET="UTF-8" HREF="https://www.drupal.org/node/add/project-issue/ | B64: of:=[.B$2] -> user_guide | C64: of:=[.C$2] -> ?categories= | D64: of:=[.D$2] -> 2 | E64: of:=[.E$2] -> &component= | F64: of:=[.F$2] -> HU translation | G64: of:=[.G$2] -> &version= | H64: of:=[.H$2] -> 8.x-2.x-dev | I64: of:=[.I$2] -> &title=[ | J64: of:=[.J$2] -> HU | K64: of:=[.K$2] -> ]%20 | L64: of:=[.L$2] -> Forrásfájl lefordítása magyarra: | M64: of:=[.M$2] -> %20 | N64: block-create-custom.txt | O64: of:=[.O$2] -> &body= | P64: of:=[.P$2] -> Az alábbi fejezet lefordítása angolról magyarra | Q64: of:=[.Q$2] -> %3A%0A-  | R64: of:=[.R$2] -> Téma | S64: of:=[.S$2] -> %3A%20 | T64: Creating a Custom Block | U64: of:=[.U$2] -> %20( | V64: of:=[.V$2] -> angolul | W64: of:=[.W$2] -> %3A%20 | X64: Creating a Custom Block | Y64: of:=[.Y$2] -> )%0A-%20 | Z64: of:=[.Z$2] -> Fejezet | AA64: of:=[.AA$2] -> %3A%20 | AB64: Blocks | AC64: of:=[.AC$2] -> %20( | AD64: of:=[.AD$2] -> angolul | AE64: of:=[.AE$2] -> %3A%20 | AF64: Blocks | AG64: of:=[.AG$2] -> )%0A-%20 | AH64: of:=[.AH$2] -> Fájlnév | AI64: of:=[.AI$2] -> %3A%20 | AJ64: block-create-custom.txt | AK64: of:=[.AK$2] -> %0A%0A | AL64: of:=[.AL$2] -> Minden szükséges tudnivalót ebben a leírásban találsz | AM64: of:=[.AM$2] -> %3A%20 | AN64: of:=[.AN$2] -> https://userguide_new-drupal.dev.devdrupal.org/guidelines/instructions.html#practicalities-translating | AO64: of:=[.AO$2] -> "> | AP64: 63 | AQ64: of:=[.AQ$2] -> .  | AR64: block-create-custom.txt | AS64: of:=[.AS$2] -> </A>
A65: of:=[.A$2] -> <DT><A LAST_CHARSET="UTF-8" HREF="https://www.drupal.org/node/add/project-issue/ | B65: of:=[.B$2] -> user_guide | C65: of:=[.C$2] -> ?categories= | D65: of:=[.D$2] -> 2 | E65: of:=[.E$2] -> &component= | F65: of:=[.F$2] -> HU translation | G65: of:=[.G$2] -> &version= | H65: of:=[.H$2] -> 8.x-2.x-dev | I65: of:=[.I$2] -> &title=[ | J65: of:=[.J$2] -> HU | K65: of:=[.K$2] -> ]%20 | L65: of:=[.L$2] -> Forrásfájl lefordítása magyarra: | M65: of:=[.M$2] -> %20 | N65: block-place.txt | O65: of:=[.O$2] -> &body= | P65: of:=[.P$2] -> Az alábbi fejezet lefordítása angolról magyarra | Q65: of:=[.Q$2] -> %3A%0A-  | R65: of:=[.R$2] -> Téma | S65: of:=[.S$2] -> %3A%20 | T65: Placing a Block in a Region | U65: of:=[.U$2] -> %20( | V65: of:=[.V$2] -> angolul | W65: of:=[.W$2] -> %3A%20 | X65: Placing a Block in a Region | Y65: of:=[.Y$2] -> )%0A-%20 | Z65: of:=[.Z$2] -> Fejezet | AA65: of:=[.AA$2] -> %3A%20 | AB65: Blocks | AC65: of:=[.AC$2] -> %20( | AD65: of:=[.AD$2] -> angolul | AE65: of:=[.AE$2] -> %3A%20 | AF65: Blocks | AG65: of:=[.AG$2] -> )%0A-%20 | AH65: of:=[.AH$2] -> Fájlnév | AI65: of:=[.AI$2] -> %3A%20 | AJ65: block-place.txt | AK65: of:=[.AK$2] -> %0A%0A | AL65: of:=[.AL$2] -> Minden szükséges tudnivalót ebben a leírásban találsz | AM65: of:=[.AM$2] -> %3A%20 | AN65: of:=[.AN$2] -> https://userguide_new-drupal.dev.devdrupal.org/guidelines/instructions.html#practicalities-translating | AO65: of:=[.AO$2] -> "> | AP65: 64 | AQ65: of:=[.AQ$2] -> .  | AR65: block-place.txt | AS65: of:=[.AS$2] -> </A>
A66: of:=[.A$2] -> <DT><A LAST_CHARSET="UTF-8" HREF="https://www.drupal.org/node/add/project-issue/ | B66: of:=[.B$2] -> user_guide | C66: of:=[.C$2] -> ?categories= | D66: of:=[.D$2] -> 2 | E66: of:=[.E$2] -> &component= | F66: of:=[.F$2] -> HU translation | G66: of:=[.G$2] -> &version= | H66: of:=[.H$2] -> 8.x-2.x-dev | I66: of:=[.I$2] -> &title=[ | J66: of:=[.J$2] -> HU | K66: of:=[.K$2] -> ]%20 | L66: of:=[.L$2] -> Forrásfájl lefordítása magyarra: | M66: of:=[.M$2] -> %20 | N66: views-concept.txt | O66: of:=[.O$2] -> &body= | P66: of:=[.P$2] -> Az alábbi fejezet lefordítása angolról magyarra | Q66: of:=[.Q$2] -> %3A%0A-  | R66: of:=[.R$2] -> Téma | S66: of:=[.S$2] -> %3A%20 | T66: Concept: Uses of Views | U66: of:=[.U$2] -> %20( | V66: of:=[.V$2] -> angolul | W66: of:=[.W$2] -> %3A%20 | X66: Concept: Uses of Views | Y66: of:=[.Y$2] -> )%0A-%20 | Z66: of:=[.Z$2] -> Fejezet | AA66: of:=[.AA$2] -> %3A%20 | AB66: Creating Listings with Views | AC66: of:=[.AC$2] -> %20( | AD66: of:=[.AD$2] -> angolul | AE66: of:=[.AE$2] -> %3A%20 | AF66: Creating Listings with Views | AG66: of:=[.AG$2] -> )%0A-%20 | AH66: of:=[.AH$2] -> Fájlnév | AI66: of:=[.AI$2] -> %3A%20 | AJ66: views-concept.txt | AK66: of:=[.AK$2] -> %0A%0A | AL66: of:=[.AL$2] -> Minden szükséges tudnivalót ebben a leírásban találsz | AM66: of:=[.AM$2] -> %3A%20 | AN66: of:=[.AN$2] -> https://userguide_new-drupal.dev.devdrupal.org/guidelines/instructions.html#practicalities-translating | AO66: of:=[.AO$2] -> "> | AP66: 65 | AQ66: of:=[.AQ$2] -> .  | AR66: views-concept.txt | AS66: of:=[.AS$2] -> </A>
A67: of:=[.A$2] -> <DT><A LAST_CHARSET="UTF-8" HREF="https://www.drupal.org/node/add/project-issue/ | B67: of:=[.B$2] -> user_guide | C67: of:=[.C$2] -> ?categories= | D67: of:=[.D$2] -> 2 | E67: of:=[.E$2] -> &component= | F67: of:=[.F$2] -> HU translation | G67: of:=[.G$2] -> &version= | H67: of:=[.H$2] -> 8.x-2.x-dev | I67: of:=[.I$2] -> &title=[ | J67: of:=[.J$2] -> HU | K67: of:=[.K$2] -> ]%20 | L67: of:=[.L$2] -> Forrásfájl lefordítása magyarra: | M67: of:=[.M$2] -> %20 | N67: views-parts.txt | O67: of:=[.O$2] -> &body= | P67: of:=[.P$2] -> Az alábbi fejezet lefordítása angolról magyarra | Q67: of:=[.Q$2] -> %3A%0A-  | R67: of:=[.R$2] -> Téma | S67: of:=[.S$2] -> %3A%20 | T67: Concept: The Parts of a View | U67: of:=[.U$2] -> %20( | V67: of:=[.V$2] -> angolul | W67: of:=[.W$2] -> %3A%20 | X67: Concept: The Parts of a View | Y67: of:=[.Y$2] -> )%0A-%20 | Z67: of:=[.Z$2] -> Fejezet | AA67: of:=[.AA$2] -> %3A%20 | AB67: Creating Listings with Views | AC67: of:=[.AC$2] -> %20( | AD67: of:=[.AD$2] -> angolul | AE67: of:=[.AE$2] -> %3A%20 | AF67: Creating Listings with Views | AG67: of:=[.AG$2] -> )%0A-%20 | AH67: of:=[.AH$2] -> Fájlnév | AI67: of:=[.AI$2] -> %3A%20 | AJ67: views-parts.txt | AK67: of:=[.AK$2] -> %0A%0A | AL67: of:=[.AL$2] -> Minden szükséges tudnivalót ebben a leírásban találsz | AM67: of:=[.AM$2] -> %3A%20 | AN67: of:=[.AN$2] -> https://userguide_new-drupal.dev.devdrupal.org/guidelines/instructions.html#practicalities-translating | AO67: of:=[.AO$2] -> "> | AP67: 66 | AQ67: of:=[.AQ$2] -> .  | AR67: views-parts.txt | AS67: of:=[.AS$2] -> </A>
A68: of:=[.A$2] -> <DT><A LAST_CHARSET="UTF-8" HREF="https://www.drupal.org/node/add/project-issue/ | B68: of:=[.B$2] -> user_guide | C68: of:=[.C$2] -> ?categories= | D68: of:=[.D$2] -> 2 | E68: of:=[.E$2] -> &component= | F68: of:=[.F$2] -> HU translation | G68: of:=[.G$2] -> &version= | H68: of:=[.H$2] -> 8.x-2.x-dev | I68: of:=[.I$2] -> &title=[ | J68: of:=[.J$2] -> HU | K68: of:=[.K$2] -> ]%20 | L68: of:=[.L$2] -> Forrásfájl lefordítása magyarra: | M68: of:=[.M$2] -> %20 | N68: views-create.txt | O68: of:=[.O$2] -> &body= | P68: of:=[.P$2] -> Az alábbi fejezet lefordítása angolról magyarra | Q68: of:=[.Q$2] -> %3A%0A-  | R68: of:=[.R$2] -> Téma | S68: of:=[.S$2] -> %3A%20 | T68: Creating a Content List View | U68: of:=[.U$2] -> %20( | V68: of:=[.V$2] -> angolul | W68: of:=[.W$2] -> %3A%20 | X68: Creating a Content List View | Y68: of:=[.Y$2] -> )%0A-%20 | Z68: of:=[.Z$2] -> Fejezet | AA68: of:=[.AA$2] -> %3A%20 | AB68: Creating Listings with Views | AC68: of:=[.AC$2] -> %20( | AD68: of:=[.AD$2] -> angolul | AE68: of:=[.AE$2] -> %3A%20 | AF68: Creating Listings with Views | AG68: of:=[.AG$2] -> )%0A-%20 | AH68: of:=[.AH$2] -> Fájlnév | AI68: of:=[.AI$2] -> %3A%20 | AJ68: views-create.txt | AK68: of:=[.AK$2] -> %0A%0A | AL68: of:=[.AL$2] -> Minden szükséges tudnivalót ebben a leírásban találsz | AM68: of:=[.AM$2] -> %3A%20 | AN68: of:=[.AN$2] -> https://userguide_new-drupal.dev.devdrupal.org/guidelines/instructions.html#practicalities-translating | AO68: of:=[.AO$2] -> "> | AP68: 67 | AQ68: of:=[.AQ$2] -> .  | AR68: views-create.txt | AS68: of:=[.AS$2] -> </A>
A69: of:=[.A$2] -> <DT><A LAST_CHARSET="UTF-8" HREF="https://www.drupal.org/node/add/project-issue/ | B69: of:=[.B$2] -> user_guide | C69: of:=[.C$2] -> ?categories= | D69: of:=[.D$2] -> 2 | E69: of:=[.E$2] -> &component= | F69: of:=[.F$2] -> HU translation | G69: of:=[.G$2] -> &version= | H69: of:=[.H$2] -> 8.x-2.x-dev | I69: of:=[.I$2] -> &title=[ | J69: of:=[.J$2] -> HU | K69: of:=[.K$2] -> ]%20 | L69: of:=[.L$2] -> Forrásfájl lefordítása magyarra: | M69: of:=[.M$2] -> %20 | N69: views-duplicate.txt | O69: of:=[.O$2] -> &body= | P69: of:=[.P$2] -> Az alábbi fejezet lefordítása angolról magyarra | Q69: of:=[.Q$2] -> %3A%0A-  | R69: of:=[.R$2] -> Téma | S69: of:=[.S$2] -> %3A%20 | T69: Duplicating a View | U69: of:=[.U$2] -> %20( | V69: of:=[.V$2] -> angolul | W69: of:=[.W$2] -> %3A%20 | X69: Duplicating a View | Y69: of:=[.Y$2] -> )%0A-%20 | Z69: of:=[.Z$2] -> Fejezet | AA69: of:=[.AA$2] -> %3A%20 | AB69: Creating Listings with Views | AC69: of:=[.AC$2] -> %20( | AD69: of:=[.AD$2] -> angolul | AE69: of:=[.AE$2] -> %3A%20 | AF69: Creating Listings with Views | AG69: of:=[.AG$2] -> )%0A-%20 | AH69: of:=[.AH$2] -> Fájlnév | AI69: of:=[.AI$2] -> %3A%20 | AJ69: views-duplicate.txt | AK69: of:=[.AK$2] -> %0A%0A | AL69: of:=[.AL$2] -> Minden szükséges tudnivalót ebben a leírásban találsz | AM69: of:=[.AM$2] -> %3A%20 | AN69: of:=[.AN$2] -> https://userguide_new-drupal.dev.devdrupal.org/guidelines/instructions.html#practicalities-translating | AO69: of:=[.AO$2] -> "> | AP69: 68 | AQ69: of:=[.AQ$2] -> .  | AR69: views-duplicate.txt | AS69: of:=[.AS$2] -> </A>
A70: of:=[.A$2] -> <DT><A LAST_CHARSET="UTF-8" HREF="https://www.drupal.org/node/add/project-issue/ | B70: of:=[.B$2] -> user_guide | C70: of:=[.C$2] -> ?categories= | D70: of:=[.D$2] -> 2 | E70: of:=[.E$2] -> &component= | F70: of:=[.F$2] -> HU translation | G70: of:=[.G$2] -> &version= | H70: of:=[.H$2] -> 8.x-2.x-dev | I70: of:=[.I$2] -> &title=[ | J70: of:=[.J$2] -> HU | K70: of:=[.K$2] -> ]%20 | L70: of:=[.L$2] -> Forrásfájl lefordítása magyarra: | M70: of:=[.M$2] -> %20 | N70: views-block.txt | O70: of:=[.O$2] -> &body= | P70: of:=[.P$2] -> Az alábbi fejezet lefordítása angolról magyarra | Q70: of:=[.Q$2] -> %3A%0A-  | R70: of:=[.R$2] -> Téma | S70: of:=[.S$2] -> %3A%20 | T70: Adding a Block Display to a View | U70: of:=[.U$2] -> %20( | V70: of:=[.V$2] -> angolul | W70: of:=[.W$2] -> %3A%20 | X70: Adding a Block Display to a View | Y70: of:=[.Y$2] -> )%0A-%20 | Z70: of:=[.Z$2] -> Fejezet | AA70: of:=[.AA$2] -> %3A%20 | AB70: Creating Listings with Views | AC70: of:=[.AC$2] -> %20( | AD70: of:=[.AD$2] -> angolul | AE70: of:=[.AE$2] -> %3A%20 | AF70: Creating Listings with Views | AG70: of:=[.AG$2] -> )%0A-%20 | AH70: of:=[.AH$2] -> Fájlnév | AI70: of:=[.AI$2] -> %3A%20 | AJ70: views-block.txt | AK70: of:=[.AK$2] -> %0A%0A | AL70: of:=[.AL$2] -> Minden szükséges tudnivalót ebben a leírásban találsz | AM70: of:=[.AM$2] -> %3A%20 | AN70: of:=[.AN$2] -> https://userguide_new-drupal.dev.devdrupal.org/guidelines/instructions.html#practicalities-translating | AO70: of:=[.AO$2] -> "> | AP70: 69 | AQ70: of:=[.AQ$2] -> .  | AR70: views-block.txt | AS70: of:=[.AS$2] -> </A>
A71: of:=[.A$2] -> <DT><A LAST_CHARSET="UTF-8" HREF="https://www.drupal.org/node/add/project-issue/ | B71: of:=[.B$2] -> user_guide | C71: of:=[.C$2] -> ?categories= | D71: of:=[.D$2] -> 2 | E71: of:=[.E$2] -> &component= | F71: of:=[.F$2] -> HU translation | G71: of:=[.G$2] -> &version= | H71: of:=[.H$2] -> 8.x-2.x-dev | I71: of:=[.I$2] -> &title=[ | J71: of:=[.J$2] -> HU | K71: of:=[.K$2] -> ]%20 | L71: of:=[.L$2] -> Forrásfájl lefordítása magyarra: | M71: of:=[.M$2] -> %20 | N71: language-concept.txt | O71: of:=[.O$2] -> &body= | P71: of:=[.P$2] -> Az alábbi fejezet lefordítása angolról magyarra | Q71: of:=[.Q$2] -> %3A%0A-  | R71: of:=[.R$2] -> Téma | S71: of:=[.S$2] -> %3A%20 | T71: Concept: User Interface, Configuration, and Content Translation | U71: of:=[.U$2] -> %20( | V71: of:=[.V$2] -> angolul | W71: of:=[.W$2] -> %3A%20 | X71: Concept: User Interface, Configuration, and Content Translation | Y71: of:=[.Y$2] -> )%0A-%20 | Z71: of:=[.Z$2] -> Fejezet | AA71: of:=[.AA$2] -> %3A%20 | AB71: Making Your Site Multilingual | AC71: of:=[.AC$2] -> %20( | AD71: of:=[.AD$2] -> angolul | AE71: of:=[.AE$2] -> %3A%20 | AF71: Making Your Site Multilingual | AG71: of:=[.AG$2] -> )%0A-%20 | AH71: of:=[.AH$2] -> Fájlnév | AI71: of:=[.AI$2] -> %3A%20 | AJ71: language-concept.txt | AK71: of:=[.AK$2] -> %0A%0A | AL71: of:=[.AL$2] -> Minden szükséges tudnivalót ebben a leírásban találsz | AM71: of:=[.AM$2] -> %3A%20 | AN71: of:=[.AN$2] -> https://userguide_new-drupal.dev.devdrupal.org/guidelines/instructions.html#practicalities-translating | AO71: of:=[.AO$2] -> "> | AP71: 70 | AQ71: of:=[.AQ$2] -> .  | AR71: language-concept.txt | AS71: of:=[.AS$2] -> </A>
A72: of:=[.A$2] -> <DT><A LAST_CHARSET="UTF-8" HREF="https://www.drupal.org/node/add/project-issue/ | B72: of:=[.B$2] -> user_guide | C72: of:=[.C$2] -> ?categories= | D72: of:=[.D$2] -> 2 | E72: of:=[.E$2] -> &component= | F72: of:=[.F$2] -> HU translation | G72: of:=[.G$2] -> &version= | H72: of:=[.H$2] -> 8.x-2.x-dev | I72: of:=[.I$2] -> &title=[ | J72: of:=[.J$2] -> HU | K72: of:=[.K$2] -> ]%20 | L72: of:=[.L$2] -> Forrásfájl lefordítása magyarra: | M72: of:=[.M$2] -> %20 | N72: language-add.txt | O72: of:=[.O$2] -> &body= | P72: of:=[.P$2] -> Az alábbi fejezet lefordítása angolról magyarra | Q72: of:=[.Q$2] -> %3A%0A-  | R72: of:=[.R$2] -> Téma | S72: of:=[.S$2] -> %3A%20 | T72: Adding a Language | U72: of:=[.U$2] -> %20( | V72: of:=[.V$2] -> angolul | W72: of:=[.W$2] -> %3A%20 | X72: Adding a Language | Y72: of:=[.Y$2] -> )%0A-%20 | Z72: of:=[.Z$2] -> Fejezet | AA72: of:=[.AA$2] -> %3A%20 | AB72: Making Your Site Multilingual | AC72: of:=[.AC$2] -> %20( | AD72: of:=[.AD$2] -> angolul | AE72: of:=[.AE$2] -> %3A%20 | AF72: Making Your Site Multilingual | AG72: of:=[.AG$2] -> )%0A-%20 | AH72: of:=[.AH$2] -> Fájlnév | AI72: of:=[.AI$2] -> %3A%20 | AJ72: language-add.txt | AK72: of:=[.AK$2] -> %0A%0A | AL72: of:=[.AL$2] -> Minden szükséges tudnivalót ebben a leírásban találsz | AM72: of:=[.AM$2] -> %3A%20 | AN72: of:=[.AN$2] -> https://userguide_new-drupal.dev.devdrupal.org/guidelines/instructions.html#practicalities-translating | AO72: of:=[.AO$2] -> "> | AP72: 71 | AQ72: of:=[.AQ$2] -> .  | AR72: language-add.txt | AS72: of:=[.AS$2] -> </A>
A73: of:=[.A$2] -> <DT><A LAST_CHARSET="UTF-8" HREF="https://www.drupal.org/node/add/project-issue/ | B73: of:=[.B$2] -> user_guide | C73: of:=[.C$2] -> ?categories= | D73: of:=[.D$2] -> 2 | E73: of:=[.E$2] -> &component= | F73: of:=[.F$2] -> HU translation | G73: of:=[.G$2] -> &version= | H73: of:=[.H$2] -> 8.x-2.x-dev | I73: of:=[.I$2] -> &title=[ | J73: of:=[.J$2] -> HU | K73: of:=[.K$2] -> ]%20 | L73: of:=[.L$2] -> Forrásfájl lefordítása magyarra: | M73: of:=[.M$2] -> %20 | N73: language-content-config.txt | O73: of:=[.O$2] -> &body= | P73: of:=[.P$2] -> Az alábbi fejezet lefordítása angolról magyarra | Q73: of:=[.Q$2] -> %3A%0A-  | R73: of:=[.R$2] -> Téma | S73: of:=[.S$2] -> %3A%20 | T73: Configuring Content Translation | U73: of:=[.U$2] -> %20( | V73: of:=[.V$2] -> angolul | W73: of:=[.W$2] -> %3A%20 | X73: Configuring Content Translation | Y73: of:=[.Y$2] -> )%0A-%20 | Z73: of:=[.Z$2] -> Fejezet | AA73: of:=[.AA$2] -> %3A%20 | AB73: Making Your Site Multilingual | AC73: of:=[.AC$2] -> %20( | AD73: of:=[.AD$2] -> angolul | AE73: of:=[.AE$2] -> %3A%20 | AF73: Making Your Site Multilingual | AG73: of:=[.AG$2] -> )%0A-%20 | AH73: of:=[.AH$2] -> Fájlnév | AI73: of:=[.AI$2] -> %3A%20 | AJ73: language-content-config.txt | AK73: of:=[.AK$2] -> %0A%0A | AL73: of:=[.AL$2] -> Minden szükséges tudnivalót ebben a leírásban találsz | AM73: of:=[.AM$2] -> %3A%20 | AN73: of:=[.AN$2] -> https://userguide_new-drupal.dev.devdrupal.org/guidelines/instructions.html#practicalities-translating | AO73: of:=[.AO$2] -> "> | AP73: 72 | AQ73: of:=[.AQ$2] -> .  | AR73: language-content-config.txt | AS73: of:=[.AS$2] -> </A>
A74: of:=[.A$2] -> <DT><A LAST_CHARSET="UTF-8" HREF="https://www.drupal.org/node/add/project-issue/ | B74: of:=[.B$2] -> user_guide | C74: of:=[.C$2] -> ?categories= | D74: of:=[.D$2] -> 2 | E74: of:=[.E$2] -> &component= | F74: of:=[.F$2] -> HU translation | G74: of:=[.G$2] -> &version= | H74: of:=[.H$2] -> 8.x-2.x-dev | I74: of:=[.I$2] -> &title=[ | J74: of:=[.J$2] -> HU | K74: of:=[.K$2] -> ]%20 | L74: of:=[.L$2] -> Forrásfájl lefordítása magyarra: | M74: of:=[.M$2] -> %20 | N74: language-content-translate.txt | O74: of:=[.O$2] -> &body= | P74: of:=[.P$2] -> Az alábbi fejezet lefordítása angolról magyarra | Q74: of:=[.Q$2] -> %3A%0A-  | R74: of:=[.R$2] -> Téma | S74: of:=[.S$2] -> %3A%20 | T74: Translating Content | U74: of:=[.U$2] -> %20( | V74: of:=[.V$2] -> angolul | W74: of:=[.W$2] -> %3A%20 | X74: Translating Content | Y74: of:=[.Y$2] -> )%0A-%20 | Z74: of:=[.Z$2] -> Fejezet | AA74: of:=[.AA$2] -> %3A%20 | AB74: Making Your Site Multilingual | AC74: of:=[.AC$2] -> %20( | AD74: of:=[.AD$2] -> angolul | AE74: of:=[.AE$2] -> %3A%20 | AF74: Making Your Site Multilingual | AG74: of:=[.AG$2] -> )%0A-%20 | AH74: of:=[.AH$2] -> Fájlnév | AI74: of:=[.AI$2] -> %3A%20 | AJ74: language-content-translate.txt | AK74: of:=[.AK$2] -> %0A%0A | AL74: of:=[.AL$2] -> Minden szükséges tudnivalót ebben a leírásban találsz | AM74: of:=[.AM$2] -> %3A%20 | AN74: of:=[.AN$2] -> https://userguide_new-drupal.dev.devdrupal.org/guidelines/instructions.html#practicalities-translating | AO74: of:=[.AO$2] -> "> | AP74: 73 | AQ74: of:=[.AQ$2] -> .  | AR74: language-content-translate.txt | AS74: of:=[.AS$2] -> </A>
A75: of:=[.A$2] -> <DT><A LAST_CHARSET="UTF-8" HREF="https://www.drupal.org/node/add/project-issue/ | B75: of:=[.B$2] -> user_guide | C75: of:=[.C$2] -> ?categories= | D75: of:=[.D$2] -> 2 | E75: of:=[.E$2] -> &component= | F75: of:=[.F$2] -> HU translation | G75: of:=[.G$2] -> &version= | H75: of:=[.H$2] -> 8.x-2.x-dev | I75: of:=[.I$2] -> &title=[ | J75: of:=[.J$2] -> HU | K75: of:=[.K$2] -> ]%20 | L75: of:=[.L$2] -> Forrásfájl lefordítása magyarra: | M75: of:=[.M$2] -> %20 | N75: language-config-translate.txt | O75: of:=[.O$2] -> &body= | P75: of:=[.P$2] -> Az alábbi fejezet lefordítása angolról magyarra | Q75: of:=[.Q$2] -> %3A%0A-  | R75: of:=[.R$2] -> Téma | S75: of:=[.S$2] -> %3A%20 | T75: Translating Configuration | U75: of:=[.U$2] -> %20( | V75: of:=[.V$2] -> angolul | W75: of:=[.W$2] -> %3A%20 | X75: Translating Configuration | Y75: of:=[.Y$2] -> )%0A-%20 | Z75: of:=[.Z$2] -> Fejezet | AA75: of:=[.AA$2] -> %3A%20 | AB75: Making Your Site Multilingual | AC75: of:=[.AC$2] -> %20( | AD75: of:=[.AD$2] -> angolul | AE75: of:=[.AE$2] -> %3A%20 | AF75: Making Your Site Multilingual | AG75: of:=[.AG$2] -> )%0A-%20 | AH75: of:=[.AH$2] -> Fájlnév | AI75: of:=[.AI$2] -> %3A%20 | AJ75: language-config-translate.txt | AK75: of:=[.AK$2] -> %0A%0A | AL75: of:=[.AL$2] -> Minden szükséges tudnivalót ebben a leírásban találsz | AM75: of:=[.AM$2] -> %3A%20 | AN75: of:=[.AN$2] -> https://userguide_new-drupal.dev.devdrupal.org/guidelines/instructions.html#practicalities-translating | AO75: of:=[.AO$2] -> "> | AP75: 74 | AQ75: of:=[.AQ$2] -> .  | AR75: language-config-translate.txt | AS75: of:=[.AS$2] -> </A>
A76: of:=[.A$2] -> <DT><A LAST_CHARSET="UTF-8" HREF="https://www.drupal.org/node/add/project-issue/ | B76: of:=[.B$2] -> user_guide | C76: of:=[.C$2] -> ?categories= | D76: of:=[.D$2] -> 2 | E76: of:=[.E$2] -> &component= | F76: of:=[.F$2] -> HU translation | G76: of:=[.G$2] -> &version= | H76: of:=[.H$2] -> 8.x-2.x-dev | I76: of:=[.I$2] -> &title=[ | J76: of:=[.J$2] -> HU | K76: of:=[.K$2] -> ]%20 | L76: of:=[.L$2] -> Forrásfájl lefordítása magyarra: | M76: of:=[.M$2] -> %20 | N76: extend-module-find.txt | O76: of:=[.O$2] -> &body= | P76: of:=[.P$2] -> Az alábbi fejezet lefordítása angolról magyarra | Q76: of:=[.Q$2] -> %3A%0A-  | R76: of:=[.R$2] -> Téma | S76: of:=[.S$2] -> %3A%20 | T76: Finding Modules | U76: of:=[.U$2] -> %20( | V76: of:=[.V$2] -> angolul | W76: of:=[.W$2] -> %3A%20 | X76: Finding Modules | Y76: of:=[.Y$2] -> )%0A-%20 | Z76: of:=[.Z$2] -> Fejezet | AA76: of:=[.AA$2] -> %3A%20 | AB76: Extending and Customizing Your Site | AC76: of:=[.AC$2] -> %20( | AD76: of:=[.AD$2] -> angolul | AE76: of:=[.AE$2] -> %3A%20 | AF76: Extending and Customizing Your Site | AG76: of:=[.AG$2] -> )%0A-%20 | AH76: of:=[.AH$2] -> Fájlnév | AI76: of:=[.AI$2] -> %3A%20 | AJ76: extend-module-find.txt | AK76: of:=[.AK$2] -> %0A%0A | AL76: of:=[.AL$2] -> Minden szükséges tudnivalót ebben a leírásban találsz | AM76: of:=[.AM$2] -> %3A%20 | AN76: of:=[.AN$2] -> https://userguide_new-drupal.dev.devdrupal.org/guidelines/instructions.html#practicalities-translating | AO76: of:=[.AO$2] -> "> | AP76: 75 | AQ76: of:=[.AQ$2] -> .  | AR76: extend-module-find.txt | AS76: of:=[.AS$2] -> </A>
A77: of:=[.A$2] -> <DT><A LAST_CHARSET="UTF-8" HREF="https://www.drupal.org/node/add/project-issue/ | B77: of:=[.B$2] -> user_guide | C77: of:=[.C$2] -> ?categories= | D77: of:=[.D$2] -> 2 | E77: of:=[.E$2] -> &component= | F77: of:=[.F$2] -> HU translation | G77: of:=[.G$2] -> &version= | H77: of:=[.H$2] -> 8.x-2.x-dev | I77: of:=[.I$2] -> &title=[ | J77: of:=[.J$2] -> HU | K77: of:=[.K$2] -> ]%20 | L77: of:=[.L$2] -> Forrásfájl lefordítása magyarra: | M77: of:=[.M$2] -> %20 | N77: extend-maintenance.txt | O77: of:=[.O$2] -> &body= | P77: of:=[.P$2] -> Az alábbi fejezet lefordítása angolról magyarra | Q77: of:=[.Q$2] -> %3A%0A-  | R77: of:=[.R$2] -> Téma | S77: of:=[.S$2] -> %3A%20 | T77: Enabling and Disabling Maintenance Mode | U77: of:=[.U$2] -> %20( | V77: of:=[.V$2] -> angolul | W77: of:=[.W$2] -> %3A%20 | X77: Enabling and Disabling Maintenance Mode | Y77: of:=[.Y$2] -> )%0A-%20 | Z77: of:=[.Z$2] -> Fejezet | AA77: of:=[.AA$2] -> %3A%20 | AB77: Extending and Customizing Your Site | AC77: of:=[.AC$2] -> %20( | AD77: of:=[.AD$2] -> angolul | AE77: of:=[.AE$2] -> %3A%20 | AF77: Extending and Customizing Your Site | AG77: of:=[.AG$2] -> )%0A-%20 | AH77: of:=[.AH$2] -> Fájlnév | AI77: of:=[.AI$2] -> %3A%20 | AJ77: extend-maintenance.txt | AK77: of:=[.AK$2] -> %0A%0A | AL77: of:=[.AL$2] -> Minden szükséges tudnivalót ebben a leírásban találsz | AM77: of:=[.AM$2] -> %3A%20 | AN77: of:=[.AN$2] -> https://userguide_new-drupal.dev.devdrupal.org/guidelines/instructions.html#practicalities-translating | AO77: of:=[.AO$2] -> "> | AP77: 76 | AQ77: of:=[.AQ$2] -> .  | AR77: extend-maintenance.txt | AS77: of:=[.AS$2] -> </A>
A78: of:=[.A$2] -> <DT><A LAST_CHARSET="UTF-8" HREF="https://www.drupal.org/node/add/project-issue/ | B78: of:=[.B$2] -> user_guide | C78: of:=[.C$2] -> ?categories= | D78: of:=[.D$2] -> 2 | E78: of:=[.E$2] -> &component= | F78: of:=[.F$2] -> HU translation | G78: of:=[.G$2] -> &version= | H78: of:=[.H$2] -> 8.x-2.x-dev | I78: of:=[.I$2] -> &title=[ | J78: of:=[.J$2] -> HU | K78: of:=[.K$2] -> ]%20 | L78: of:=[.L$2] -> Forrásfájl lefordítása magyarra: | M78: of:=[.M$2] -> %20 | N78: extend-module-install.txt | O78: of:=[.O$2] -> &body= | P78: of:=[.P$2] -> Az alábbi fejezet lefordítása angolról magyarra | Q78: of:=[.Q$2] -> %3A%0A-  | R78: of:=[.R$2] -> Téma | S78: of:=[.S$2] -> %3A%20 | T78: Downloading and Installing a Module from Drupal.org | U78: of:=[.U$2] -> %20( | V78: of:=[.V$2] -> angolul | W78: of:=[.W$2] -> %3A%20 | X78: Downloading and Installing a Module from Drupal.org | Y78: of:=[.Y$2] -> )%0A-%20 | Z78: of:=[.Z$2] -> Fejezet | AA78: of:=[.AA$2] -> %3A%20 | AB78: Extending and Customizing Your Site | AC78: of:=[.AC$2] -> %20( | AD78: of:=[.AD$2] -> angolul | AE78: of:=[.AE$2] -> %3A%20 | AF78: Extending and Customizing Your Site | AG78: of:=[.AG$2] -> )%0A-%20 | AH78: of:=[.AH$2] -> Fájlnév | AI78: of:=[.AI$2] -> %3A%20 | AJ78: extend-module-install.txt | AK78: of:=[.AK$2] -> %0A%0A | AL78: of:=[.AL$2] -> Minden szükséges tudnivalót ebben a leírásban találsz | AM78: of:=[.AM$2] -> %3A%20 | AN78: of:=[.AN$2] -> https://userguide_new-drupal.dev.devdrupal.org/guidelines/instructions.html#practicalities-translating | AO78: of:=[.AO$2] -> "> | AP78: 77 | AQ78: of:=[.AQ$2] -> .  | AR78: extend-module-install.txt | AS78: of:=[.AS$2] -> </A>
A79: of:=[.A$2] -> <DT><A LAST_CHARSET="UTF-8" HREF="https://www.drupal.org/node/add/project-issue/ | B79: of:=[.B$2] -> user_guide | C79: of:=[.C$2] -> ?categories= | D79: of:=[.D$2] -> 2 | E79: of:=[.E$2] -> &component= | F79: of:=[.F$2] -> HU translation | G79: of:=[.G$2] -> &version= | H79: of:=[.H$2] -> 8.x-2.x-dev | I79: of:=[.I$2] -> &title=[ | J79: of:=[.J$2] -> HU | K79: of:=[.K$2] -> ]%20 | L79: of:=[.L$2] -> Forrásfájl lefordítása magyarra: | M79: of:=[.M$2] -> %20 | N79: extend-theme-find.txt | O79: of:=[.O$2] -> &body= | P79: of:=[.P$2] -> Az alábbi fejezet lefordítása angolról magyarra | Q79: of:=[.Q$2] -> %3A%0A-  | R79: of:=[.R$2] -> Téma | S79: of:=[.S$2] -> %3A%20 | T79: Finding Themes | U79: of:=[.U$2] -> %20( | V79: of:=[.V$2] -> angolul | W79: of:=[.W$2] -> %3A%20 | X79: Finding Themes | Y79: of:=[.Y$2] -> )%0A-%20 | Z79: of:=[.Z$2] -> Fejezet | AA79: of:=[.AA$2] -> %3A%20 | AB79: Extending and Customizing Your Site | AC79: of:=[.AC$2] -> %20( | AD79: of:=[.AD$2] -> angolul | AE79: of:=[.AE$2] -> %3A%20 | AF79: Extending and Customizing Your Site | AG79: of:=[.AG$2] -> )%0A-%20 | AH79: of:=[.AH$2] -> Fájlnév | AI79: of:=[.AI$2] -> %3A%20 | AJ79: extend-theme-find.txt | AK79: of:=[.AK$2] -> %0A%0A | AL79: of:=[.AL$2] -> Minden szükséges tudnivalót ebben a leírásban találsz | AM79: of:=[.AM$2] -> %3A%20 | AN79: of:=[.AN$2] -> https://userguide_new-drupal.dev.devdrupal.org/guidelines/instructions.html#practicalities-translating | AO79: of:=[.AO$2] -> "> | AP79: 78 | AQ79: of:=[.AQ$2] -> .  | AR79: extend-theme-find.txt | AS79: of:=[.AS$2] -> </A>
A80: of:=[.A$2] -> <DT><A LAST_CHARSET="UTF-8" HREF="https://www.drupal.org/node/add/project-issue/ | B80: of:=[.B$2] -> user_guide | C80: of:=[.C$2] -> ?categories= | D80: of:=[.D$2] -> 2 | E80: of:=[.E$2] -> &component= | F80: of:=[.F$2] -> HU translation | G80: of:=[.G$2] -> &version= | H80: of:=[.H$2] -> 8.x-2.x-dev | I80: of:=[.I$2] -> &title=[ | J80: of:=[.J$2] -> HU | K80: of:=[.K$2] -> ]%20 | L80: of:=[.L$2] -> Forrásfájl lefordítása magyarra: | M80: of:=[.M$2] -> %20 | N80: extend-theme-install.txt | O80: of:=[.O$2] -> &body= | P80: of:=[.P$2] -> Az alábbi fejezet lefordítása angolról magyarra | Q80: of:=[.Q$2] -> %3A%0A-  | R80: of:=[.R$2] -> Téma | S80: of:=[.S$2] -> %3A%20 | T80: Downloading and Installing a Theme from Drupal.org | U80: of:=[.U$2] -> %20( | V80: of:=[.V$2] -> angolul | W80: of:=[.W$2] -> %3A%20 | X80: Downloading and Installing a Theme from Drupal.org | Y80: of:=[.Y$2] -> )%0A-%20 | Z80: of:=[.Z$2] -> Fejezet | AA80: of:=[.AA$2] -> %3A%20 | AB80: Extending and Customizing Your Site | AC80: of:=[.AC$2] -> %20( | AD80: of:=[.AD$2] -> angolul | AE80: of:=[.AE$2] -> %3A%20 | AF80: Extending and Customizing Your Site | AG80: of:=[.AG$2] -> )%0A-%20 | AH80: of:=[.AH$2] -> Fájlnév | AI80: of:=[.AI$2] -> %3A%20 | AJ80: extend-theme-install.txt | AK80: of:=[.AK$2] -> %0A%0A | AL80: of:=[.AL$2] -> Minden szükséges tudnivalót ebben a leírásban találsz | AM80: of:=[.AM$2] -> %3A%20 | AN80: of:=[.AN$2] -> https://userguide_new-drupal.dev.devdrupal.org/guidelines/instructions.html#practicalities-translating | AO80: of:=[.AO$2] -> "> | AP80: 79 | AQ80: of:=[.AQ$2] -> .  | AR80: extend-theme-install.txt | AS80: of:=[.AS$2] -> </A>
A81: of:=[.A$2] -> <DT><A LAST_CHARSET="UTF-8" HREF="https://www.drupal.org/node/add/project-issue/ | B81: of:=[.B$2] -> user_guide | C81: of:=[.C$2] -> ?categories= | D81: of:=[.D$2] -> 2 | E81: of:=[.E$2] -> &component= | F81: of:=[.F$2] -> HU translation | G81: of:=[.G$2] -> &version= | H81: of:=[.H$2] -> 8.x-2.x-dev | I81: of:=[.I$2] -> &title=[ | J81: of:=[.J$2] -> HU | K81: of:=[.K$2] -> ]%20 | L81: of:=[.L$2] -> Forrásfájl lefordítása magyarra: | M81: of:=[.M$2] -> %20 | N81: extend-manual-install.txt | O81: of:=[.O$2] -> &body= | P81: of:=[.P$2] -> Az alábbi fejezet lefordítása angolról magyarra | Q81: of:=[.Q$2] -> %3A%0A-  | R81: of:=[.R$2] -> Téma | S81: of:=[.S$2] -> %3A%20 | T81: Manually Downloading Module or Theme Files | U81: of:=[.U$2] -> %20( | V81: of:=[.V$2] -> angolul | W81: of:=[.W$2] -> %3A%20 | X81: Manually Downloading Module or Theme Files | Y81: of:=[.Y$2] -> )%0A-%20 | Z81: of:=[.Z$2] -> Fejezet | AA81: of:=[.AA$2] -> %3A%20 | AB81: Extending and Customizing Your Site | AC81: of:=[.AC$2] -> %20( | AD81: of:=[.AD$2] -> angolul | AE81: of:=[.AE$2] -> %3A%20 | AF81: Extending and Customizing Your Site | AG81: of:=[.AG$2] -> )%0A-%20 | AH81: of:=[.AH$2] -> Fájlnév | AI81: of:=[.AI$2] -> %3A%20 | AJ81: extend-manual-install.txt | AK81: of:=[.AK$2] -> %0A%0A | AL81: of:=[.AL$2] -> Minden szükséges tudnivalót ebben a leírásban találsz | AM81: of:=[.AM$2] -> %3A%20 | AN81: of:=[.AN$2] -> https://userguide_new-drupal.dev.devdrupal.org/guidelines/instructions.html#practicalities-translating | AO81: of:=[.AO$2] -> "> | AP81: 80 | AQ81: of:=[.AQ$2] -> .  | AR81: extend-manual-install.txt | AS81: of:=[.AS$2] -> </A>
A82: of:=[.A$2] -> <DT><A LAST_CHARSET="UTF-8" HREF="https://www.drupal.org/node/add/project-issue/ | B82: of:=[.B$2] -> user_guide | C82: of:=[.C$2] -> ?categories= | D82: of:=[.D$2] -> 2 | E82: of:=[.E$2] -> &component= | F82: of:=[.F$2] -> HU translation | G82: of:=[.G$2] -> &version= | H82: of:=[.H$2] -> 8.x-2.x-dev | I82: of:=[.I$2] -> &title=[ | J82: of:=[.J$2] -> HU | K82: of:=[.K$2] -> ]%20 | L82: of:=[.L$2] -> Forrásfájl lefordítása magyarra: | M82: of:=[.M$2] -> %20 | N82: install-dev-sites.txt | O82: of:=[.O$2] -> &body= | P82: of:=[.P$2] -> Az alábbi fejezet lefordítása angolról magyarra | Q82: of:=[.Q$2] -> %3A%0A-  | R82: of:=[.R$2] -> Téma | S82: of:=[.S$2] -> %3A%20 | T82: Concept: Development Sites | U82: of:=[.U$2] -> %20( | V82: of:=[.V$2] -> angolul | W82: of:=[.W$2] -> %3A%20 | X82: Concept: Development Sites | Y82: of:=[.Y$2] -> )%0A-%20 | Z82: of:=[.Z$2] -> Fejezet | AA82: of:=[.AA$2] -> %3A%20 | AB82: Extending and Customizing Your Site | AC82: of:=[.AC$2] -> %20( | AD82: of:=[.AD$2] -> angolul | AE82: of:=[.AE$2] -> %3A%20 | AF82: Extending and Customizing Your Site | AG82: of:=[.AG$2] -> )%0A-%20 | AH82: of:=[.AH$2] -> Fájlnév | AI82: of:=[.AI$2] -> %3A%20 | AJ82: install-dev-sites.txt | AK82: of:=[.AK$2] -> %0A%0A | AL82: of:=[.AL$2] -> Minden szükséges tudnivalót ebben a leírásban találsz | AM82: of:=[.AM$2] -> %3A%20 | AN82: of:=[.AN$2] -> https://userguide_new-drupal.dev.devdrupal.org/guidelines/instructions.html#practicalities-translating | AO82: of:=[.AO$2] -> "> | AP82: 81 | AQ82: of:=[.AQ$2] -> .  | AR82: install-dev-sites.txt | AS82: of:=[.AS$2] -> </A>
A83: of:=[.A$2] -> <DT><A LAST_CHARSET="UTF-8" HREF="https://www.drupal.org/node/add/project-issue/ | B83: of:=[.B$2] -> user_guide | C83: of:=[.C$2] -> ?categories= | D83: of:=[.D$2] -> 2 | E83: of:=[.E$2] -> &component= | F83: of:=[.F$2] -> HU translation | G83: of:=[.G$2] -> &version= | H83: of:=[.H$2] -> 8.x-2.x-dev | I83: of:=[.I$2] -> &title=[ | J83: of:=[.J$2] -> HU | K83: of:=[.K$2] -> ]%20 | L83: of:=[.L$2] -> Forrásfájl lefordítása magyarra: | M83: of:=[.M$2] -> %20 | N83: install-dev-making.txt | O83: of:=[.O$2] -> &body= | P83: of:=[.P$2] -> Az alábbi fejezet lefordítása angolról magyarra | Q83: of:=[.Q$2] -> %3A%0A-  | R83: of:=[.R$2] -> Téma | S83: of:=[.S$2] -> %3A%20 | T83: Making a Development Site | U83: of:=[.U$2] -> %20( | V83: of:=[.V$2] -> angolul | W83: of:=[.W$2] -> %3A%20 | X83: Making a Development Site | Y83: of:=[.Y$2] -> )%0A-%20 | Z83: of:=[.Z$2] -> Fejezet | AA83: of:=[.AA$2] -> %3A%20 | AB83: Extending and Customizing Your Site | AC83: of:=[.AC$2] -> %20( | AD83: of:=[.AD$2] -> angolul | AE83: of:=[.AE$2] -> %3A%20 | AF83: Extending and Customizing Your Site | AG83: of:=[.AG$2] -> )%0A-%20 | AH83: of:=[.AH$2] -> Fájlnév | AI83: of:=[.AI$2] -> %3A%20 | AJ83: install-dev-making.txt | AK83: of:=[.AK$2] -> %0A%0A | AL83: of:=[.AL$2] -> Minden szükséges tudnivalót ebben a leírásban találsz | AM83: of:=[.AM$2] -> %3A%20 | AN83: of:=[.AN$2] -> https://userguide_new-drupal.dev.devdrupal.org/guidelines/instructions.html#practicalities-translating | AO83: of:=[.AO$2] -> "> | AP83: 82 | AQ83: of:=[.AQ$2] -> .  | AR83: install-dev-making.txt | AS83: of:=[.AS$2] -> </A>
A84: of:=[.A$2] -> <DT><A LAST_CHARSET="UTF-8" HREF="https://www.drupal.org/node/add/project-issue/ | B84: of:=[.B$2] -> user_guide | C84: of:=[.C$2] -> ?categories= | D84: of:=[.D$2] -> 2 | E84: of:=[.E$2] -> &component= | F84: of:=[.F$2] -> HU translation | G84: of:=[.G$2] -> &version= | H84: of:=[.H$2] -> 8.x-2.x-dev | I84: of:=[.I$2] -> &title=[ | J84: of:=[.J$2] -> HU | K84: of:=[.K$2] -> ]%20 | L84: of:=[.L$2] -> Forrásfájl lefordítása magyarra: | M84: of:=[.M$2] -> %20 | N84: extend-deploy.txt | O84: of:=[.O$2] -> &body= | P84: of:=[.P$2] -> Az alábbi fejezet lefordítása angolról magyarra | Q84: of:=[.Q$2] -> %3A%0A-  | R84: of:=[.R$2] -> Téma | S84: of:=[.S$2] -> %3A%20 | T84: Deploying New Site Features | U84: of:=[.U$2] -> %20( | V84: of:=[.V$2] -> angolul | W84: of:=[.W$2] -> %3A%20 | X84: Deploying New Site Features | Y84: of:=[.Y$2] -> )%0A-%20 | Z84: of:=[.Z$2] -> Fejezet | AA84: of:=[.AA$2] -> %3A%20 | AB84: Extending and Customizing Your Site | AC84: of:=[.AC$2] -> %20( | AD84: of:=[.AD$2] -> angolul | AE84: of:=[.AE$2] -> %3A%20 | AF84: Extending and Customizing Your Site | AG84: of:=[.AG$2] -> )%0A-%20 | AH84: of:=[.AH$2] -> Fájlnév | AI84: of:=[.AI$2] -> %3A%20 | AJ84: extend-deploy.txt | AK84: of:=[.AK$2] -> %0A%0A | AL84: of:=[.AL$2] -> Minden szükséges tudnivalót ebben a leírásban találsz | AM84: of:=[.AM$2] -> %3A%20 | AN84: of:=[.AN$2] -> https://userguide_new-drupal.dev.devdrupal.org/guidelines/instructions.html#practicalities-translating | AO84: of:=[.AO$2] -> "> | AP84: 83 | AQ84: of:=[.AQ$2] -> .  | AR84: extend-deploy.txt | AS84: of:=[.AS$2] -> </A>
A85: of:=[.A$2] -> <DT><A LAST_CHARSET="UTF-8" HREF="https://www.drupal.org/node/add/project-issue/ | B85: of:=[.B$2] -> user_guide | C85: of:=[.C$2] -> ?categories= | D85: of:=[.D$2] -> 2 | E85: of:=[.E$2] -> &component= | F85: of:=[.F$2] -> HU translation | G85: of:=[.G$2] -> &version= | H85: of:=[.H$2] -> 8.x-2.x-dev | I85: of:=[.I$2] -> &title=[ | J85: of:=[.J$2] -> HU | K85: of:=[.K$2] -> ]%20 | L85: of:=[.L$2] -> Forrásfájl lefordítása magyarra: | M85: of:=[.M$2] -> %20 | N85: extend-config-versions.txt | O85: of:=[.O$2] -> &body= | P85: of:=[.P$2] -> Az alábbi fejezet lefordítása angolról magyarra | Q85: of:=[.Q$2] -> %3A%0A-  | R85: of:=[.R$2] -> Téma | S85: of:=[.S$2] -> %3A%20 | T85: Synchronizing Configuration Versions | U85: of:=[.U$2] -> %20( | V85: of:=[.V$2] -> angolul | W85: of:=[.W$2] -> %3A%20 | X85: Synchronizing Configuration Versions | Y85: of:=[.Y$2] -> )%0A-%20 | Z85: of:=[.Z$2] -> Fejezet | AA85: of:=[.AA$2] -> %3A%20 | AB85: Extending and Customizing Your Site | AC85: of:=[.AC$2] -> %20( | AD85: of:=[.AD$2] -> angolul | AE85: of:=[.AE$2] -> %3A%20 | AF85: Extending and Customizing Your Site | AG85: of:=[.AG$2] -> )%0A-%20 | AH85: of:=[.AH$2] -> Fájlnév | AI85: of:=[.AI$2] -> %3A%20 | AJ85: extend-config-versions.txt | AK85: of:=[.AK$2] -> %0A%0A | AL85: of:=[.AL$2] -> Minden szükséges tudnivalót ebben a leírásban találsz | AM85: of:=[.AM$2] -> %3A%20 | AN85: of:=[.AN$2] -> https://userguide_new-drupal.dev.devdrupal.org/guidelines/instructions.html#practicalities-translating | AO85: of:=[.AO$2] -> "> | AP85: 84 | AQ85: of:=[.AQ$2] -> .  | AR85: extend-config-versions.txt | AS85: of:=[.AS$2] -> </A>
A86: of:=[.A$2] -> <DT><A LAST_CHARSET="UTF-8" HREF="https://www.drupal.org/node/add/project-issue/ | B86: of:=[.B$2] -> user_guide | C86: of:=[.C$2] -> ?categories= | D86: of:=[.D$2] -> 2 | E86: of:=[.E$2] -> &component= | F86: of:=[.F$2] -> HU translation | G86: of:=[.G$2] -> &version= | H86: of:=[.H$2] -> 8.x-2.x-dev | I86: of:=[.I$2] -> &title=[ | J86: of:=[.J$2] -> HU | K86: of:=[.K$2] -> ]%20 | L86: of:=[.L$2] -> Forrásfájl lefordítása magyarra: | M86: of:=[.M$2] -> %20 | N86: prevent-cache.txt | O86: of:=[.O$2] -> &body= | P86: of:=[.P$2] -> Az alábbi fejezet lefordítása angolról magyarra | Q86: of:=[.Q$2] -> %3A%0A-  | R86: of:=[.R$2] -> Téma | S86: of:=[.S$2] -> %3A%20 | T86: Concept: Cache | U86: of:=[.U$2] -> %20( | V86: of:=[.V$2] -> angolul | W86: of:=[.W$2] -> %3A%20 | X86: Concept: Cache | Y86: of:=[.Y$2] -> )%0A-%20 | Z86: of:=[.Z$2] -> Fejezet | AA86: of:=[.AA$2] -> %3A%20 | AB86: Preventing and Fixing Problems | AC86: of:=[.AC$2] -> %20( | AD86: of:=[.AD$2] -> angolul | AE86: of:=[.AE$2] -> %3A%20 | AF86: Preventing and Fixing Problems | AG86: of:=[.AG$2] -> )%0A-%20 | AH86: of:=[.AH$2] -> Fájlnév | AI86: of:=[.AI$2] -> %3A%20 | AJ86: prevent-cache.txt | AK86: of:=[.AK$2] -> %0A%0A | AL86: of:=[.AL$2] -> Minden szükséges tudnivalót ebben a leírásban találsz | AM86: of:=[.AM$2] -> %3A%20 | AN86: of:=[.AN$2] -> https://userguide_new-drupal.dev.devdrupal.org/guidelines/instructions.html#practicalities-translating | AO86: of:=[.AO$2] -> "> | AP86: 85 | AQ86: of:=[.AQ$2] -> .  | AR86: prevent-cache.txt | AS86: of:=[.AS$2] -> </A>
A87: of:=[.A$2] -> <DT><A LAST_CHARSET="UTF-8" HREF="https://www.drupal.org/node/add/project-issue/ | B87: of:=[.B$2] -> user_guide | C87: of:=[.C$2] -> ?categories= | D87: of:=[.D$2] -> 2 | E87: of:=[.E$2] -> &component= | F87: of:=[.F$2] -> HU translation | G87: of:=[.G$2] -> &version= | H87: of:=[.H$2] -> 8.x-2.x-dev | I87: of:=[.I$2] -> &title=[ | J87: of:=[.J$2] -> HU | K87: of:=[.K$2] -> ]%20 | L87: of:=[.L$2] -> Forrásfájl lefordítása magyarra: | M87: of:=[.M$2] -> %20 | N87: prevent-cache-clear.txt | O87: of:=[.O$2] -> &body= | P87: of:=[.P$2] -> Az alábbi fejezet lefordítása angolról magyarra | Q87: of:=[.Q$2] -> %3A%0A-  | R87: of:=[.R$2] -> Téma | S87: of:=[.S$2] -> %3A%20 | T87: Clearing the Cache | U87: of:=[.U$2] -> %20( | V87: of:=[.V$2] -> angolul | W87: of:=[.W$2] -> %3A%20 | X87: Clearing the Cache | Y87: of:=[.Y$2] -> )%0A-%20 | Z87: of:=[.Z$2] -> Fejezet | AA87: of:=[.AA$2] -> %3A%20 | AB87: Preventing and Fixing Problems | AC87: of:=[.AC$2] -> %20( | AD87: of:=[.AD$2] -> angolul | AE87: of:=[.AE$2] -> %3A%20 | AF87: Preventing and Fixing Problems | AG87: of:=[.AG$2] -> )%0A-%20 | AH87: of:=[.AH$2] -> Fájlnév | AI87: of:=[.AI$2] -> %3A%20 | AJ87: prevent-cache-clear.txt | AK87: of:=[.AK$2] -> %0A%0A | AL87: of:=[.AL$2] -> Minden szükséges tudnivalót ebben a leírásban találsz | AM87: of:=[.AM$2] -> %3A%20 | AN87: of:=[.AN$2] -> https://userguide_new-drupal.dev.devdrupal.org/guidelines/instructions.html#practicalities-translating | AO87: of:=[.AO$2] -> "> | AP87: 86 | AQ87: of:=[.AQ$2] -> .  | AR87: prevent-cache-clear.txt | AS87: of:=[.AS$2] -> </A>
A88: of:=[.A$2] -> <DT><A LAST_CHARSET="UTF-8" HREF="https://www.drupal.org/node/add/project-issue/ | B88: of:=[.B$2] -> user_guide | C88: of:=[.C$2] -> ?categories= | D88: of:=[.D$2] -> 2 | E88: of:=[.E$2] -> &component= | F88: of:=[.F$2] -> HU translation | G88: of:=[.G$2] -> &version= | H88: of:=[.H$2] -> 8.x-2.x-dev | I88: of:=[.I$2] -> &title=[ | J88: of:=[.J$2] -> HU | K88: of:=[.K$2] -> ]%20 | L88: of:=[.L$2] -> Forrásfájl lefordítása magyarra: | M88: of:=[.M$2] -> %20 | N88: prevent-backups.txt | O88: of:=[.O$2] -> &body= | P88: of:=[.P$2] -> Az alábbi fejezet lefordítása angolról magyarra | Q88: of:=[.Q$2] -> %3A%0A-  | R88: of:=[.R$2] -> Téma | S88: of:=[.S$2] -> %3A%20 | T88: Concept: Data Backups | U88: of:=[.U$2] -> %20( | V88: of:=[.V$2] -> angolul | W88: of:=[.W$2] -> %3A%20 | X88: Concept: Data Backups | Y88: of:=[.Y$2] -> )%0A-%20 | Z88: of:=[.Z$2] -> Fejezet | AA88: of:=[.AA$2] -> %3A%20 | AB88: Preventing and Fixing Problems | AC88: of:=[.AC$2] -> %20( | AD88: of:=[.AD$2] -> angolul | AE88: of:=[.AE$2] -> %3A%20 | AF88: Preventing and Fixing Problems | AG88: of:=[.AG$2] -> )%0A-%20 | AH88: of:=[.AH$2] -> Fájlnév | AI88: of:=[.AI$2] -> %3A%20 | AJ88: prevent-backups.txt | AK88: of:=[.AK$2] -> %0A%0A | AL88: of:=[.AL$2] -> Minden szükséges tudnivalót ebben a leírásban találsz | AM88: of:=[.AM$2] -> %3A%20 | AN88: of:=[.AN$2] -> https://userguide_new-drupal.dev.devdrupal.org/guidelines/instructions.html#practicalities-translating | AO88: of:=[.AO$2] -> "> | AP88: 87 | AQ88: of:=[.AQ$2] -> .  | AR88: prevent-backups.txt | AS88: of:=[.AS$2] -> </A>
A89: of:=[.A$2] -> <DT><A LAST_CHARSET="UTF-8" HREF="https://www.drupal.org/node/add/project-issue/ | B89: of:=[.B$2] -> user_guide | C89: of:=[.C$2] -> ?categories= | D89: of:=[.D$2] -> 2 | E89: of:=[.E$2] -> &component= | F89: of:=[.F$2] -> HU translation | G89: of:=[.G$2] -> &version= | H89: of:=[.H$2] -> 8.x-2.x-dev | I89: of:=[.I$2] -> &title=[ | J89: of:=[.J$2] -> HU | K89: of:=[.K$2] -> ]%20 | L89: of:=[.L$2] -> Forrásfájl lefordítása magyarra: | M89: of:=[.M$2] -> %20 | N89: prevent-log.txt | O89: of:=[.O$2] -> &body= | P89: of:=[.P$2] -> Az alábbi fejezet lefordítása angolról magyarra | Q89: of:=[.Q$2] -> %3A%0A-  | R89: of:=[.R$2] -> Téma | S89: of:=[.S$2] -> %3A%20 | T89: Concept: Log | U89: of:=[.U$2] -> %20( | V89: of:=[.V$2] -> angolul | W89: of:=[.W$2] -> %3A%20 | X89: Concept: Log | Y89: of:=[.Y$2] -> )%0A-%20 | Z89: of:=[.Z$2] -> Fejezet | AA89: of:=[.AA$2] -> %3A%20 | AB89: Preventing and Fixing Problems | AC89: of:=[.AC$2] -> %20( | AD89: of:=[.AD$2] -> angolul | AE89: of:=[.AE$2] -> %3A%20 | AF89: Preventing and Fixing Problems | AG89: of:=[.AG$2] -> )%0A-%20 | AH89: of:=[.AH$2] -> Fájlnév | AI89: of:=[.AI$2] -> %3A%20 | AJ89: prevent-log.txt | AK89: of:=[.AK$2] -> %0A%0A | AL89: of:=[.AL$2] -> Minden szükséges tudnivalót ebben a leírásban találsz | AM89: of:=[.AM$2] -> %3A%20 | AN89: of:=[.AN$2] -> https://userguide_new-drupal.dev.devdrupal.org/guidelines/instructions.html#practicalities-translating | AO89: of:=[.AO$2] -> "> | AP89: 88 | AQ89: of:=[.AQ$2] -> .  | AR89: prevent-log.txt | AS89: of:=[.AS$2] -> </A>
A90: of:=[.A$2] -> <DT><A LAST_CHARSET="UTF-8" HREF="https://www.drupal.org/node/add/project-issue/ | B90: of:=[.B$2] -> user_guide | C90: of:=[.C$2] -> ?categories= | D90: of:=[.D$2] -> 2 | E90: of:=[.E$2] -> &component= | F90: of:=[.F$2] -> HU translation | G90: of:=[.G$2] -> &version= | H90: of:=[.H$2] -> 8.x-2.x-dev | I90: of:=[.I$2] -> &title=[ | J90: of:=[.J$2] -> HU | K90: of:=[.K$2] -> ]%20 | L90: of:=[.L$2] -> Forrásfájl lefordítása magyarra: | M90: of:=[.M$2] -> %20 | N90: prevent-status.txt | O90: of:=[.O$2] -> &body= | P90: of:=[.P$2] -> Az alábbi fejezet lefordítása angolról magyarra | Q90: of:=[.Q$2] -> %3A%0A-  | R90: of:=[.R$2] -> Téma | S90: of:=[.S$2] -> %3A%20 | T90: Concept: Status report | U90: of:=[.U$2] -> %20( | V90: of:=[.V$2] -> angolul | W90: of:=[.W$2] -> %3A%20 | X90: Concept: Status report | Y90: of:=[.Y$2] -> )%0A-%20 | Z90: of:=[.Z$2] -> Fejezet | AA90: of:=[.AA$2] -> %3A%20 | AB90: Preventing and Fixing Problems | AC90: of:=[.AC$2] -> %20( | AD90: of:=[.AD$2] -> angolul | AE90: of:=[.AE$2] -> %3A%20 | AF90: Preventing and Fixing Problems | AG90: of:=[.AG$2] -> )%0A-%20 | AH90: of:=[.AH$2] -> Fájlnév | AI90: of:=[.AI$2] -> %3A%20 | AJ90: prevent-status.txt | AK90: of:=[.AK$2] -> %0A%0A | AL90: of:=[.AL$2] -> Minden szükséges tudnivalót ebben a leírásban találsz | AM90: of:=[.AM$2] -> %3A%20 | AN90: of:=[.AN$2] -> https://userguide_new-drupal.dev.devdrupal.org/guidelines/instructions.html#practicalities-translating | AO90: of:=[.AO$2] -> "> | AP90: 89 | AQ90: of:=[.AQ$2] -> .  | AR90: prevent-status.txt | AS90: of:=[.AS$2] -> </A>
A91: of:=[.A$2] -> <DT><A LAST_CHARSET="UTF-8" HREF="https://www.drupal.org/node/add/project-issue/ | B91: of:=[.B$2] -> user_guide | C91: of:=[.C$2] -> ?categories= | D91: of:=[.D$2] -> 2 | E91: of:=[.E$2] -> &component= | F91: of:=[.F$2] -> HU translation | G91: of:=[.G$2] -> &version= | H91: of:=[.H$2] -> 8.x-2.x-dev | I91: of:=[.I$2] -> &title=[ | J91: of:=[.J$2] -> HU | K91: of:=[.K$2] -> ]%20 | L91: of:=[.L$2] -> Forrásfájl lefordítása magyarra: | M91: of:=[.M$2] -> %20 | N91: security-cron-concept.txt | O91: of:=[.O$2] -> &body= | P91: of:=[.P$2] -> Az alábbi fejezet lefordítása angolról magyarra | Q91: of:=[.Q$2] -> %3A%0A-  | R91: of:=[.R$2] -> Téma | S91: of:=[.S$2] -> %3A%20 | T91: Concept: Cron | U91: of:=[.U$2] -> %20( | V91: of:=[.V$2] -> angolul | W91: of:=[.W$2] -> %3A%20 | X91: Concept: Cron | Y91: of:=[.Y$2] -> )%0A-%20 | Z91: of:=[.Z$2] -> Fejezet | AA91: of:=[.AA$2] -> %3A%20 | AB91: Security and Maintenance | AC91: of:=[.AC$2] -> %20( | AD91: of:=[.AD$2] -> angolul | AE91: of:=[.AE$2] -> %3A%20 | AF91: Security and Maintenance | AG91: of:=[.AG$2] -> )%0A-%20 | AH91: of:=[.AH$2] -> Fájlnév | AI91: of:=[.AI$2] -> %3A%20 | AJ91: security-cron-concept.txt | AK91: of:=[.AK$2] -> %0A%0A | AL91: of:=[.AL$2] -> Minden szükséges tudnivalót ebben a leírásban találsz | AM91: of:=[.AM$2] -> %3A%20 | AN91: of:=[.AN$2] -> https://userguide_new-drupal.dev.devdrupal.org/guidelines/instructions.html#practicalities-translating | AO91: of:=[.AO$2] -> "> | AP91: 90 | AQ91: of:=[.AQ$2] -> .  | AR91: security-cron-concept.txt | AS91: of:=[.AS$2] -> </A>
A92: of:=[.A$2] -> <DT><A LAST_CHARSET="UTF-8" HREF="https://www.drupal.org/node/add/project-issue/ | B92: of:=[.B$2] -> user_guide | C92: of:=[.C$2] -> ?categories= | D92: of:=[.D$2] -> 2 | E92: of:=[.E$2] -> &component= | F92: of:=[.F$2] -> HU translation | G92: of:=[.G$2] -> &version= | H92: of:=[.H$2] -> 8.x-2.x-dev | I92: of:=[.I$2] -> &title=[ | J92: of:=[.J$2] -> HU | K92: of:=[.K$2] -> ]%20 | L92: of:=[.L$2] -> Forrásfájl lefordítása magyarra: | M92: of:=[.M$2] -> %20 | N92: security-cron.txt | O92: of:=[.O$2] -> &body= | P92: of:=[.P$2] -> Az alábbi fejezet lefordítása angolról magyarra | Q92: of:=[.Q$2] -> %3A%0A-  | R92: of:=[.R$2] -> Téma | S92: of:=[.S$2] -> %3A%20 | T92: Configuring Cron Maintenance Tasks | U92: of:=[.U$2] -> %20( | V92: of:=[.V$2] -> angolul | W92: of:=[.W$2] -> %3A%20 | X92: Configuring Cron Maintenance Tasks | Y92: of:=[.Y$2] -> )%0A-%20 | Z92: of:=[.Z$2] -> Fejezet | AA92: of:=[.AA$2] -> %3A%20 | AB92: Security and Maintenance | AC92: of:=[.AC$2] -> %20( | AD92: of:=[.AD$2] -> angolul | AE92: of:=[.AE$2] -> %3A%20 | AF92: Security and Maintenance | AG92: of:=[.AG$2] -> )%0A-%20 | AH92: of:=[.AH$2] -> Fájlnév | AI92: of:=[.AI$2] -> %3A%20 | AJ92: security-cron.txt | AK92: of:=[.AK$2] -> %0A%0A | AL92: of:=[.AL$2] -> Minden szükséges tudnivalót ebben a leírásban találsz | AM92: of:=[.AM$2] -> %3A%20 | AN92: of:=[.AN$2] -> https://userguide_new-drupal.dev.devdrupal.org/guidelines/instructions.html#practicalities-translating | AO92: of:=[.AO$2] -> "> | AP92: 91 | AQ92: of:=[.AQ$2] -> .  | AR92: security-cron.txt | AS92: of:=[.AS$2] -> </A>
A93: of:=[.A$2] -> <DT><A LAST_CHARSET="UTF-8" HREF="https://www.drupal.org/node/add/project-issue/ | B93: of:=[.B$2] -> user_guide | C93: of:=[.C$2] -> ?categories= | D93: of:=[.D$2] -> 2 | E93: of:=[.E$2] -> &component= | F93: of:=[.F$2] -> HU translation | G93: of:=[.G$2] -> &version= | H93: of:=[.H$2] -> 8.x-2.x-dev | I93: of:=[.I$2] -> &title=[ | J93: of:=[.J$2] -> HU | K93: of:=[.K$2] -> ]%20 | L93: of:=[.L$2] -> Forrásfájl lefordítása magyarra: | M93: of:=[.M$2] -> %20 | N93: security-concept.txt | O93: of:=[.O$2] -> &body= | P93: of:=[.P$2] -> Az alábbi fejezet lefordítása angolról magyarra | Q93: of:=[.Q$2] -> %3A%0A-  | R93: of:=[.R$2] -> Téma | S93: of:=[.S$2] -> %3A%20 | T93: Concept: Security and Regular Updates | U93: of:=[.U$2] -> %20( | V93: of:=[.V$2] -> angolul | W93: of:=[.W$2] -> %3A%20 | X93: Concept: Security and Regular Updates | Y93: of:=[.Y$2] -> )%0A-%20 | Z93: of:=[.Z$2] -> Fejezet | AA93: of:=[.AA$2] -> %3A%20 | AB93: Security and Maintenance | AC93: of:=[.AC$2] -> %20( | AD93: of:=[.AD$2] -> angolul | AE93: of:=[.AE$2] -> %3A%20 | AF93: Security and Maintenance | AG93: of:=[.AG$2] -> )%0A-%20 | AH93: of:=[.AH$2] -> Fájlnév | AI93: of:=[.AI$2] -> %3A%20 | AJ93: security-concept.txt | AK93: of:=[.AK$2] -> %0A%0A | AL93: of:=[.AL$2] -> Minden szükséges tudnivalót ebben a leírásban találsz | AM93: of:=[.AM$2] -> %3A%20 | AN93: of:=[.AN$2] -> https://userguide_new-drupal.dev.devdrupal.org/guidelines/instructions.html#practicalities-translating | AO93: of:=[.AO$2] -> "> | AP93: 92 | AQ93: of:=[.AQ$2] -> .  | AR93: security-concept.txt | AS93: of:=[.AS$2] -> </A>
A94: of:=[.A$2] -> <DT><A LAST_CHARSET="UTF-8" HREF="https://www.drupal.org/node/add/project-issue/ | B94: of:=[.B$2] -> user_guide | C94: of:=[.C$2] -> ?categories= | D94: of:=[.D$2] -> 2 | E94: of:=[.E$2] -> &component= | F94: of:=[.F$2] -> HU translation | G94: of:=[.G$2] -> &version= | H94: of:=[.H$2] -> 8.x-2.x-dev | I94: of:=[.I$2] -> &title=[ | J94: of:=[.J$2] -> HU | K94: of:=[.K$2] -> ]%20 | L94: of:=[.L$2] -> Forrásfájl lefordítása magyarra: | M94: of:=[.M$2] -> %20 | N94: security-announce.txt | O94: of:=[.O$2] -> &body= | P94: of:=[.P$2] -> Az alábbi fejezet lefordítása angolról magyarra | Q94: of:=[.Q$2] -> %3A%0A-  | R94: of:=[.R$2] -> Téma | S94: of:=[.S$2] -> %3A%20 | T94: Keeping Track of Updates | U94: of:=[.U$2] -> %20( | V94: of:=[.V$2] -> angolul | W94: of:=[.W$2] -> %3A%20 | X94: Keeping Track of Updates | Y94: of:=[.Y$2] -> )%0A-%20 | Z94: of:=[.Z$2] -> Fejezet | AA94: of:=[.AA$2] -> %3A%20 | AB94: Security and Maintenance | AC94: of:=[.AC$2] -> %20( | AD94: of:=[.AD$2] -> angolul | AE94: of:=[.AE$2] -> %3A%20 | AF94: Security and Maintenance | AG94: of:=[.AG$2] -> )%0A-%20 | AH94: of:=[.AH$2] -> Fájlnév | AI94: of:=[.AI$2] -> %3A%20 | AJ94: security-announce.txt | AK94: of:=[.AK$2] -> %0A%0A | AL94: of:=[.AL$2] -> Minden szükséges tudnivalót ebben a leírásban találsz | AM94: of:=[.AM$2] -> %3A%20 | AN94: of:=[.AN$2] -> https://userguide_new-drupal.dev.devdrupal.org/guidelines/instructions.html#practicalities-translating | AO94: of:=[.AO$2] -> "> | AP94: 93 | AQ94: of:=[.AQ$2] -> .  | AR94: security-announce.txt | AS94: of:=[.AS$2] -> </A>
A95: of:=[.A$2] -> <DT><A LAST_CHARSET="UTF-8" HREF="https://www.drupal.org/node/add/project-issue/ | B95: of:=[.B$2] -> user_guide | C95: of:=[.C$2] -> ?categories= | D95: of:=[.D$2] -> 2 | E95: of:=[.E$2] -> &component= | F95: of:=[.F$2] -> HU translation | G95: of:=[.G$2] -> &version= | H95: of:=[.H$2] -> 8.x-2.x-dev | I95: of:=[.I$2] -> &title=[ | J95: of:=[.J$2] -> HU | K95: of:=[.K$2] -> ]%20 | L95: of:=[.L$2] -> Forrásfájl lefordítása magyarra: | M95: of:=[.M$2] -> %20 | N95: security-update-core.txt | O95: of:=[.O$2] -> &body= | P95: of:=[.P$2] -> Az alábbi fejezet lefordítása angolról magyarra | Q95: of:=[.Q$2] -> %3A%0A-  | R95: of:=[.R$2] -> Téma | S95: of:=[.S$2] -> %3A%20 | T95: Updating the Core Software | U95: of:=[.U$2] -> %20( | V95: of:=[.V$2] -> angolul | W95: of:=[.W$2] -> %3A%20 | X95: Updating the Core Software | Y95: of:=[.Y$2] -> )%0A-%20 | Z95: of:=[.Z$2] -> Fejezet | AA95: of:=[.AA$2] -> %3A%20 | AB95: Security and Maintenance | AC95: of:=[.AC$2] -> %20( | AD95: of:=[.AD$2] -> angolul | AE95: of:=[.AE$2] -> %3A%20 | AF95: Security and Maintenance | AG95: of:=[.AG$2] -> )%0A-%20 | AH95: of:=[.AH$2] -> Fájlnév | AI95: of:=[.AI$2] -> %3A%20 | AJ95: security-update-core.txt | AK95: of:=[.AK$2] -> %0A%0A | AL95: of:=[.AL$2] -> Minden szükséges tudnivalót ebben a leírásban találsz | AM95: of:=[.AM$2] -> %3A%20 | AN95: of:=[.AN$2] -> https://userguide_new-drupal.dev.devdrupal.org/guidelines/instructions.html#practicalities-translating | AO95: of:=[.AO$2] -> "> | AP95: 94 | AQ95: of:=[.AQ$2] -> .  | AR95: security-update-core.txt | AS95: of:=[.AS$2] -> </A>
A96: of:=[.A$2] -> <DT><A LAST_CHARSET="UTF-8" HREF="https://www.drupal.org/node/add/project-issue/ | B96: of:=[.B$2] -> user_guide | C96: of:=[.C$2] -> ?categories= | D96: of:=[.D$2] -> 2 | E96: of:=[.E$2] -> &component= | F96: of:=[.F$2] -> HU translation | G96: of:=[.G$2] -> &version= | H96: of:=[.H$2] -> 8.x-2.x-dev | I96: of:=[.I$2] -> &title=[ | J96: of:=[.J$2] -> HU | K96: of:=[.K$2] -> ]%20 | L96: of:=[.L$2] -> Forrásfájl lefordítása magyarra: | M96: of:=[.M$2] -> %20 | N96: security-update-module.txt | O96: of:=[.O$2] -> &body= | P96: of:=[.P$2] -> Az alábbi fejezet lefordítása angolról magyarra | Q96: of:=[.Q$2] -> %3A%0A-  | R96: of:=[.R$2] -> Téma | S96: of:=[.S$2] -> %3A%20 | T96: Updating a Module | U96: of:=[.U$2] -> %20( | V96: of:=[.V$2] -> angolul | W96: of:=[.W$2] -> %3A%20 | X96: Updating a Module | Y96: of:=[.Y$2] -> )%0A-%20 | Z96: of:=[.Z$2] -> Fejezet | AA96: of:=[.AA$2] -> %3A%20 | AB96: Security and Maintenance | AC96: of:=[.AC$2] -> %20( | AD96: of:=[.AD$2] -> angolul | AE96: of:=[.AE$2] -> %3A%20 | AF96: Security and Maintenance | AG96: of:=[.AG$2] -> )%0A-%20 | AH96: of:=[.AH$2] -> Fájlnév | AI96: of:=[.AI$2] -> %3A%20 | AJ96: security-update-module.txt | AK96: of:=[.AK$2] -> %0A%0A | AL96: of:=[.AL$2] -> Minden szükséges tudnivalót ebben a leírásban találsz | AM96: of:=[.AM$2] -> %3A%20 | AN96: of:=[.AN$2] -> https://userguide_new-drupal.dev.devdrupal.org/guidelines/instructions.html#practicalities-translating | AO96: of:=[.AO$2] -> "> | AP96: 95 | AQ96: of:=[.AQ$2] -> .  | AR96: security-update-module.txt | AS96: of:=[.AS$2] -> </A>
A97: of:=[.A$2] -> <DT><A LAST_CHARSET="UTF-8" HREF="https://www.drupal.org/node/add/project-issue/ | B97: of:=[.B$2] -> user_guide | C97: of:=[.C$2] -> ?categories= | D97: of:=[.D$2] -> 2 | E97: of:=[.E$2] -> &component= | F97: of:=[.F$2] -> HU translation | G97: of:=[.G$2] -> &version= | H97: of:=[.H$2] -> 8.x-2.x-dev | I97: of:=[.I$2] -> &title=[ | J97: of:=[.J$2] -> HU | K97: of:=[.K$2] -> ]%20 | L97: of:=[.L$2] -> Forrásfájl lefordítása magyarra: | M97: of:=[.M$2] -> %20 | N97: security-update-theme.txt | O97: of:=[.O$2] -> &body= | P97: of:=[.P$2] -> Az alábbi fejezet lefordítása angolról magyarra | Q97: of:=[.Q$2] -> %3A%0A-  | R97: of:=[.R$2] -> Téma | S97: of:=[.S$2] -> %3A%20 | T97: Updating a Theme | U97: of:=[.U$2] -> %20( | V97: of:=[.V$2] -> angolul | W97: of:=[.W$2] -> %3A%20 | X97: Updating a Theme | Y97: of:=[.Y$2] -> )%0A-%20 | Z97: of:=[.Z$2] -> Fejezet | AA97: of:=[.AA$2] -> %3A%20 | AB97: Security and Maintenance | AC97: of:=[.AC$2] -> %20( | AD97: of:=[.AD$2] -> angolul | AE97: of:=[.AE$2] -> %3A%20 | AF97: Security and Maintenance | AG97: of:=[.AG$2] -> )%0A-%20 | AH97: of:=[.AH$2] -> Fájlnév | AI97: of:=[.AI$2] -> %3A%20 | AJ97: security-update-theme.txt | AK97: of:=[.AK$2] -> %0A%0A | AL97: of:=[.AL$2] -> Minden szükséges tudnivalót ebben a leírásban találsz | AM97: of:=[.AM$2] -> %3A%20 | AN97: of:=[.AN$2] -> https://userguide_new-drupal.dev.devdrupal.org/guidelines/instructions.html#practicalities-translating | AO97: of:=[.AO$2] -> "> | AP97: 96 | AQ97: of:=[.AQ$2] -> .  | AR97: security-update-theme.txt | AS97: of:=[.AS$2] -> </A>
A98: of:=[.A$2] -> <DT><A LAST_CHARSET="UTF-8" HREF="https://www.drupal.org/node/add/project-issue/ | B98: of:=[.B$2] -> user_guide | C98: of:=[.C$2] -> ?categories= | D98: of:=[.D$2] -> 2 | E98: of:=[.E$2] -> &component= | F98: of:=[.F$2] -> HU translation | G98: of:=[.G$2] -> &version= | H98: of:=[.H$2] -> 8.x-2.x-dev | I98: of:=[.I$2] -> &title=[ | J98: of:=[.J$2] -> HU | K98: of:=[.K$2] -> ]%20 | L98: of:=[.L$2] -> Forrásfájl lefordítása magyarra: | M98: of:=[.M$2] -> %20 | N98: thoughts-connecting.txt | O98: of:=[.O$2] -> &body= | P98: of:=[.P$2] -> Az alábbi fejezet lefordítása angolról magyarra | Q98: of:=[.Q$2] -> %3A%0A-  | R98: of:=[.R$2] -> Téma | S98: of:=[.S$2] -> %3A%20 | T98: Connecting with the Community | U98: of:=[.U$2] -> %20( | V98: of:=[.V$2] -> angolul | W98: of:=[.W$2] -> %3A%20 | X98: Connecting with the Community | Y98: of:=[.Y$2] -> )%0A-%20 | Z98: of:=[.Z$2] -> Fejezet | AA98: of:=[.AA$2] -> %3A%20 | AB98: Final Thoughts | AC98: of:=[.AC$2] -> %20( | AD98: of:=[.AD$2] -> angolul | AE98: of:=[.AE$2] -> %3A%20 | AF98: Final Thoughts | AG98: of:=[.AG$2] -> )%0A-%20 | AH98: of:=[.AH$2] -> Fájlnév | AI98: of:=[.AI$2] -> %3A%20 | AJ98: thoughts-connecting.txt | AK98: of:=[.AK$2] -> %0A%0A | AL98: of:=[.AL$2] -> Minden szükséges tudnivalót ebben a leírásban találsz | AM98: of:=[.AM$2] -> %3A%20 | AN98: of:=[.AN$2] -> https://userguide_new-drupal.dev.devdrupal.org/guidelines/instructions.html#practicalities-translating | AO98: of:=[.AO$2] -> "> | AP98: 97 | AQ98: of:=[.AQ$2] -> .  | AR98: thoughts-connecting.txt | AS98: of:=[.AS$2] -> </A>
A99: of:=[.A$2] -> <DT><A LAST_CHARSET="UTF-8" HREF="https://www.drupal.org/node/add/project-issue/ | B99: of:=[.B$2] -> user_guide | C99: of:=[.C$2] -> ?categories= | D99: of:=[.D$2] -> 2 | E99: of:=[.E$2] -> &component= | F99: of:=[.F$2] -> HU translation | G99: of:=[.G$2] -> &version= | H99: of:=[.H$2] -> 8.x-2.x-dev | I99: of:=[.I$2] -> &title=[ | J99: of:=[.J$2] -> HU | K99: of:=[.K$2] -> ]%20 | L99: of:=[.L$2] -> Forrásfájl lefordítása magyarra: | M99: of:=[.M$2] -> %20 | N99: thoughts-support.txt | O99: of:=[.O$2] -> &body= | P99: of:=[.P$2] -> Az alábbi fejezet lefordítása angolról magyarra | Q99: of:=[.Q$2] -> %3A%0A-  | R99: of:=[.R$2] -> Téma | S99: of:=[.S$2] -> %3A%20 | T99: Getting Support | U99: of:=[.U$2] -> %20( | V99: of:=[.V$2] -> angolul | W99: of:=[.W$2] -> %3A%20 | X99: Getting Support | Y99: of:=[.Y$2] -> )%0A-%20 | Z99: of:=[.Z$2] -> Fejezet | AA99: of:=[.AA$2] -> %3A%20 | AB99: Final Thoughts | AC99: of:=[.AC$2] -> %20( | AD99: of:=[.AD$2] -> angolul | AE99: of:=[.AE$2] -> %3A%20 | AF99: Final Thoughts | AG99: of:=[.AG$2] -> )%0A-%20 | AH99: of:=[.AH$2] -> Fájlnév | AI99: of:=[.AI$2] -> %3A%20 | AJ99: thoughts-support.txt | AK99: of:=[.AK$2] -> %0A%0A | AL99: of:=[.AL$2] -> Minden szükséges tudnivalót ebben a leírásban találsz | AM99: of:=[.AM$2] -> %3A%20 | AN99: of:=[.AN$2] -> https://userguide_new-drupal.dev.devdrupal.org/guidelines/instructions.html#practicalities-translating | AO99: of:=[.AO$2] -> "> | AP99: 98 | AQ99: of:=[.AQ$2] -> .  | AR99: thoughts-support.txt | AS99: of:=[.AS$2] -> </A>
A100: of:=[.A$2] -> <DT><A LAST_CHARSET="UTF-8" HREF="https://www.drupal.org/node/add/project-issue/ | B100: of:=[.B$2] -> user_guide | C100: of:=[.C$2] -> ?categories= | D100: of:=[.D$2] -> 2 | E100: of:=[.E$2] -> &component= | F100: of:=[.F$2] -> HU translation | G100: of:=[.G$2] -> &version= | H100: of:=[.H$2] -> 8.x-2.x-dev | I100: of:=[.I$2] -> &title=[ | J100: of:=[.J$2] -> HU | K100: of:=[.K$2] -> ]%20 | L100: of:=[.L$2] -> Forrásfájl lefordítása magyarra: | M100: of:=[.M$2] -> %20 | N100: thoughts-learn-more.txt | O100: of:=[.O$2] -> &body= | P100: of:=[.P$2] -> Az alábbi fejezet lefordítása angolról magyarra | Q100: of:=[.Q$2] -> %3A%0A-  | R100: of:=[.R$2] -> Téma | S100: of:=[.S$2] -> %3A%20 | T100: Learning More | U100: of:=[.U$2] -> %20( | V100: of:=[.V$2] -> angolul | W100: of:=[.W$2] -> %3A%20 | X100: Learning More | Y100: of:=[.Y$2] -> )%0A-%20 | Z100: of:=[.Z$2] -> Fejezet | AA100: of:=[.AA$2] -> %3A%20 | AB100: Final Thoughts | AC100: of:=[.AC$2] -> %20( | AD100: of:=[.AD$2] -> angolul | AE100: of:=[.AE$2] -> %3A%20 | AF100: Final Thoughts | AG100: of:=[.AG$2] -> )%0A-%20 | AH100: of:=[.AH$2] -> Fájlnév | AI100: of:=[.AI$2] -> %3A%20 | AJ100: thoughts-learn-more.txt | AK100: of:=[.AK$2] -> %0A%0A | AL100: of:=[.AL$2] -> Minden szükséges tudnivalót ebben a leírásban találsz | AM100: of:=[.AM$2] -> %3A%20 | AN100: of:=[.AN$2] -> https://userguide_new-drupal.dev.devdrupal.org/guidelines/instructions.html#practicalities-translating | AO100: of:=[.AO$2] -> "> | AP100: 99 | AQ100: of:=[.AQ$2] -> .  | AR100: thoughts-learn-more.txt | AS100: of:=[.AS$2] -> </A>
A101: of:=[.A$2] -> <DT><A LAST_CHARSET="UTF-8" HREF="https://www.drupal.org/node/add/project-issue/ | B101: of:=[.B$2] -> user_guide | C101: of:=[.C$2] -> ?categories= | D101: of:=[.D$2] -> 2 | E101: of:=[.E$2] -> &component= | F101: of:=[.F$2] -> HU translation | G101: of:=[.G$2] -> &version= | H101: of:=[.H$2] -> 8.x-2.x-dev | I101: of:=[.I$2] -> &title=[ | J101: of:=[.J$2] -> HU | K101: of:=[.K$2] -> ]%20 | L101: of:=[.L$2] -> Forrásfájl lefordítása magyarra: | M101: of:=[.M$2] -> %20 | N101: glossary.txt | O101: of:=[.O$2] -> &body= | P101: of:=[.P$2] -> Az alábbi fejezet lefordítása angolról magyarra | Q101: of:=[.Q$2] -> %3A%0A-  | R101: of:=[.R$2] -> Téma | S101: of:=[.S$2] -> %3A%20 | T101: Glossary | U101: of:=[.U$2] -> %20( | V101: of:=[.V$2] -> angolul | W101: of:=[.W$2] -> %3A%20 | X101: Glossary | Y101: of:=[.Y$2] -> )%0A-%20 | Z101: of:=[.Z$2] -> Fejezet | AA101: of:=[.AA$2] -> %3A%20 | AB101: Glossary | AC101: of:=[.AC$2] -> %20( | AD101: of:=[.AD$2] -> angolul | AE101: of:=[.AE$2] -> %3A%20 | AF101: Glossary | AG101: of:=[.AG$2] -> )%0A-%20 | AH101: of:=[.AH$2] -> Fájlnév | AI101: of:=[.AI$2] -> %3A%20 | AJ101: glossary.txt | AK101: of:=[.AK$2] -> %0A%0A | AL101: of:=[.AL$2] -> Minden szükséges tudnivalót ebben a leírásban találsz | AM101: of:=[.AM$2] -> %3A%20 | AN101: of:=[.AN$2] -> https://userguide_new-drupal.dev.devdrupal.org/guidelines/instructions.html#practicalities-translating | AO101: of:=[.AO$2] -> "> | AP101: 100 | AQ101: of:=[.AQ$2] -> .  | AR101: glossary.txt | AS101: of:=[.AS$2] -> </A>
A102: of:=[.A$2] -> <DT><A LAST_CHARSET="UTF-8" HREF="https://www.drupal.org/node/add/project-issue/ | B102: of:=[.B$2] -> user_guide | C102: of:=[.C$2] -> ?categories= | D102: of:=[.D$2] -> 2 | E102: of:=[.E$2] -> &component= | F102: of:=[.F$2] -> HU translation | G102: of:=[.G$2] -> &version= | H102: of:=[.H$2] -> 8.x-2.x-dev | I102: of:=[.I$2] -> &title=[ | J102: of:=[.J$2] -> HU | K102: of:=[.K$2] -> ]%20 | L102: of:=[.L$2] -> Forrásfájl lefordítása magyarra: | M102: of:=[.M$2] -> %20 | N102: attributions.txt | O102: of:=[.O$2] -> &body= | P102: of:=[.P$2] -> Az alábbi fejezet lefordítása angolról magyarra | Q102: of:=[.Q$2] -> %3A%0A-  | R102: of:=[.R$2] -> Téma | S102: of:=[.S$2] -> %3A%20 | T102: Guide-Wide Attributions | U102: of:=[.U$2] -> %20( | V102: of:=[.V$2] -> angolul | W102: of:=[.W$2] -> %3A%20 | X102: Guide-Wide Attributions | Y102: of:=[.Y$2] -> )%0A-%20 | Z102: of:=[.Z$2] -> Fejezet | AA102: of:=[.AA$2] -> %3A%20 | AB102: Appendix | AC102: of:=[.AC$2] -> %20( | AD102: of:=[.AD$2] -> angolul | AE102: of:=[.AE$2] -> %3A%20 | AF102: Appendix | AG102: of:=[.AG$2] -> )%0A-%20 | AH102: of:=[.AH$2] -> Fájlnév | AI102: of:=[.AI$2] -> %3A%20 | AJ102: attributions.txt | AK102: of:=[.AK$2] -> %0A%0A | AL102: of:=[.AL$2] -> Minden szükséges tudnivalót ebben a leírásban találsz | AM102: of:=[.AM$2] -> %3A%20 | AN102: of:=[.AN$2] -> https://userguide_new-drupal.dev.devdrupal.org/guidelines/instructions.html#practicalities-translating | AO102: of:=[.AO$2] -> "> | AP102: 101 | AQ102: of:=[.AQ$2] -> .  | AR102: attributions.txt | AS102: of:=[.AS$2] -> </A>
A103: <DD> </DL><p> </DL>